gallery/logs_schedule/multi-resnet_18/resnet_18-B1.json
{"i": [["[\"1097323f3970e5c881ad3a0028ca79cb\", [1, 14, 14, 256], [4, 4, 256, 256], [1, 1, 1, 256], [1, 14, 14, 256]]", "cuda -keys=cuda,gpu -arch=sm_86 -max_num_threads=1024 -thread_warp_size=32", [-1, 16, 64, 49152, 2147483647, 1024, 8, 32], "", 0, []], [[], [["CI", 11], ["CI", 9], ["AN", 8, 0, 1], ["AN", 8, 1, 1], ["SP", 8, 2, 49, [49], 1], ["SP", 8, 4, 256, [1], 1], ["AN", 8, 6, 1], ["AN", 8, 7, 1], ["RE", 8, [2, 4, 3, 5, 0, 1, 6, 7]], ["CI", 7], ["CHW", 6, "local"], ["SP", 6, 0, 4, [2, 2, 1, 1], 1], ["SP", 6, 5, 4, [1, 4, 1, 1], 1], ["SP", 6, 10, 49, [1, 1, 1, 7], 1], ["SP", 6, 15, 256, [1, 4, 1, 1], 1], ["SP", 6, 20, 256, [8, 1], 1], ["RE", 6, [0, 5, 10, 15, 1, 6, 11, 16, 2, 7, 12, 17, 20, 21, 3, 8, 13, 18, 22, 4, 9, 14, 19]], ["FSP", 7, 0, 11, 3], ["FSP", 7, 4, 12, 3], ["FSP", 7, 8, 13, 3], ["FSP", 7, 12, 14, 3], ["RE", 7, [0, 4, 8, 12, 1, 5, 9, 13, 2, 6, 10, 14, 3, 7, 11, 15]], ["CA", 6, 7, 11], ["CHR", 5, "shared", [6]], ["CA", 6, 7, 12], ["CHR", 4, "shared", [7]], ["CA", 5, 8, 12], ["AN", 4, 0, 1], ["AN", 4, 1, 1], ["SP", 4, 2, 49, [7], 1], ["SP", 4, 4, 256, [1], 1], ["AN", 4, 6, 1], ["AN", 4, 7, 1], ["RE", 4, [2, 4, 3, 5, 0, 1, 6, 7]], ["CI", 3], ["CA", 2, 4, 3], ["CI", 1], ["FU", 15, [0, 1, 2, 3]], ["SP", 15, 0, 50176, [32], 1], ["AN", 15, 0, 5], ["AN", 15, 1, 6], ["FU", 11, [0, 1, 2, 3]], ["SP", 11, 0, 12544, [32], 1], ["AN", 11, 0, 5], ["AN", 11, 1, 6], ["FU", 9, [0, 1, 2, 3]], ["AN", 9, 0, 5], ["FU", 9, [1, 2, 3, 4]], ["AN", 9, 1, 4], ["FU", 9, [2, 3, 4, 5]], ["AN", 9, 2, 6], ["FU", 7, [0, 1, 2, 3]], ["SP", 7, 0, 16, [1], 1], ["AN", 7, 1, 2], ["FFSP", 7, 0, [14, 13, 12, 11], 1, 1], ["AN", 7, 1, 6], ["FU", 5, [0, 1, 2, 3]], ["SP", 5, 0, 112, [1], 1], ["AN", 5, 1, 2], ["FFSP", 5, 0, [14, 13, 12, 11], 1, 1], ["AN", 5, 1, 6], ["FU", 4, [0, 1, 2, 3]], ["SP", 4, 0, 12544, [32], 1], ["AN", 4, 0, 5], ["AN", 4, 1, 6], ["PR", 4, 0, "auto_unroll_max_step$16"], ["PR", 8, 0, "auto_unroll_max_step$16"], ["PR", 11, 0, "auto_unroll_max_step$512"]]]], "r": [[7.05548e-05], 0, 1.51263, 1756339951], "v": "v0.6"}
{"i": [["[\"1097323f3970e5c881ad3a0028ca79cb\", [1, 14, 14, 256], [4, 4, 256, 256], [1, 1, 1, 256], [1, 14, 14, 256]]", "cuda -keys=cuda,gpu -arch=sm_86 -max_num_threads=1024 -thread_warp_size=32", [-1, 16, 64, 49152, 2147483647, 1024, 8, 32], "", 0, []], [[], [["CI", 11], ["CI", 9], ["AN", 8, 0, 1], ["AN", 8, 1, 1], ["SP", 8, 2, 49, [1], 1], ["SP", 8, 4, 256, [1], 1], ["AN", 8, 6, 1], ["AN", 8, 7, 1], ["RE", 8, [2, 4, 3, 5, 0, 1, 6, 7]], ["CI", 7], ["CHW", 6, "local"], ["SP", 6, 0, 4, [1, 1, 2, 1], 1], ["SP", 6, 5, 4, [1, 2, 1, 2], 1], ["SP", 6, 10, 49, [1, 7, 1, 7], 1], ["SP", 6, 15, 256, [2, 16, 1, 8], 1], ["SP", 6, 20, 256, [2, 2], 1], ["RE", 6, [0, 5, 10, 15, 1, 6, 11, 16, 2, 7, 12, 17, 20, 21, 3, 8, 13, 18, 22, 4, 9, 14, 19]], ["FSP", 7, 0, 11, 3], ["FSP", 7, 4, 12, 3], ["FSP", 7, 8, 13, 3], ["FSP", 7, 12, 14, 3], ["RE", 7, [0, 4, 8, 12, 1, 5, 9, 13, 2, 6, 10, 14, 3, 7, 11, 15]], ["CA", 6, 7, 11], ["CHR", 5, "shared", [6]], ["CA", 6, 7, 12], ["CHR", 4, "shared", [7]], ["CA", 5, 8, 12], ["AN", 4, 0, 1], ["AN", 4, 1, 1], ["SP", 4, 2, 49, [49], 1], ["SP", 4, 4, 256, [1], 1], ["AN", 4, 6, 1], ["AN", 4, 7, 1], ["RE", 4, [2, 4, 3, 5, 0, 1, 6, 7]], ["CI", 3], ["CA", 2, 4, 3], ["CI", 1], ["FU", 15, [0, 1, 2, 3]], ["SP", 15, 0, 50176, [32], 1], ["AN", 15, 0, 5], ["AN", 15, 1, 6], ["FU", 11, [0, 1, 2, 3]], ["SP", 11, 0, 12544, [32], 1], ["AN", 11, 0, 5], ["AN", 11, 1, 6], ["FU", 9, [0, 1, 2, 3]], ["AN", 9, 0, 5], ["FU", 9, [1, 2, 3, 4]], ["AN", 9, 1, 4], ["FU", 9, [2, 3, 4, 5]], ["AN", 9, 2, 6], ["FU", 7, [0, 1, 2, 3]], ["SP", 7, 0, 128, [1], 1], ["AN", 7, 1, 2], ["FFSP", 7, 0, [14, 13, 12, 11], 1, 1], ["AN", 7, 1, 6], ["FU", 5, [0, 1, 2, 3]], ["SP", 5, 0, 112, [1], 1], ["AN", 5, 1, 2], ["FFSP", 5, 0, [14, 13, 12, 11], 1, 1], ["AN", 5, 1, 6], ["FU", 4, [0, 1, 2, 3]], ["SP", 4, 0, 12544, [32], 1], ["AN", 4, 0, 5], ["AN", 4, 1, 6], ["PR", 4, 0, "auto_unroll_max_step$16"], ["PR", 8, 0, "auto_unroll_max_step$16"], ["PR", 11, 0, "auto_unroll_max_step$0"]]]], "r": [[0.00212328], 0, 1.82968, 1756339952], "v": "v0.6"}
{"i": [["[\"1097323f3970e5c881ad3a0028ca79cb\", [1, 14, 14, 256], [4, 4, 256, 256], [1, 1, 1, 256], [1, 14, 14, 256]]", "cuda -keys=cuda,gpu -arch=sm_86 -max_num_threads=1024 -thread_warp_size=32", [-1, 16, 64, 49152, 2147483647, 1024, 8, 32], "", 0, []], [[], [["CI", 11], ["CI", 9], ["AN", 8, 0, 1], ["AN", 8, 1, 1], ["SP", 8, 2, 49, [7], 1], ["SP", 8, 4, 256, [4], 1], ["AN", 8, 6, 1], ["AN", 8, 7, 1], ["RE", 8, [2, 4, 3, 5, 0, 1, 6, 7]], ["CI", 7], ["CHW", 6, "local"], ["SP", 6, 0, 4, [2, 2, 1, 1], 1], ["SP", 6, 5, 4, [1, 2, 2, 1], 1], ["SP", 6, 10, 49, [1, 7, 7, 1], 1], ["SP", 6, 15, 256, [2, 8, 2, 2], 1], ["SP", 6, 20, 256, [4, 1], 1], ["RE", 6, [0, 5, 10, 15, 1, 6, 11, 16, 2, 7, 12, 17, 20, 21, 3, 8, 13, 18, 22, 4, 9, 14, 19]], ["FSP", 7, 0, 11, 3], ["FSP", 7, 4, 12, 3], ["FSP", 7, 8, 13, 3], ["FSP", 7, 12, 14, 3], ["RE", 7, [0, 4, 8, 12, 1, 5, 9, 13, 2, 6, 10, 14, 3, 7, 11, 15]], ["CA", 6, 7, 11], ["CHR", 5, "shared", [6]], ["CA", 6, 7, 12], ["CHR", 4, "shared", [7]], ["CA", 5, 8, 12], ["AN", 4, 0, 1], ["AN", 4, 1, 1], ["SP", 4, 2, 49, [49], 1], ["SP", 4, 4, 256, [1], 1], ["AN", 4, 6, 1], ["AN", 4, 7, 1], ["RE", 4, [2, 4, 3, 5, 0, 1, 6, 7]], ["CI", 3], ["CA", 2, 4, 3], ["CI", 1], ["FU", 15, [0, 1, 2, 3]], ["SP", 15, 0, 50176, [32], 1], ["AN", 15, 0, 5], ["AN", 15, 1, 6], ["FU", 11, [0, 1, 2, 3]], ["SP", 11, 0, 12544, [32], 1], ["AN", 11, 0, 5], ["AN", 11, 1, 6], ["FU", 9, [0, 1, 2, 3]], ["AN", 9, 0, 5], ["FU", 9, [1, 2, 3, 4]], ["AN", 9, 1, 4], ["FU", 9, [2, 3, 4, 5]], ["AN", 9, 2, 6], ["FU", 7, [0, 1, 2, 3]], ["SP", 7, 0, 16, [4], 1], ["AN", 7, 1, 2], ["FFSP", 7, 0, [14, 13, 12, 11], 1, 1], ["AN", 7, 1, 6], ["FU", 5, [0, 1, 2, 3]], ["SP", 5, 0, 28, [1], 1], ["AN", 5, 1, 2], ["FFSP", 5, 0, [14, 13, 12, 11], 1, 1], ["AN", 5, 1, 6], ["FU", 4, [0, 1, 2, 3]], ["SP", 4, 0, 12544, [32], 1], ["AN", 4, 0, 5], ["AN", 4, 1, 6], ["PR", 4, 0, "auto_unroll_max_step$16"], ["PR", 8, 0, "auto_unroll_max_step$64"], ["PR", 11, 0, "auto_unroll_max_step$1024"]]]], "r": [[0.000326796], 0, 1.82492, 1756339953], "v": "v0.6"}
{"i": [["[\"1097323f3970e5c881ad3a0028ca79cb\", [1, 14, 14, 256], [4, 4, 256, 256], [1, 1, 1, 256], [1, 14, 14, 256]]", "cuda -keys=cuda,gpu -arch=sm_86 -max_num_threads=1024 -thread_warp_size=32", [-1, 16, 64, 49152, 2147483647, 1024, 8, 32], "", 0, []], [[], [["CI", 11], ["CI", 9], ["AN", 8, 0, 1], ["AN", 8, 1, 1], ["SP", 8, 2, 49, [49], 1], ["SP", 8, 4, 256, [2], 1], ["AN", 8, 6, 1], ["AN", 8, 7, 1], ["RE", 8, [2, 4, 3, 5, 0, 1, 6, 7]], ["CI", 7], ["CHW", 6, "local"], ["SP", 6, 0, 4, [1, 2, 1, 2], 1], ["SP", 6, 5, 4, [2, 1, 1, 2], 1], ["SP", 6, 10, 49, [1, 7, 1, 7], 1], ["SP", 6, 15, 256, [4, 4, 8, 2], 1], ["SP", 6, 20, 256, [2, 1], 1], ["RE", 6, [0, 5, 10, 15, 1, 6, 11, 16, 2, 7, 12, 17, 20, 21, 3, 8, 13, 18, 22, 4, 9, 14, 19]], ["FSP", 7, 0, 11, 3], ["FSP", 7, 4, 12, 3], ["FSP", 7, 8, 13, 3], ["FSP", 7, 12, 14, 3], ["RE", 7, [0, 4, 8, 12, 1, 5, 9, 13, 2, 6, 10, 14, 3, 7, 11, 15]], ["CA", 6, 7, 11], ["CHR", 5, "shared", [6]], ["CA", 6, 7, 12], ["CHR", 4, "shared", [7]], ["CA", 5, 8, 12], ["AN", 4, 0, 1], ["AN", 4, 1, 1], ["SP", 4, 2, 49, [7], 1], ["SP", 4, 4, 256, [32], 1], ["AN", 4, 6, 1], ["AN", 4, 7, 1], ["RE", 4, [2, 4, 3, 5, 0, 1, 6, 7]], ["CI", 3], ["CA", 2, 4, 3], ["CI", 1], ["FU", 15, [0, 1, 2, 3]], ["SP", 15, 0, 50176, [32], 1], ["AN", 15, 0, 5], ["AN", 15, 1, 6], ["FU", 11, [0, 1, 2, 3]], ["SP", 11, 0, 12544, [64], 1], ["AN", 11, 0, 5], ["AN", 11, 1, 6], ["FU", 9, [0, 1, 2, 3]], ["AN", 9, 0, 5], ["FU", 9, [1, 2, 3, 4]], ["AN", 9, 1, 4], ["FU", 9, [2, 3, 4, 5]], ["AN", 9, 2, 6], ["FU", 7, [0, 1, 2, 3]], ["SP", 7, 0, 128, [1], 1], ["AN", 7, 1, 2], ["FFSP", 7, 0, [14, 13, 12, 11], 1, 1], ["AN", 7, 1, 6], ["FU", 5, [0, 1, 2, 3]], ["SP", 5, 0, 56, [1], 1], ["AN", 5, 1, 2], ["FFSP", 5, 0, [14, 13, 12, 11], 1, 1], ["AN", 5, 1, 6], ["FU", 4, [0, 1, 2, 3]], ["SP", 4, 0, 12544, [32], 1], ["AN", 4, 0, 5], ["AN", 4, 1, 6], ["PR", 4, 0, "auto_unroll_max_step$1024"], ["PR", 8, 0, "auto_unroll_max_step$16"], ["PR", 11, 0, "auto_unroll_max_step$0"]]]], "r": [[0.00914711], 0, 2.21743, 1756339953], "v": "v0.6"}
{"i": [["[\"1097323f3970e5c881ad3a0028ca79cb\", [1, 14, 14, 256], [4, 4, 256, 256], [1, 1, 1, 256], [1, 14, 14, 256]]", "cuda -keys=cuda,gpu -arch=sm_86 -max_num_threads=1024 -thread_warp_size=32", [-1, 16, 64, 49152, 2147483647, 1024, 8, 32], "", 0, []], [[], [["CI", 11], ["CI", 9], ["AN", 8, 0, 1], ["AN", 8, 1, 1], ["SP", 8, 2, 49, [7], 1], ["SP", 8, 4, 256, [8], 1], ["AN", 8, 6, 1], ["AN", 8, 7, 1], ["RE", 8, [2, 4, 3, 5, 0, 1, 6, 7]], ["CI", 7], ["CHW", 6, "local"], ["SP", 6, 0, 4, [2, 1, 1, 1], 1], ["SP", 6, 5, 4, [1, 1, 1, 2], 1], ["SP", 6, 10, 49, [1, 1, 7, 7], 1], ["SP", 6, 15, 256, [4, 64, 1, 1], 1], ["SP", 6, 20, 256, [4, 1], 1], ["RE", 6, [0, 5, 10, 15, 1, 6, 11, 16, 2, 7, 12, 17, 20, 21, 3, 8, 13, 18, 22, 4, 9, 14, 19]], ["FSP", 7, 0, 11, 3], ["FSP", 7, 4, 12, 3], ["FSP", 7, 8, 13, 3], ["FSP", 7, 12, 14, 3], ["RE", 7, [0, 4, 8, 12, 1, 5, 9, 13, 2, 6, 10, 14, 3, 7, 11, 15]], ["CA", 6, 7, 11], ["CHR", 5, "shared", [6]], ["CA", 6, 7, 12], ["CHR", 4, "shared", [7]], ["CA", 5, 8, 12], ["AN", 4, 0, 1], ["AN", 4, 1, 1], ["SP", 4, 2, 49, [7], 1], ["SP", 4, 4, 256, [8], 1], ["AN", 4, 6, 1], ["AN", 4, 7, 1], ["RE", 4, [2, 4, 3, 5, 0, 1, 6, 7]], ["CI", 3], ["CA", 2, 4, 3], ["CI", 1], ["FU", 15, [0, 1, 2, 3]], ["SP", 15, 0, 50176, [4], 1], ["AN", 15, 0, 5], ["AN", 15, 1, 6], ["FU", 11, [0, 1, 2, 3]], ["SP", 11, 0, 12544, [32], 1], ["AN", 11, 0, 5], ["AN", 11, 1, 6], ["FU", 9, [0, 1, 2, 3]], ["AN", 9, 0, 5], ["FU", 9, [1, 2, 3, 4]], ["AN", 9, 1, 4], ["FU", 9, [2, 3, 4, 5]], ["AN", 9, 2, 6], ["FU", 7, [0, 1, 2, 3]], ["SP", 7, 0, 8, [1], 1], ["AN", 7, 1, 2], ["FFSP", 7, 0, [14, 13, 12, 11], 1, 1], ["AN", 7, 1, 6], ["FU", 5, [0, 1, 2, 3]], ["SP", 5, 0, 392, [1], 1], ["AN", 5, 1, 2], ["FFSP", 5, 0, [14, 13, 12, 11], 1, 1], ["AN", 5, 1, 6], ["FU", 4, [0, 1, 2, 3]], ["SP", 4, 0, 12544, [16], 1], ["AN", 4, 0, 5], ["AN", 4, 1, 6], ["PR", 4, 0, "auto_unroll_max_step$1024"], ["PR", 8, 0, "auto_unroll_max_step$512"], ["PR", 11, 0, "auto_unroll_max_step$512"]]]], "r": [[0.00206124], 0, 2.5349, 1756339954], "v": "v0.6"}
{"i": [["[\"1097323f3970e5c881ad3a0028ca79cb\", [1, 14, 14, 256], [4, 4, 256, 256], [1, 1, 1, 256], [1, 14, 14, 256]]", "cuda -keys=cuda,gpu -arch=sm_86 -max_num_threads=1024 -thread_warp_size=32", [-1, 16, 64, 49152, 2147483647, 1024, 8, 32], "", 0, []], [[], [["CI", 11], ["CI", 9], ["AN", 8, 0, 1], ["AN", 8, 1, 1], ["SP", 8, 2, 49, [1], 1], ["SP", 8, 4, 256, [4], 1], ["AN", 8, 6, 1], ["AN", 8, 7, 1], ["RE", 8, [2, 4, 3, 5, 0, 1, 6, 7]], ["CI", 7], ["CHW", 6, "local"], ["SP", 6, 0, 4, [1, 2, 1, 2], 1], ["SP", 6, 5, 4, [1, 1, 2, 1], 1], ["SP", 6, 10, 49, [1, 1, 49, 1], 1], ["SP", 6, 15, 256, [2, 64, 1, 1], 1], ["SP", 6, 20, 256, [1, 2], 1], ["RE", 6, [0, 5, 10, 15, 1, 6, 11, 16, 2, 7, 12, 17, 20, 21, 3, 8, 13, 18, 22, 4, 9, 14, 19]], ["FSP", 7, 0, 11, 3], ["FSP", 7, 4, 12, 3], ["FSP", 7, 8, 13, 3], ["FSP", 7, 12, 14, 3], ["RE", 7, [0, 4, 8, 12, 1, 5, 9, 13, 2, 6, 10, 14, 3, 7, 11, 15]], ["CA", 6, 7, 11], ["CHR", 5, "shared", [6]], ["CA", 6, 7, 12], ["CHR", 4, "shared", [7]], ["CA", 5, 8, 12], ["AN", 4, 0, 1], ["AN", 4, 1, 1], ["SP", 4, 2, 49, [49], 1], ["SP", 4, 4, 256, [4], 1], ["AN", 4, 6, 1], ["AN", 4, 7, 1], ["RE", 4, [2, 4, 3, 5, 0, 1, 6, 7]], ["CI", 3], ["CA", 2, 4, 3], ["CI", 1], ["FU", 15, [0, 1, 2, 3]], ["SP", 15, 0, 50176, [64], 1], ["AN", 15, 0, 5], ["AN", 15, 1, 6], ["FU", 11, [0, 1, 2, 3]], ["SP", 11, 0, 12544, [4], 1], ["AN", 11, 0, 5], ["AN", 11, 1, 6], ["FU", 9, [0, 1, 2, 3]], ["AN", 9, 0, 5], ["FU", 9, [1, 2, 3, 4]], ["AN", 9, 1, 4], ["FU", 9, [2, 3, 4, 5]], ["AN", 9, 2, 6], ["FU", 7, [0, 1, 2, 3]], ["SP", 7, 0, 8, [1], 1], ["AN", 7, 1, 2], ["FFSP", 7, 0, [14, 13, 12, 11], 1, 1], ["AN", 7, 1, 6], ["FU", 5, [0, 1, 2, 3]], ["SP", 5, 0, 392, [1], 1], ["AN", 5, 1, 2], ["FFSP", 5, 0, [14, 13, 12, 11], 1, 1], ["AN", 5, 1, 6], ["FU", 4, [0, 1, 2, 3]], ["SP", 4, 0, 12544, [32], 1], ["AN", 4, 0, 5], ["AN", 4, 1, 6], ["PR", 4, 0, "auto_unroll_max_step$64"], ["PR", 8, 0, "auto_unroll_max_step$1024"], ["PR", 11, 0, "auto_unroll_max_step$1024"]]]], "r": [[0.00125703], 0, 3.00086, 1756339955], "v": "v0.6"}
{"i": [["[\"1097323f3970e5c881ad3a0028ca79cb\", [1, 14, 14, 256], [4, 4, 256, 256], [1, 1, 1, 256], [1, 14, 14, 256]]", "cuda -keys=cuda,gpu -arch=sm_86 -max_num_threads=1024 -thread_warp_size=32", [-1, 16, 64, 49152, 2147483647, 1024, 8, 32], "", 0, []], [[], [["CI", 11], ["CI", 9], ["AN", 8, 0, 1], ["AN", 8, 1, 1], ["SP", 8, 2, 49, [7], 1], ["SP", 8, 4, 256, [2], 1], ["AN", 8, 6, 1], ["AN", 8, 7, 1], ["RE", 8, [2, 4, 3, 5, 0, 1, 6, 7]], ["CI", 7], ["CHW", 6, "local"], ["SP", 6, 0, 4, [1, 2, 2, 1], 1], ["SP", 6, 5, 4, [1, 1, 1, 2], 1], ["SP", 6, 10, 49, [1, 7, 7, 1], 1], ["SP", 6, 15, 256, [4, 2, 1, 4], 1], ["SP", 6, 20, 256, [2, 2], 1], ["RE", 6, [0, 5, 10, 15, 1, 6, 11, 16, 2, 7, 12, 17, 20, 21, 3, 8, 13, 18, 22, 4, 9, 14, 19]], ["FSP", 7, 0, 11, 3], ["FSP", 7, 4, 12, 3], ["FSP", 7, 8, 13, 3], ["FSP", 7, 12, 14, 3], ["RE", 7, [0, 4, 8, 12, 1, 5, 9, 13, 2, 6, 10, 14, 3, 7, 11, 15]], ["CA", 6, 7, 11], ["CHR", 5, "shared", [6]], ["CA", 6, 7, 12], ["CHR", 4, "shared", [7]], ["CA", 5, 8, 12], ["AN", 4, 0, 1], ["AN", 4, 1, 1], ["SP", 4, 2, 49, [7], 1], ["SP", 4, 4, 256, [8], 1], ["AN", 4, 6, 1], ["AN", 4, 7, 1], ["RE", 4, [2, 4, 3, 5, 0, 1, 6, 7]], ["CI", 3], ["CA", 2, 4, 3], ["CI", 1], ["FU", 15, [0, 1, 2, 3]], ["SP", 15, 0, 50176, [32], 1], ["AN", 15, 0, 5], ["AN", 15, 1, 6], ["FU", 11, [0, 1, 2, 3]], ["SP", 11, 0, 12544, [1], 1], ["AN", 11, 0, 5], ["AN", 11, 1, 6], ["FU", 9, [0, 1, 2, 3]], ["AN", 9, 0, 5], ["FU", 9, [1, 2, 3, 4]], ["AN", 9, 1, 4], ["FU", 9, [2, 3, 4, 5]], ["AN", 9, 2, 6], ["FU", 7, [0, 1, 2, 3]], ["SP", 7, 0, 32, [1], 1], ["AN", 7, 1, 2], ["FFSP", 7, 0, [14, 13, 12, 11], 1, 1], ["AN", 7, 1, 6], ["FU", 5, [0, 1, 2, 3]], ["SP", 5, 0, 112, [1], 1], ["AN", 5, 1, 2], ["FFSP", 5, 0, [14, 13, 12, 11], 1, 1], ["AN", 5, 1, 6], ["FU", 4, [0, 1, 2, 3]], ["SP", 4, 0, 12544, [32], 1], ["AN", 4, 0, 5], ["AN", 4, 1, 6], ["PR", 4, 0, "auto_unroll_max_step$1024"], ["PR", 8, 0, "auto_unroll_max_step$16"], ["PR", 11, 0, "auto_unroll_max_step$1024"]]]], "r": [[0.000943204], 0, 2.29226, 1756339956], "v": "v0.6"}
{"i": [["[\"1097323f3970e5c881ad3a0028ca79cb\", [1, 14, 14, 256], [4, 4, 256, 256], [1, 1, 1, 256], [1, 14, 14, 256]]", "cuda -keys=cuda,gpu -arch=sm_86 -max_num_threads=1024 -thread_warp_size=32", [-1, 16, 64, 49152, 2147483647, 1024, 8, 32], "", 0, []], [[], [["CI", 11], ["CI", 9], ["AN", 8, 0, 1], ["AN", 8, 1, 1], ["SP", 8, 2, 49, [49], 1], ["SP", 8, 4, 256, [1], 1], ["AN", 8, 6, 1], ["AN", 8, 7, 1], ["RE", 8, [2, 4, 3, 5, 0, 1, 6, 7]], ["CI", 7], ["CHW", 6, "local"], ["SP", 6, 0, 4, [1, 1, 1, 4], 1], ["SP", 6, 5, 4, [1, 1, 2, 2], 1], ["SP", 6, 10, 49, [1, 49, 1, 1], 1], ["SP", 6, 15, 256, [2, 1, 8, 1], 1], ["SP", 6, 20, 256, [1, 8], 1], ["RE", 6, [0, 5, 10, 15, 1, 6, 11, 16, 2, 7, 12, 17, 20, 21, 3, 8, 13, 18, 22, 4, 9, 14, 19]], ["FSP", 7, 0, 11, 3], ["FSP", 7, 4, 12, 3], ["FSP", 7, 8, 13, 3], ["FSP", 7, 12, 14, 3], ["RE", 7, [0, 4, 8, 12, 1, 5, 9, 13, 2, 6, 10, 14, 3, 7, 11, 15]], ["CA", 6, 7, 11], ["CHR", 5, "shared", [6]], ["CA", 6, 7, 12], ["CHR", 4, "shared", [7]], ["CA", 5, 8, 12], ["AN", 4, 0, 1], ["AN", 4, 1, 1], ["SP", 4, 2, 49, [7], 1], ["SP", 4, 4, 256, [16], 1], ["AN", 4, 6, 1], ["AN", 4, 7, 1], ["RE", 4, [2, 4, 3, 5, 0, 1, 6, 7]], ["CI", 3], ["CA", 2, 4, 3], ["CI", 1], ["FU", 15, [0, 1, 2, 3]], ["SP", 15, 0, 50176, [32], 1], ["AN", 15, 0, 5], ["AN", 15, 1, 6], ["FU", 11, [0, 1, 2, 3]], ["SP", 11, 0, 12544, [32], 1], ["AN", 11, 0, 5], ["AN", 11, 1, 6], ["FU", 9, [0, 1, 2, 3]], ["AN", 9, 0, 5], ["FU", 9, [1, 2, 3, 4]], ["AN", 9, 1, 4], ["FU", 9, [2, 3, 4, 5]], ["AN", 9, 2, 6], ["FU", 7, [0, 1, 2, 3]], ["SP", 7, 0, 512, [1], 1], ["AN", 7, 1, 2], ["FFSP", 7, 0, [14, 13, 12, 11], 1, 1], ["AN", 7, 1, 6], ["FU", 5, [0, 1, 2, 3]], ["SP", 5, 0, 64, [1], 1], ["AN", 5, 1, 2], ["FFSP", 5, 0, [14, 13, 12, 11], 1, 1], ["AN", 5, 1, 6], ["FU", 4, [0, 1, 2, 3]], ["SP", 4, 0, 12544, [32], 1], ["AN", 4, 0, 5], ["AN", 4, 1, 6], ["PR", 4, 0, "auto_unroll_max_step$0"], ["PR", 8, 0, "auto_unroll_max_step$64"], ["PR", 11, 0, "auto_unroll_max_step$512"]]]], "r": [[0.000311258], 0, 1.59523, 1756339956], "v": "v0.6"}
{"i": [["[\"2d10de6646307f0e3e5cf4b31c20e69b\", [1, 56, 56, 64], [1, 1, 64, 64], [1, 56, 56, 64]]", "cuda -keys=cuda,gpu -arch=sm_86 -max_num_threads=1024 -thread_warp_size=32", [-1, 16, 64, 49152, 2147483647, 1024, 8, 32], "", 0, []], [[], [["CHW", 3, "local"], ["SP", 3, 0, 1, [1, 1, 1, 1], 1], ["SP", 3, 5, 56, [1, 7, 4, 2], 1], ["SP", 3, 10, 56, [2, 2, 1, 1], 1], ["SP", 3, 15, 64, [1, 4, 4, 1], 1], ["SP", 3, 20, 1, [1, 1], 1], ["SP", 3, 23, 1, [1, 1], 1], ["SP", 3, 26, 64, [4, 1], 1], ["RE", 3, [0, 5, 10, 15, 1, 6, 11, 16, 2, 7, 12, 17, 20, 23, 26, 21, 24, 27, 3, 8, 13, 18, 22, 25, 28, 4, 9, 14, 19]], ["FSP", 4, 0, 1, 3], ["FSP", 4, 4, 2, 3], ["FSP", 4, 8, 3, 3], ["FSP", 4, 12, 4, 3], ["RE", 4, [0, 4, 8, 12, 1, 5, 9, 13, 2, 6, 10, 14, 3, 7, 11, 15]], ["CA", 3, 4, 11], ["CHR", 2, "shared", [3]], ["CA", 3, 4, 14], ["CHR", 1, "shared", [4]], ["CA", 2, 5, 14], ["CI", 1], ["FU", 6, [0, 1, 2, 3]], ["AN", 6, 0, 5], ["FU", 6, [1, 2, 3, 4]], ["AN", 6, 1, 4], ["FU", 6, [2, 3, 4, 5]], ["AN", 6, 2, 6], ["FU", 4, [0, 1, 2, 3]], ["SP", 4, 0, 16, [4], 1], ["AN", 4, 1, 2], ["FFSP", 4, 0, [4, 3, 2, 1], 1, 1], ["AN", 4, 1, 6], ["FU", 2, [0, 1, 2, 3]], ["SP", 2, 0, 32, [1], 1], ["AN", 2, 1, 2], ["FFSP", 2, 0, [4, 3, 2, 1], 1, 1], ["AN", 2, 1, 6], ["PR", 5, 0, "auto_unroll_max_step$1024"]]]], "r": [[1.15953e-05], 0, 1.52145, 1756339990], "v": "v0.6"}
{"i": [["[\"2d10de6646307f0e3e5cf4b31c20e69b\", [1, 56, 56, 64], [1, 1, 64, 64], [1, 56, 56, 64]]", "cuda -keys=cuda,gpu -arch=sm_86 -max_num_threads=1024 -thread_warp_size=32", [-1, 16, 64, 49152, 2147483647, 1024, 8, 32], "", 0, []], [[], [["CHW", 3, "local"], ["SP", 3, 0, 1, [1, 1, 1, 1], 1], ["SP", 3, 5, 56, [1, 4, 1, 1], 1], ["SP", 3, 10, 56, [1, 1, 2, 4], 1], ["SP", 3, 15, 64, [1, 16, 2, 1], 1], ["SP", 3, 20, 1, [1, 1], 1], ["SP", 3, 23, 1, [1, 1], 1], ["SP", 3, 26, 64, [2, 2], 1], ["RE", 3, [0, 5, 10, 15, 1, 6, 11, 16, 2, 7, 12, 17, 20, 23, 26, 21, 24, 27, 3, 8, 13, 18, 22, 25, 28, 4, 9, 14, 19]], ["FSP", 4, 0, 1, 3], ["FSP", 4, 4, 2, 3], ["FSP", 4, 8, 3, 3], ["FSP", 4, 12, 4, 3], ["RE", 4, [0, 4, 8, 12, 1, 5, 9, 13, 2, 6, 10, 14, 3, 7, 11, 15]], ["CA", 3, 4, 11], ["CHR", 2, "shared", [3]], ["CA", 3, 4, 14], ["CHR", 1, "shared", [4]], ["CA", 2, 5, 14], ["CI", 1], ["FU", 6, [0, 1, 2, 3]], ["AN", 6, 0, 5], ["FU", 6, [1, 2, 3, 4]], ["AN", 6, 1, 4], ["FU", 6, [2, 3, 4, 5]], ["AN", 6, 2, 6], ["FU", 4, [0, 1, 2, 3]], ["SP", 4, 0, 8, [2], 1], ["AN", 4, 1, 2], ["FFSP", 4, 0, [4, 3, 2, 1], 1, 1], ["AN", 4, 1, 6], ["FU", 2, [0, 1, 2, 3]], ["SP", 2, 0, 32, [1], 1], ["AN", 2, 1, 2], ["FFSP", 2, 0, [4, 3, 2, 1], 1, 1], ["AN", 2, 1, 6], ["PR", 5, 0, "auto_unroll_max_step$512"]]]], "r": [[7.27507e-06], 0, 1.15608, 1756339991], "v": "v0.6"}
{"i": [["[\"2d10de6646307f0e3e5cf4b31c20e69b\", [1, 56, 56, 64], [1, 1, 64, 64], [1, 56, 56, 64]]", "cuda -keys=cuda,gpu -arch=sm_86 -max_num_threads=1024 -thread_warp_size=32", [-1, 16, 64, 49152, 2147483647, 1024, 8, 32], "", 0, []], [[], [["CHW", 3, "local"], ["SP", 3, 0, 1, [1, 1, 1, 1], 1], ["SP", 3, 5, 56, [1, 1, 8, 1], 1], ["SP", 3, 10, 56, [2, 14, 2, 1], 1], ["SP", 3, 15, 64, [2, 1, 1, 1], 1], ["SP", 3, 20, 1, [1, 1], 1], ["SP", 3, 23, 1, [1, 1], 1], ["SP", 3, 26, 64, [4, 1], 1], ["RE", 3, [0, 5, 10, 15, 1, 6, 11, 16, 2, 7, 12, 17, 20, 23, 26, 21, 24, 27, 3, 8, 13, 18, 22, 25, 28, 4, 9, 14, 19]], ["FSP", 4, 0, 1, 3], ["FSP", 4, 4, 2, 3], ["FSP", 4, 8, 3, 3], ["FSP", 4, 12, 4, 3], ["RE", 4, [0, 4, 8, 12, 1, 5, 9, 13, 2, 6, 10, 14, 3, 7, 11, 15]], ["CA", 3, 4, 11], ["CHR", 2, "shared", [3]], ["CA", 3, 4, 14], ["CHR", 1, "shared", [4]], ["CA", 2, 5, 14], ["CI", 1], ["FU", 6, [0, 1, 2, 3]], ["AN", 6, 0, 5], ["FU", 6, [1, 2, 3, 4]], ["AN", 6, 1, 4], ["FU", 6, [2, 3, 4, 5]], ["AN", 6, 2, 6], ["FU", 4, [0, 1, 2, 3]], ["SP", 4, 0, 4, [1], 1], ["AN", 4, 1, 2], ["FFSP", 4, 0, [4, 3, 2, 1], 1, 1], ["AN", 4, 1, 6], ["FU", 2, [0, 1, 2, 3]], ["SP", 2, 0, 8, [1], 1], ["AN", 2, 1, 2], ["FFSP", 2, 0, [4, 3, 2, 1], 1, 1], ["AN", 2, 1, 6], ["PR", 5, 0, "auto_unroll_max_step$512"]]]], "r": [[4.16053e-05], 0, 1.68331, 1756339992], "v": "v0.6"}
{"i": [["[\"2d10de6646307f0e3e5cf4b31c20e69b\", [1, 56, 56, 64], [1, 1, 64, 64], [1, 56, 56, 64]]", "cuda -keys=cuda,gpu -arch=sm_86 -max_num_threads=1024 -thread_warp_size=32", [-1, 16, 64, 49152, 2147483647, 1024, 8, 32], "", 0, []], [[], [["CHW", 3, "local"], ["SP", 3, 0, 1, [1, 1, 1, 1], 1], ["SP", 3, 5, 56, [1, 7, 4, 2], 1], ["SP", 3, 10, 56, [1, 2, 1, 2], 1], ["SP", 3, 15, 64, [1, 8, 1, 4], 1], ["SP", 3, 20, 1, [1, 1], 1], ["SP", 3, 23, 1, [1, 1], 1], ["SP", 3, 26, 64, [1, 1], 1], ["RE", 3, [0, 5, 10, 15, 1, 6, 11, 16, 2, 7, 12, 17, 20, 23, 26, 21, 24, 27, 3, 8, 13, 18, 22, 25, 28, 4, 9, 14, 19]], ["FSP", 4, 0, 1, 3], ["FSP", 4, 4, 2, 3], ["FSP", 4, 8, 3, 3], ["FSP", 4, 12, 4, 3], ["RE", 4, [0, 4, 8, 12, 1, 5, 9, 13, 2, 6, 10, 14, 3, 7, 11, 15]], ["CA", 3, 4, 11], ["CHR", 2, "shared", [3]], ["CA", 3, 4, 14], ["CHR", 1, "shared", [4]], ["CA", 2, 5, 14], ["CI", 1], ["FU", 6, [0, 1, 2, 3]], ["AN", 6, 0, 5], ["FU", 6, [1, 2, 3, 4]], ["AN", 6, 1, 4], ["FU", 6, [2, 3, 4, 5]], ["AN", 6, 2, 6], ["FU", 4, [0, 1, 2, 3]], ["SP", 4, 0, 4, [4], 1], ["AN", 4, 1, 2], ["FFSP", 4, 0, [4, 3, 2, 1], 1, 1], ["AN", 4, 1, 6], ["FU", 2, [0, 1, 2, 3]], ["SP", 2, 0, 16, [2], 1], ["AN", 2, 1, 2], ["FFSP", 2, 0, [4, 3, 2, 1], 1, 1], ["AN", 2, 1, 6], ["PR", 5, 0, "auto_unroll_max_step$0"]]]], "r": [[2.4138e-05], 0, 1.23752, 1756339993], "v": "v0.6"}
{"i": [["[\"2d10de6646307f0e3e5cf4b31c20e69b\", [1, 56, 56, 64], [1, 1, 64, 64], [1, 56, 56, 64]]", "cuda -keys=cuda,gpu -arch=sm_86 -max_num_threads=1024 -thread_warp_size=32", [-1, 16, 64, 49152, 2147483647, 1024, 8, 32], "", 0, []], [[], [["CHW", 3, "local"], ["SP", 3, 0, 1, [1, 1, 1, 1], 1], ["SP", 3, 5, 56, [2, 1, 1, 2], 1], ["SP", 3, 10, 56, [1, 28, 1, 1], 1], ["SP", 3, 15, 64, [4, 4, 4, 1], 1], ["SP", 3, 20, 1, [1, 1], 1], ["SP", 3, 23, 1, [1, 1], 1], ["SP", 3, 26, 64, [4, 4], 1], ["RE", 3, [0, 5, 10, 15, 1, 6, 11, 16, 2, 7, 12, 17, 20, 23, 26, 21, 24, 27, 3, 8, 13, 18, 22, 25, 28, 4, 9, 14, 19]], ["FSP", 4, 0, 1, 3], ["FSP", 4, 4, 2, 3], ["FSP", 4, 8, 3, 3], ["FSP", 4, 12, 4, 3], ["RE", 4, [0, 4, 8, 12, 1, 5, 9, 13, 2, 6, 10, 14, 3, 7, 11, 15]], ["CA", 3, 4, 11], ["CHR", 2, "shared", [3]], ["CA", 3, 4, 14], ["CHR", 1, "shared", [4]], ["CA", 2, 5, 14], ["CI", 1], ["FU", 6, [0, 1, 2, 3]], ["AN", 6, 0, 5], ["FU", 6, [1, 2, 3, 4]], ["AN", 6, 1, 4], ["FU", 6, [2, 3, 4, 5]], ["AN", 6, 2, 6], ["FU", 4, [0, 1, 2, 3]], ["SP", 4, 0, 64, [1], 1], ["AN", 4, 1, 2], ["FFSP", 4, 0, [4, 3, 2, 1], 1, 1], ["AN", 4, 1, 6], ["FU", 2, [0, 1, 2, 3]], ["SP", 2, 0, 64, [1], 1], ["AN", 2, 1, 2], ["FFSP", 2, 0, [4, 3, 2, 1], 1, 1], ["AN", 2, 1, 6], ["PR", 5, 0, "auto_unroll_max_step$1024"]]]], "r": [[1e-05], 0, 2.05595, 1756339994], "v": "v0.6"}
{"i": [["[\"2d10de6646307f0e3e5cf4b31c20e69b\", [1, 56, 56, 64], [1, 1, 64, 64], [1, 56, 56, 64]]", "cuda -keys=cuda,gpu -arch=sm_86 -max_num_threads=1024 -thread_warp_size=32", [-1, 16, 64, 49152, 2147483647, 1024, 8, 32], "", 0, []], [[], [["CHW", 3, "local"], ["SP", 3, 0, 1, [1, 1, 1, 1], 1], ["SP", 3, 5, 56, [4, 2, 1, 7], 1], ["SP", 3, 10, 56, [1, 14, 1, 1], 1], ["SP", 3, 15, 64, [1, 4, 8, 1], 1], ["SP", 3, 20, 1, [1, 1], 1], ["SP", 3, 23, 1, [1, 1], 1], ["SP", 3, 26, 64, [2, 2], 1], ["RE", 3, [0, 5, 10, 15, 1, 6, 11, 16, 2, 7, 12, 17, 20, 23, 26, 21, 24, 27, 3, 8, 13, 18, 22, 25, 28, 4, 9, 14, 19]], ["FSP", 4, 0, 1, 3], ["FSP", 4, 4, 2, 3], ["FSP", 4, 8, 3, 3], ["FSP", 4, 12, 4, 3], ["RE", 4, [0, 4, 8, 12, 1, 5, 9, 13, 2, 6, 10, 14, 3, 7, 11, 15]], ["CA", 3, 4, 11], ["CHR", 2, "shared", [3]], ["CA", 3, 4, 14], ["CHR", 1, "shared", [4]], ["CA", 2, 5, 14], ["CI", 1], ["FU", 6, [0, 1, 2, 3]], ["AN", 6, 0, 5], ["FU", 6, [1, 2, 3, 4]], ["AN", 6, 1, 4], ["FU", 6, [2, 3, 4, 5]], ["AN", 6, 2, 6], ["FU", 4, [0, 1, 2, 3]], ["SP", 4, 0, 32, [1], 1], ["AN", 4, 1, 2], ["FFSP", 4, 0, [4, 3, 2, 1], 1, 1], ["AN", 4, 1, 6], ["FU", 2, [0, 1, 2, 3]], ["SP", 2, 0, 28, [1], 1], ["AN", 2, 1, 2], ["FFSP", 2, 0, [4, 3, 2, 1], 1, 1], ["AN", 2, 1, 6], ["PR", 5, 0, "auto_unroll_max_step$1024"]]]], "r": [[5.26261e-05], 0, 2.23563, 1756339994], "v": "v0.6"}
{"i": [["[\"2d10de6646307f0e3e5cf4b31c20e69b\", [1, 56, 56, 64], [1, 1, 64, 64], [1, 56, 56, 64]]", "cuda -keys=cuda,gpu -arch=sm_86 -max_num_threads=1024 -thread_warp_size=32", [-1, 16, 64, 49152, 2147483647, 1024, 8, 32], "", 0, []], [[], [["CHW", 3, "local"], ["SP", 3, 0, 1, [1, 1, 1, 1], 1], ["SP", 3, 5, 56, [1, 14, 2, 2], 1], ["SP", 3, 10, 56, [2, 1, 1, 1], 1], ["SP", 3, 15, 64, [1, 4, 1, 4], 1], ["SP", 3, 20, 1, [1, 1], 1], ["SP", 3, 23, 1, [1, 1], 1], ["SP", 3, 26, 64, [1, 1], 1], ["RE", 3, [0, 5, 10, 15, 1, 6, 11, 16, 2, 7, 12, 17, 20, 23, 26, 21, 24, 27, 3, 8, 13, 18, 22, 25, 28, 4, 9, 14, 19]], ["FSP", 4, 0, 1, 3], ["FSP", 4, 4, 2, 3], ["FSP", 4, 8, 3, 3], ["FSP", 4, 12, 4, 3], ["RE", 4, [0, 4, 8, 12, 1, 5, 9, 13, 2, 6, 10, 14, 3, 7, 11, 15]], ["CA", 3, 4, 11], ["CHR", 2, "shared", [3]], ["CA", 3, 4, 14], ["CHR", 1, "shared", [4]], ["CA", 2, 5, 14], ["CI", 1], ["FU", 6, [0, 1, 2, 3]], ["AN", 6, 0, 5], ["FU", 6, [1, 2, 3, 4]], ["AN", 6, 1, 4], ["FU", 6, [2, 3, 4, 5]], ["AN", 6, 2, 6], ["FU", 4, [0, 1, 2, 3]], ["SP", 4, 0, 16, [1], 1], ["AN", 4, 1, 2], ["FFSP", 4, 0, [4, 3, 2, 1], 1, 1], ["AN", 4, 1, 6], ["FU", 2, [0, 1, 2, 3]], ["SP", 2, 0, 16, [4], 1], ["AN", 2, 1, 2], ["FFSP", 2, 0, [4, 3, 2, 1], 1, 1], ["AN", 2, 1, 6], ["PR", 5, 0, "auto_unroll_max_step$16"]]]], "r": [[2.05425e-05], 0, 1.21923, 1756339995], "v": "v0.6"}
{"i": [["[\"2d10de6646307f0e3e5cf4b31c20e69b\", [1, 56, 56, 64], [1, 1, 64, 64], [1, 56, 56, 64]]", "cuda -keys=cuda,gpu -arch=sm_86 -max_num_threads=1024 -thread_warp_size=32", [-1, 16, 64, 49152, 2147483647, 1024, 8, 32], "", 0, []], [[], [["CHW", 3, "local"], ["SP", 3, 0, 1, [1, 1, 1, 1], 1], ["SP", 3, 5, 56, [4, 1, 7, 1], 1], ["SP", 3, 10, 56, [1, 1, 4, 7], 1], ["SP", 3, 15, 64, [1, 32, 1, 1], 1], ["SP", 3, 20, 1, [1, 1], 1], ["SP", 3, 23, 1, [1, 1], 1], ["SP", 3, 26, 64, [1, 8], 1], ["RE", 3, [0, 5, 10, 15, 1, 6, 11, 16, 2, 7, 12, 17, 20, 23, 26, 21, 24, 27, 3, 8, 13, 18, 22, 25, 28, 4, 9, 14, 19]], ["FSP", 4, 0, 1, 3], ["FSP", 4, 4, 2, 3], ["FSP", 4, 8, 3, 3], ["FSP", 4, 12, 4, 3], ["RE", 4, [0, 4, 8, 12, 1, 5, 9, 13, 2, 6, 10, 14, 3, 7, 11, 15]], ["CA", 3, 4, 11], ["CHR", 2, "shared", [3]], ["CA", 3, 4, 14], ["CHR", 1, "shared", [4]], ["CA", 2, 5, 14], ["CI", 1], ["FU", 6, [0, 1, 2, 3]], ["AN", 6, 0, 5], ["FU", 6, [1, 2, 3, 4]], ["AN", 6, 1, 4], ["FU", 6, [2, 3, 4, 5]], ["AN", 6, 2, 6], ["FU", 4, [0, 1, 2, 3]], ["SP", 4, 0, 16, [1], 1], ["AN", 4, 1, 2], ["FFSP", 4, 0, [4, 3, 2, 1], 1, 1], ["AN", 4, 1, 6], ["FU", 2, [0, 1, 2, 3]], ["SP", 2, 0, 1568, [4], 1], ["AN", 2, 1, 2], ["FFSP", 2, 0, [4, 3, 2, 1], 1, 1], ["AN", 2, 1, 6], ["PR", 5, 0, "auto_unroll_max_step$512"]]]], "r": [[0.000123314], 0, 2.20374, 1756339996], "v": "v0.6"}
{"i": [["[\"07f9fcad27bdd3233f86fe35a5185d33\", [1, 56, 56, 64], [3, 3, 64, 128], [1, 1, 1, 128], [1, 28, 28, 128]]", "cuda -keys=cuda,gpu -arch=sm_86 -max_num_threads=1024 -thread_warp_size=32", [-1, 16, 64, 49152, 2147483647, 1024, 8, 32], "", 0, []], [[], [["CI", 5], ["SP", 3, 0, 1, [1, 1, 1, 1], 1], ["SP", 3, 5, 28, [1, 2, 1, 2], 1], ["SP", 3, 10, 28, [1, 2, 14, 1], 1], ["SP", 3, 15, 128, [2, 2, 4, 1], 1], ["SP", 3, 20, 3, [3, 1], 1], ["SP", 3, 23, 3, [3, 1], 1], ["SP", 3, 26, 64, [1, 4], 1], ["RE", 3, [0, 5, 10, 15, 1, 6, 11, 16, 2, 7, 12, 17, 20, 23, 26, 21, 24, 27, 3, 8, 13, 18, 22, 25, 28, 4, 9, 14, 19]], ["FSP", 6, 0, 1, 3], ["FSP", 6, 4, 2, 3], ["FSP", 6, 8, 3, 3], ["FSP", 6, 12, 4, 3], ["RE", 6, [0, 4, 8, 12, 1, 5, 9, 13, 2, 6, 10, 14, 3, 7, 11, 15]], ["CA", 3, 6, 11], ["CHR", 2, "shared", [3]], ["CA", 3, 4, 14], ["CHR", 1, "shared", [4]], ["CA", 2, 5, 14], ["CI", 1], ["FU", 8, [0, 1, 2, 3]], ["AN", 8, 0, 5], ["FU", 8, [1, 2, 3, 4]], ["AN", 8, 1, 4], ["FU", 8, [2, 3, 4, 5]], ["AN", 8, 2, 6], ["FU", 4, [0, 1, 2, 3]], ["SP", 4, 0, 96, [1], 1], ["AN", 4, 1, 2], ["FFSP", 4, 0, [4, 3, 2, 1], 1, 1], ["AN", 4, 1, 6], ["FU", 2, [0, 1, 2, 3]], ["SP", 2, 0, 696, [6], 1], ["AN", 2, 1, 2], ["FFSP", 2, 0, [4, 3, 2, 1], 1, 1], ["AN", 2, 1, 6], ["PR", 5, 0, "auto_unroll_max_step$0"]]]], "r": [[0.000886734], 0, 1.403, 1756340042], "v": "v0.6"}
{"i": [["[\"07f9fcad27bdd3233f86fe35a5185d33\", [1, 56, 56, 64], [3, 3, 64, 128], [1, 1, 1, 128], [1, 28, 28, 128]]", "cuda -keys=cuda,gpu -arch=sm_86 -max_num_threads=1024 -thread_warp_size=32", [-1, 16, 64, 49152, 2147483647, 1024, 8, 32], "", 0, []], [[], [["CI", 5], ["SP", 3, 0, 1, [1, 1, 1, 1], 1], ["SP", 3, 5, 28, [1, 7, 1, 2], 1], ["SP", 3, 10, 28, [1, 2, 14, 1], 1], ["SP", 3, 15, 128, [2, 8, 1, 8], 1], ["SP", 3, 20, 3, [3, 1], 1], ["SP", 3, 23, 3, [3, 1], 1], ["SP", 3, 26, 64, [1, 4], 1], ["RE", 3, [0, 5, 10, 15, 1, 6, 11, 16, 2, 7, 12, 17, 20, 23, 26, 21, 24, 27, 3, 8, 13, 18, 22, 25, 28, 4, 9, 14, 19]], ["FSP", 6, 0, 1, 3], ["FSP", 6, 4, 2, 3], ["FSP", 6, 8, 3, 3], ["FSP", 6, 12, 4, 3], ["RE", 6, [0, 4, 8, 12, 1, 5, 9, 13, 2, 6, 10, 14, 3, 7, 11, 15]], ["CA", 3, 6, 11], ["CHR", 2, "shared", [3]], ["CA", 3, 4, 14], ["CHR", 1, "shared", [4]], ["CA", 2, 5, 14], ["CI", 1], ["FU", 8, [0, 1, 2, 3]], ["AN", 8, 0, 5], ["FU", 8, [1, 2, 3, 4]], ["AN", 8, 1, 4], ["FU", 8, [2, 3, 4, 5]], ["AN", 8, 2, 6], ["FU", 4, [0, 1, 2, 3]], ["SP", 4, 0, 288, [1], 1], ["AN", 4, 1, 2], ["FFSP", 4, 0, [4, 3, 2, 1], 1, 1], ["AN", 4, 1, 6], ["FU", 2, [0, 1, 2, 3]], ["SP", 2, 0, 580, [10], 1], ["AN", 2, 1, 2], ["FFSP", 2, 0, [4, 3, 2, 1], 1, 1], ["AN", 2, 1, 6], ["PR", 5, 0, "auto_unroll_max_step$16"]]]], "r": [[0.00112739], 0, 1.5907, 1756340043], "v": "v0.6"}
{"i": [["[\"07f9fcad27bdd3233f86fe35a5185d33\", [1, 56, 56, 64], [3, 3, 64, 128], [1, 1, 1, 128], [1, 28, 28, 128]]", "cuda -keys=cuda,gpu -arch=sm_86 -max_num_threads=1024 -thread_warp_size=32", [-1, 16, 64, 49152, 2147483647, 1024, 8, 32], "", 0, []], [[], [["CI", 5], ["SP", 3, 0, 1, [1, 1, 1, 1], 1], ["SP", 3, 5, 28, [2, 1, 1, 2], 1], ["SP", 3, 10, 28, [1, 1, 7, 2], 1], ["SP", 3, 15, 128, [1, 64, 1, 1], 1], ["SP", 3, 20, 3, [1, 1], 1], ["SP", 3, 23, 3, [1, 1], 1], ["SP", 3, 26, 64, [16, 1], 1], ["RE", 3, [0, 5, 10, 15, 1, 6, 11, 16, 2, 7, 12, 17, 20, 23, 26, 21, 24, 27, 3, 8, 13, 18, 22, 25, 28, 4, 9, 14, 19]], ["FSP", 6, 0, 1, 3], ["FSP", 6, 4, 2, 3], ["FSP", 6, 8, 3, 3], ["FSP", 6, 12, 4, 3], ["RE", 6, [0, 4, 8, 12, 1, 5, 9, 13, 2, 6, 10, 14, 3, 7, 11, 15]], ["CA", 3, 6, 11], ["CHR", 2, "shared", [3]], ["CA", 3, 4, 14], ["CHR", 1, "shared", [4]], ["CA", 2, 5, 14], ["CI", 1], ["FU", 8, [0, 1, 2, 3]], ["AN", 8, 0, 5], ["FU", 8, [1, 2, 3, 4]], ["AN", 8, 1, 4], ["FU", 8, [2, 3, 4, 5]], ["AN", 8, 2, 6], ["FU", 4, [0, 1, 2, 3]], ["SP", 4, 0, 48, [1], 1], ["AN", 4, 1, 2], ["FFSP", 4, 0, [4, 3, 2, 1], 1, 1], ["AN", 4, 1, 6], ["FU", 2, [0, 1, 2, 3]], ["SP", 2, 0, 1392, [1], 1], ["AN", 2, 1, 2], ["FFSP", 2, 0, [4, 3, 2, 1], 1, 1], ["AN", 2, 1, 6], ["PR", 5, 0, "auto_unroll_max_step$16"]]]], "r": [[0.000387901], 0, 1.36168, 1756340044], "v": "v0.6"}
{"i": [["[\"07f9fcad27bdd3233f86fe35a5185d33\", [1, 56, 56, 64], [3, 3, 64, 128], [1, 1, 1, 128], [1, 28, 28, 128]]", "cuda -keys=cuda,gpu -arch=sm_86 -max_num_threads=1024 -thread_warp_size=32", [-1, 16, 64, 49152, 2147483647, 1024, 8, 32], "", 0, []], [[], [["CI", 5], ["SP", 3, 0, 1, [1, 1, 1, 1], 1], ["SP", 3, 5, 28, [7, 1, 1, 4], 1], ["SP", 3, 10, 28, [1, 2, 2, 1], 1], ["SP", 3, 15, 128, [1, 16, 2, 1], 1], ["SP", 3, 20, 3, [1, 1], 1], ["SP", 3, 23, 3, [3, 1], 1], ["SP", 3, 26, 64, [1, 1], 1], ["RE", 3, [0, 5, 10, 15, 1, 6, 11, 16, 2, 7, 12, 17, 20, 23, 26, 21, 24, 27, 3, 8, 13, 18, 22, 25, 28, 4, 9, 14, 19]], ["FSP", 6, 0, 1, 3], ["FSP", 6, 4, 2, 3], ["FSP", 6, 8, 3, 3], ["FSP", 6, 12, 4, 3], ["RE", 6, [0, 4, 8, 12, 1, 5, 9, 13, 2, 6, 10, 14, 3, 7, 11, 15]], ["CA", 3, 6, 11], ["CHR", 2, "shared", [3]], ["CA", 3, 4, 14], ["CHR", 1, "shared", [4]], ["CA", 2, 5, 14], ["CI", 1], ["FU", 8, [0, 1, 2, 3]], ["AN", 8, 0, 5], ["FU", 8, [1, 2, 3, 4]], ["AN", 8, 1, 4], ["FU", 8, [2, 3, 4, 5]], ["AN", 8, 2, 6], ["FU", 4, [0, 1, 2, 3]], ["SP", 4, 0, 6, [1], 1], ["AN", 4, 1, 2], ["FFSP", 4, 0, [4, 3, 2, 1], 1, 1], ["AN", 4, 1, 6], ["FU", 2, [0, 1, 2, 3]], ["SP", 2, 0, 35, [1], 1], ["AN", 2, 1, 2], ["FFSP", 2, 0, [4, 3, 2, 1], 1, 1], ["AN", 2, 1, 6], ["PR", 5, 0, "auto_unroll_max_step$0"]]]], "r": [[0.000687556], 0, 1.39916, 1756340045], "v": "v0.6"}
{"i": [["[\"07f9fcad27bdd3233f86fe35a5185d33\", [1, 56, 56, 64], [3, 3, 64, 128], [1, 1, 1, 128], [1, 28, 28, 128]]", "cuda -keys=cuda,gpu -arch=sm_86 -max_num_threads=1024 -thread_warp_size=32", [-1, 16, 64, 49152, 2147483647, 1024, 8, 32], "", 0, []], [[], [["CI", 5], ["SP", 3, 0, 1, [1, 1, 1, 1], 1], ["SP", 3, 5, 28, [2, 7, 1, 1], 1], ["SP", 3, 10, 28, [2, 7, 1, 2], 1], ["SP", 3, 15, 128, [1, 4, 4, 4], 1], ["SP", 3, 20, 3, [3, 1], 1], ["SP", 3, 23, 3, [1, 3], 1], ["SP", 3, 26, 64, [1, 4], 1], ["RE", 3, [0, 5, 10, 15, 1, 6, 11, 16, 2, 7, 12, 17, 20, 23, 26, 21, 24, 27, 3, 8, 13, 18, 22, 25, 28, 4, 9, 14, 19]], ["FSP", 6, 0, 1, 3], ["FSP", 6, 4, 2, 3], ["FSP", 6, 8, 3, 3], ["FSP", 6, 12, 4, 3], ["RE", 6, [0, 4, 8, 12, 1, 5, 9, 13, 2, 6, 10, 14, 3, 7, 11, 15]], ["CA", 3, 6, 11], ["CHR", 2, "shared", [3]], ["CA", 3, 4, 14], ["CHR", 1, "shared", [4]], ["CA", 2, 5, 14], ["CI", 1], ["FU", 8, [0, 1, 2, 3]], ["AN", 8, 0, 5], ["FU", 8, [1, 2, 3, 4]], ["AN", 8, 1, 4], ["FU", 8, [2, 3, 4, 5]], ["AN", 8, 2, 6], ["FU", 4, [0, 1, 2, 3]], ["SP", 4, 0, 144, [1], 1], ["AN", 4, 1, 2], ["FFSP", 4, 0, [4, 3, 2, 1], 1, 1], ["AN", 4, 1, 6], ["FU", 2, [0, 1, 2, 3]], ["SP", 2, 0, 15, [1], 1], ["AN", 2, 1, 2], ["FFSP", 2, 0, [4, 3, 2, 1], 1, 1], ["AN", 2, 1, 6], ["PR", 5, 0, "auto_unroll_max_step$0"]]]], "r": [[0.000322534], 0, 1.46015, 1756340046], "v": "v0.6"}
{"i": [["[\"07f9fcad27bdd3233f86fe35a5185d33\", [1, 56, 56, 64], [3, 3, 64, 128], [1, 1, 1, 128], [1, 28, 28, 128]]", "cuda -keys=cuda,gpu -arch=sm_86 -max_num_threads=1024 -thread_warp_size=32", [-1, 16, 64, 49152, 2147483647, 1024, 8, 32], "", 0, []], [[], [["CI", 5], ["SP", 3, 0, 1, [1, 1, 1, 1], 1], ["SP", 3, 5, 28, [1, 7, 1, 1], 1], ["SP", 3, 10, 28, [1, 1, 14, 1], 1], ["SP", 3, 15, 128, [1, 32, 2, 1], 1], ["SP", 3, 20, 3, [1, 3], 1], ["SP", 3, 23, 3, [1, 1], 1], ["SP", 3, 26, 64, [1, 1], 1], ["RE", 3, [0, 5, 10, 15, 1, 6, 11, 16, 2, 7, 12, 17, 20, 23, 26, 21, 24, 27, 3, 8, 13, 18, 22, 25, 28, 4, 9, 14, 19]], ["FSP", 6, 0, 1, 3], ["FSP", 6, 4, 2, 3], ["FSP", 6, 8, 3, 3], ["FSP", 6, 12, 4, 3], ["RE", 6, [0, 4, 8, 12, 1, 5, 9, 13, 2, 6, 10, 14, 3, 7, 11, 15]], ["CA", 3, 6, 11], ["CHR", 2, "shared", [3]], ["CA", 3, 4, 14], ["CHR", 1, "shared", [4]], ["CA", 2, 5, 14], ["CI", 1], ["FU", 8, [0, 1, 2, 3]], ["AN", 8, 0, 5], ["FU", 8, [1, 2, 3, 4]], ["AN", 8, 1, 4], ["FU", 8, [2, 3, 4, 5]], ["AN", 8, 2, 6], ["FU", 4, [0, 1, 2, 3]], ["SP", 4, 0, 96, [1], 1], ["AN", 4, 1, 2], ["FFSP", 4, 0, [4, 3, 2, 1], 1, 1], ["AN", 4, 1, 6], ["FU", 2, [0, 1, 2, 3]], ["SP", 2, 0, 6480, [6], 1], ["AN", 2, 1, 2], ["FFSP", 2, 0, [4, 3, 2, 1], 1, 1], ["AN", 2, 1, 6], ["PR", 5, 0, "auto_unroll_max_step$64"]]]], "r": [[0.000216251], 0, 11.0731, 1756340057], "v": "v0.6"}
{"i": [["[\"07f9fcad27bdd3233f86fe35a5185d33\", [1, 56, 56, 64], [3, 3, 64, 128], [1, 1, 1, 128], [1, 28, 28, 128]]", "cuda -keys=cuda,gpu -arch=sm_86 -max_num_threads=1024 -thread_warp_size=32", [-1, 16, 64, 49152, 2147483647, 1024, 8, 32], "", 0, []], [[], [["CI", 5], ["SP", 3, 0, 1, [1, 1, 1, 1], 1], ["SP", 3, 5, 28, [2, 1, 2, 7], 1], ["SP", 3, 10, 28, [1, 1, 1, 14], 1], ["SP", 3, 15, 128, [1, 64, 1, 1], 1], ["SP", 3, 20, 3, [3, 1], 1], ["SP", 3, 23, 3, [1, 3], 1], ["SP", 3, 26, 64, [2, 2], 1], ["RE", 3, [0, 5, 10, 15, 1, 6, 11, 16, 2, 7, 12, 17, 20, 23, 26, 21, 24, 27, 3, 8, 13, 18, 22, 25, 28, 4, 9, 14, 19]], ["FSP", 6, 0, 1, 3], ["FSP", 6, 4, 2, 3], ["FSP", 6, 8, 3, 3], ["FSP", 6, 12, 4, 3], ["RE", 6, [0, 4, 8, 12, 1, 5, 9, 13, 2, 6, 10, 14, 3, 7, 11, 15]], ["CA", 3, 6, 11], ["CHR", 2, "shared", [3]], ["CA", 3, 4, 14], ["CHR", 1, "shared", [4]], ["CA", 2, 5, 14], ["CI", 1], ["FU", 8, [0, 1, 2, 3]], ["AN", 8, 0, 5], ["FU", 8, [1, 2, 3, 4]], ["AN", 8, 1, 4], ["FU", 8, [2, 3, 4, 5]], ["AN", 8, 2, 6], ["FU", 4, [0, 1, 2, 3]], ["SP", 4, 0, 36, [1], 1], ["AN", 4, 1, 2], ["FFSP", 4, 0, [4, 3, 2, 1], 1, 1], ["AN", 4, 1, 6], ["FU", 2, [0, 1, 2, 3]], ["SP", 2, 0, 580, [1], 1], ["AN", 2, 1, 2], ["FFSP", 2, 0, [4, 3, 2, 1], 1, 1], ["AN", 2, 1, 6], ["PR", 5, 0, "auto_unroll_max_step$0"]]]], "r": [[0.00292686], 0, 2.44309, 1756340058], "v": "v0.6"}
{"i": [["[\"08f7449d79e570b7274174709e5e5e01\", [1, 512], [1000, 512], [1, 1000], [1, 1000]]", "cuda -keys=cuda,gpu -arch=sm_86 -max_num_threads=1024 -thread_warp_size=32", [-1, 16, 64, 49152, 2147483647, 1024, 8, 32], "", 0, []], [[], [["SP", 2, 0, 1, [1, 1, 1, 1], 1], ["SP", 2, 5, 1000, [1, 200, 1, 5], 1], ["SP", 2, 10, 512, [4, 1], 1], ["RE", 2, [0, 5, 1, 6, 2, 7, 10, 11, 3, 8, 12, 4, 9]], ["FSP", 4, 0, 0, 3], ["FSP", 4, 4, 1, 3], ["RE", 4, [0, 4, 1, 5, 2, 6, 3, 7]], ["CA", 2, 4, 5], ["CHR", 1, "shared", [2]], ["CA", 2, 3, 6], ["CHR", 0, "shared", [3]], ["CA", 1, 4, 6], ["FU", 6, [0, 1]], ["AN", 6, 0, 5], ["FU", 6, [1, 2]], ["AN", 6, 1, 4], ["FU", 6, [2, 3]], ["AN", 6, 2, 6], ["FU", 3, [0, 1]], ["SP", 3, 0, 20, [1], 1], ["AN", 3, 1, 2], ["FFSP", 3, 0, [1, 0], 1, 1], ["AN", 3, 1, 6], ["FU", 1, [0, 1]], ["SP", 1, 0, 4, [1], 1], ["AN", 1, 1, 2], ["FFSP", 1, 0, [1, 0], 1, 1], ["AN", 1, 1, 6], ["PR", 4, 0, "auto_unroll_max_step$0"]]]], "r": [[0.000125894], 0, 1.02669, 1756340075], "v": "v0.6"}
{"i": [["[\"08f7449d79e570b7274174709e5e5e01\", [1, 512], [1000, 512], [1, 1000], [1, 1000]]", "cuda -keys=cuda,gpu -arch=sm_86 -max_num_threads=1024 -thread_warp_size=32", [-1, 16, 64, 49152, 2147483647, 1024, 8, 32], "", 0, []], [[], [["SP", 2, 0, 1, [1, 1, 1, 1], 1], ["SP", 2, 5, 1000, [1, 50, 2, 5], 1], ["SP", 2, 10, 512, [2, 2], 1], ["RE", 2, [0, 5, 1, 6, 2, 7, 10, 11, 3, 8, 12, 4, 9]], ["FSP", 4, 0, 0, 3], ["FSP", 4, 4, 1, 3], ["RE", 4, [0, 4, 1, 5, 2, 6, 3, 7]], ["CA", 2, 4, 5], ["CHR", 1, "shared", [2]], ["CA", 2, 3, 6], ["CHR", 0, "shared", [3]], ["CA", 1, 4, 6], ["FU", 6, [0, 1]], ["AN", 6, 0, 5], ["FU", 6, [1, 2]], ["AN", 6, 1, 4], ["FU", 6, [2, 3]], ["AN", 6, 2, 6], ["FU", 3, [0, 1]], ["SP", 3, 0, 40, [1], 1], ["AN", 3, 1, 2], ["FFSP", 3, 0, [1, 0], 1, 1], ["AN", 3, 1, 6], ["FU", 1, [0, 1]], ["SP", 1, 0, 4, [1], 1], ["AN", 1, 1, 2], ["FFSP", 1, 0, [1, 0], 1, 1], ["AN", 1, 1, 6], ["PR", 4, 0, "auto_unroll_max_step$64"]]]], "r": [[0.000100819], 0, 1.29982, 1756340076], "v": "v0.6"}
{"i": [["[\"08f7449d79e570b7274174709e5e5e01\", [1, 512], [1000, 512], [1, 1000], [1, 1000]]", "cuda -keys=cuda,gpu -arch=sm_86 -max_num_threads=1024 -thread_warp_size=32", [-1, 16, 64, 49152, 2147483647, 1024, 8, 32], "", 0, []], [[], [["SP", 2, 0, 1, [1, 1, 1, 1], 1], ["SP", 2, 5, 1000, [4, 125, 1, 1], 1], ["SP", 2, 10, 512, [2, 8], 1], ["RE", 2, [0, 5, 1, 6, 2, 7, 10, 11, 3, 8, 12, 4, 9]], ["FSP", 4, 0, 0, 3], ["FSP", 4, 4, 1, 3], ["RE", 4, [0, 4, 1, 5, 2, 6, 3, 7]], ["CA", 2, 4, 5], ["CHR", 1, "shared", [2]], ["CA", 2, 3, 6], ["CHR", 0, "shared", [3]], ["CA", 1, 4, 6], ["FU", 6, [0, 1]], ["AN", 6, 0, 5], ["FU", 6, [1, 2]], ["AN", 6, 1, 4], ["FU", 6, [2, 3]], ["AN", 6, 2, 6], ["FU", 3, [0, 1]], ["SP", 3, 0, 4, [1], 1], ["AN", 3, 1, 2], ["FFSP", 3, 0, [1, 0], 1, 1], ["AN", 3, 1, 6], ["FU", 1, [0, 1]], ["SP", 1, 0, 4, [1], 1], ["AN", 1, 1, 2], ["FFSP", 1, 0, [1, 0], 1, 1], ["AN", 1, 1, 6], ["PR", 4, 0, "auto_unroll_max_step$0"]]]], "r": [[8.56248e-05], 0, 1.22948, 1756340077], "v": "v0.6"}
{"i": [["[\"08f7449d79e570b7274174709e5e5e01\", [1, 512], [1000, 512], [1, 1000], [1, 1000]]", "cuda -keys=cuda,gpu -arch=sm_86 -max_num_threads=1024 -thread_warp_size=32", [-1, 16, 64, 49152, 2147483647, 1024, 8, 32], "", 0, []], [[], [["SP", 2, 0, 1, [1, 1, 1, 1], 1], ["SP", 2, 5, 1000, [1, 200, 5, 1], 1], ["SP", 2, 10, 512, [1, 2], 1], ["RE", 2, [0, 5, 1, 6, 2, 7, 10, 11, 3, 8, 12, 4, 9]], ["FSP", 4, 0, 0, 3], ["FSP", 4, 4, 1, 3], ["RE", 4, [0, 4, 1, 5, 2, 6, 3, 7]], ["CA", 2, 4, 5], ["CHR", 1, "shared", [2]], ["CA", 2, 3, 6], ["CHR", 0, "shared", [3]], ["CA", 1, 4, 6], ["FU", 6, [0, 1]], ["AN", 6, 0, 5], ["FU", 6, [1, 2]], ["AN", 6, 1, 4], ["FU", 6, [2, 3]], ["AN", 6, 2, 6], ["FU", 3, [0, 1]], ["SP", 3, 0, 10, [1], 1], ["AN", 3, 1, 2], ["FFSP", 3, 0, [1, 0], 1, 1], ["AN", 3, 1, 6], ["FU", 1, [0, 1]], ["SP", 1, 0, 2, [1], 1], ["AN", 1, 1, 2], ["FFSP", 1, 0, [1, 0], 1, 1], ["AN", 1, 1, 6], ["PR", 4, 0, "auto_unroll_max_step$512"]]]], "r": [[0.000199863], 0, 1.21394, 1756340078], "v": "v0.6"}
{"i": [["[\"08f7449d79e570b7274174709e5e5e01\", [1, 512], [1000, 512], [1, 1000], [1, 1000]]", "cuda -keys=cuda,gpu -arch=sm_86 -max_num_threads=1024 -thread_warp_size=32", [-1, 16, 64, 49152, 2147483647, 1024, 8, 32], "", 0, []], [[], [["SP", 2, 0, 1, [1, 1, 1, 1], 1], ["SP", 2, 5, 1000, [8, 25, 1, 1], 1], ["SP", 2, 10, 512, [1, 4], 1], ["RE", 2, [0, 5, 1, 6, 2, 7, 10, 11, 3, 8, 12, 4, 9]], ["FSP", 4, 0, 0, 3], ["FSP", 4, 4, 1, 3], ["RE", 4, [0, 4, 1, 5, 2, 6, 3, 7]], ["CA", 2, 4, 5], ["CHR", 1, "shared", [2]], ["CA", 2, 3, 6], ["CHR", 0, "shared", [3]], ["CA", 1, 4, 6], ["FU", 6, [0, 1]], ["AN", 6, 0, 5], ["FU", 6, [1, 2]], ["AN", 6, 1, 4], ["FU", 6, [2, 3]], ["AN", 6, 2, 6], ["FU", 3, [0, 1]], ["SP", 3, 0, 4, [1], 1], ["AN", 3, 1, 2], ["FFSP", 3, 0, [1, 0], 1, 1], ["AN", 3, 1, 6], ["FU", 1, [0, 1]], ["SP", 1, 0, 4, [2], 1], ["AN", 1, 1, 2], ["FFSP", 1, 0, [1, 0], 1, 1], ["AN", 1, 1, 6], ["PR", 4, 0, "auto_unroll_max_step$0"]]]], "r": [[5.1646e-05], 0, 1.24639, 1756340079], "v": "v0.6"}
{"i": [["[\"08f7449d79e570b7274174709e5e5e01\", [1, 512], [1000, 512], [1, 1000], [1, 1000]]", "cuda -keys=cuda,gpu -arch=sm_86 -max_num_threads=1024 -thread_warp_size=32", [-1, 16, 64, 49152, 2147483647, 1024, 8, 32], "", 0, []], [[], [["SP", 2, 0, 1, [1, 1, 1, 1], 1], ["SP", 2, 5, 1000, [1, 125, 2, 4], 1], ["SP", 2, 10, 512, [2, 2], 1], ["RE", 2, [0, 5, 1, 6, 2, 7, 10, 11, 3, 8, 12, 4, 9]], ["FSP", 4, 0, 0, 3], ["FSP", 4, 4, 1, 3], ["RE", 4, [0, 4, 1, 5, 2, 6, 3, 7]], ["CA", 2, 4, 5], ["CHR", 1, "shared", [2]], ["CA", 2, 3, 6], ["CHR", 0, "shared", [3]], ["CA", 1, 4, 6], ["FU", 6, [0, 1]], ["AN", 6, 0, 5], ["FU", 6, [1, 2]], ["AN", 6, 1, 4], ["FU", 6, [2, 3]], ["AN", 6, 2, 6], ["FU", 3, [0, 1]], ["SP", 3, 0, 32, [1], 1], ["AN", 3, 1, 2], ["FFSP", 3, 0, [1, 0], 1, 1], ["AN", 3, 1, 6], ["FU", 1, [0, 1]], ["SP", 1, 0, 4, [4], 1], ["AN", 1, 1, 2], ["FFSP", 1, 0, [1, 0], 1, 1], ["AN", 1, 1, 6], ["PR", 4, 0, "auto_unroll_max_step$16"]]]], "r": [[0.000193754], 0, 1.26537, 1756340080], "v": "v0.6"}
{"i": [["[\"08f7449d79e570b7274174709e5e5e01\", [1, 512], [1000, 512], [1, 1000], [1, 1000]]", "cuda -keys=cuda,gpu -arch=sm_86 -max_num_threads=1024 -thread_warp_size=32", [-1, 16, 64, 49152, 2147483647, 1024, 8, 32], "", 0, []], [[], [["SP", 2, 0, 1, [1, 1, 1, 1], 1], ["SP", 2, 5, 1000, [1, 50, 1, 10], 1], ["SP", 2, 10, 512, [1, 4], 1], ["RE", 2, [0, 5, 1, 6, 2, 7, 10, 11, 3, 8, 12, 4, 9]], ["FSP", 4, 0, 0, 3], ["FSP", 4, 4, 1, 3], ["RE", 4, [0, 4, 1, 5, 2, 6, 3, 7]], ["CA", 2, 4, 5], ["CHR", 1, "shared", [2]], ["CA", 2, 3, 6], ["CHR", 0, "shared", [3]], ["CA", 1, 4, 6], ["FU", 6, [0, 1]], ["AN", 6, 0, 5], ["FU", 6, [1, 2]], ["AN", 6, 1, 4], ["FU", 6, [2, 3]], ["AN", 6, 2, 6], ["FU", 3, [0, 1]], ["SP", 3, 0, 40, [1], 1], ["AN", 3, 1, 2], ["FFSP", 3, 0, [1, 0], 1, 1], ["AN", 3, 1, 6], ["FU", 1, [0, 1]], ["SP", 1, 0, 4, [2], 1], ["AN", 1, 1, 2], ["FFSP", 1, 0, [1, 0], 1, 1], ["AN", 1, 1, 6], ["PR", 4, 0, "auto_unroll_max_step$64"]]]], "r": [[9.82161e-05], 0, 1.29312, 1756340081], "v": "v0.6"}
{"i": [["[\"08f7449d79e570b7274174709e5e5e01\", [1, 512], [1000, 512], [1, 1000], [1, 1000]]", "cuda -keys=cuda,gpu -arch=sm_86 -max_num_threads=1024 -thread_warp_size=32", [-1, 16, 64, 49152, 2147483647, 1024, 8, 32], "", 0, []], [[], [["SP", 2, 0, 1, [1, 1, 1, 1], 1], ["SP", 2, 5, 1000, [1, 250, 1, 4], 1], ["SP", 2, 10, 512, [2, 1], 1], ["RE", 2, [0, 5, 1, 6, 2, 7, 10, 11, 3, 8, 12, 4, 9]], ["FSP", 4, 0, 0, 3], ["FSP", 4, 4, 1, 3], ["RE", 4, [0, 4, 1, 5, 2, 6, 3, 7]], ["CA", 2, 4, 5], ["CHR", 1, "shared", [2]], ["CA", 2, 3, 6], ["CHR", 0, "shared", [3]], ["CA", 1, 4, 6], ["FU", 6, [0, 1]], ["AN", 6, 0, 5], ["FU", 6, [1, 2]], ["AN", 6, 1, 4], ["FU", 6, [2, 3]], ["AN", 6, 2, 6], ["FU", 3, [0, 1]], ["SP", 3, 0, 4, [1], 1], ["AN", 3, 1, 2], ["FFSP", 3, 0, [1, 0], 1, 1], ["AN", 3, 1, 6], ["FU", 1, [0, 1]], ["SP", 1, 0, 2, [1], 1], ["AN", 1, 1, 2], ["FFSP", 1, 0, [1, 0], 1, 1], ["AN", 1, 1, 6], ["PR", 4, 0, "auto_unroll_max_step$0"]]]], "r": [[0.000215602], 0, 1.17187, 1756340082], "v": "v0.6"}
{"i": [["[\"8c53ca2904398da2889aa7508082d7bb\", [1, 7, 7, 512], [1, 1, 1, 512]]", "cuda -keys=cuda,gpu -arch=sm_86 -max_num_threads=1024 -thread_warp_size=32", [-1, 16, 64, 49152, 2147483647, 1024, 8, 32], "", 0, []], [[], [["FU", 2, [0, 1, 2, 3]], ["SP", 2, 0, 512, [1], 1], ["AN", 2, 0, 5], ["AN", 2, 1, 6], ["FU", 1, [0, 1, 2, 3]], ["SP", 1, 0, 512, [64], 1], ["AN", 1, 0, 5], ["AN", 1, 1, 6], ["PR", 1, 0, "auto_unroll_max_step$512"]]]], "r": [[3.72703e-06], 0, 1.28457, 1756340114], "v": "v0.6"}
{"i": [["[\"8c53ca2904398da2889aa7508082d7bb\", [1, 7, 7, 512], [1, 1, 1, 512]]", "cuda -keys=cuda,gpu -arch=sm_86 -max_num_threads=1024 -thread_warp_size=32", [-1, 16, 64, 49152, 2147483647, 1024, 8, 32], "", 0, []], [[], [["FU", 2, [0, 1, 2, 3]], ["SP", 2, 0, 512, [2], 1], ["AN", 2, 0, 5], ["AN", 2, 1, 6], ["FU", 1, [0, 1, 2, 3]], ["SP", 1, 0, 512, [2], 1], ["AN", 1, 0, 5], ["AN", 1, 1, 6], ["PR", 1, 0, "auto_unroll_max_step$1024"]]]], "r": [[3.74842e-06], 0, 1.06755, 1756340115], "v": "v0.6"}
{"i": [["[\"8c53ca2904398da2889aa7508082d7bb\", [1, 7, 7, 512], [1, 1, 1, 512]]", "cuda -keys=cuda,gpu -arch=sm_86 -max_num_threads=1024 -thread_warp_size=32", [-1, 16, 64, 49152, 2147483647, 1024, 8, 32], "", 0, []], [[], [["FU", 2, [0, 1, 2, 3]], ["SP", 2, 0, 512, [32], 1], ["AN", 2, 0, 5], ["AN", 2, 1, 6], ["FU", 1, [0, 1, 2, 3]], ["SP", 1, 0, 512, [64], 1], ["AN", 1, 0, 5], ["AN", 1, 1, 6], ["PR", 1, 0, "auto_unroll_max_step$64"]]]], "r": [[3.47542e-06], 0, 1.03855, 1756340116], "v": "v0.6"}
{"i": [["[\"8c53ca2904398da2889aa7508082d7bb\", [1, 7, 7, 512], [1, 1, 1, 512]]", "cuda -keys=cuda,gpu -arch=sm_86 -max_num_threads=1024 -thread_warp_size=32", [-1, 16, 64, 49152, 2147483647, 1024, 8, 32], "", 0, []], [[], [["FU", 2, [0, 1, 2, 3]], ["SP", 2, 0, 512, [4], 1], ["AN", 2, 0, 5], ["AN", 2, 1, 6], ["FU", 1, [0, 1, 2, 3]], ["SP", 1, 0, 512, [64], 1], ["AN", 1, 0, 5], ["AN", 1, 1, 6], ["PR", 1, 0, "auto_unroll_max_step$1024"]]]], "r": [[3.4765e-06], 0, 1.37722, 1756340117], "v": "v0.6"}
{"i": [["[\"8c53ca2904398da2889aa7508082d7bb\", [1, 7, 7, 512], [1, 1, 1, 512]]", "cuda -keys=cuda,gpu -arch=sm_86 -max_num_threads=1024 -thread_warp_size=32", [-1, 16, 64, 49152, 2147483647, 1024, 8, 32], "", 0, []], [[], [["FU", 2, [0, 1, 2, 3]], ["SP", 2, 0, 512, [4], 1], ["AN", 2, 0, 5], ["AN", 2, 1, 6], ["FU", 1, [0, 1, 2, 3]], ["SP", 1, 0, 512, [64], 1], ["AN", 1, 0, 5], ["AN", 1, 1, 6], ["PR", 1, 0, "auto_unroll_max_step$512"]]]], "r": [[3.4769e-06], 0, 1.0602, 1756340118], "v": "v0.6"}
{"i": [["[\"8c53ca2904398da2889aa7508082d7bb\", [1, 7, 7, 512], [1, 1, 1, 512]]", "cuda -keys=cuda,gpu -arch=sm_86 -max_num_threads=1024 -thread_warp_size=32", [-1, 16, 64, 49152, 2147483647, 1024, 8, 32], "", 0, []], [[], [["FU", 2, [0, 1, 2, 3]], ["SP", 2, 0, 512, [4], 1], ["AN", 2, 0, 5], ["AN", 2, 1, 6], ["FU", 1, [0, 1, 2, 3]], ["SP", 1, 0, 512, [32], 1], ["AN", 1, 0, 5], ["AN", 1, 1, 6], ["PR", 1, 0, "auto_unroll_max_step$512"]]]], "r": [[3.3362e-06], 0, 1.02113, 1756340119], "v": "v0.6"}
{"i": [["[\"8c53ca2904398da2889aa7508082d7bb\", [1, 7, 7, 512], [1, 1, 1, 512]]", "cuda -keys=cuda,gpu -arch=sm_86 -max_num_threads=1024 -thread_warp_size=32", [-1, 16, 64, 49152, 2147483647, 1024, 8, 32], "", 0, []], [[], [["FU", 2, [0, 1, 2, 3]], ["SP", 2, 0, 512, [32], 1], ["AN", 2, 0, 5], ["AN", 2, 1, 6], ["FU", 1, [0, 1, 2, 3]], ["SP", 1, 0, 512, [8], 1], ["AN", 1, 0, 5], ["AN", 1, 1, 6], ["PR", 1, 0, "auto_unroll_max_step$512"]]]], "r": [[3.33472e-06], 0, 1.10223, 1756340119], "v": "v0.6"}
{"i": [["[\"8c53ca2904398da2889aa7508082d7bb\", [1, 7, 7, 512], [1, 1, 1, 512]]", "cuda -keys=cuda,gpu -arch=sm_86 -max_num_threads=1024 -thread_warp_size=32", [-1, 16, 64, 49152, 2147483647, 1024, 8, 32], "", 0, []], [[], [["FU", 2, [0, 1, 2, 3]], ["SP", 2, 0, 512, [32], 1], ["AN", 2, 0, 5], ["AN", 2, 1, 6], ["FU", 1, [0, 1, 2, 3]], ["SP", 1, 0, 512, [1], 1], ["AN", 1, 0, 5], ["AN", 1, 1, 6], ["PR", 1, 0, "auto_unroll_max_step$512"]]]], "r": [[3.77223e-06], 0, 1.07258, 1756340120], "v": "v0.6"}
{"i": [["[\"d78e8eb6021c4cdda0ad7775d10f751a\", [1, 7, 7, 512], [4, 4, 512, 512], [1, 7, 7, 512], [1, 7, 7, 512]]", "cuda -keys=cuda,gpu -arch=sm_86 -max_num_threads=1024 -thread_warp_size=32", [-1, 16, 64, 49152, 2147483647, 1024, 8, 32], "", 0, []], [[], [["CI", 9], ["AN", 8, 0, 1], ["AN", 8, 1, 1], ["SP", 8, 2, 16, [4], 1], ["SP", 8, 4, 512, [8], 1], ["AN", 8, 6, 1], ["AN", 8, 7, 1], ["RE", 8, [2, 4, 3, 5, 0, 1, 6, 7]], ["CI", 7], ["CHW", 6, "local"], ["SP", 6, 0, 4, [1, 2, 2, 1], 1], ["SP", 6, 5, 4, [2, 1, 2, 1], 1], ["SP", 6, 10, 16, [1, 1, 1, 8], 1], ["SP", 6, 15, 512, [1, 32, 2, 1], 1], ["SP", 6, 20, 512, [1, 1], 1], ["RE", 6, [0, 5, 10, 15, 1, 6, 11, 16, 2, 7, 12, 17, 20, 21, 3, 8, 13, 18, 22, 4, 9, 14, 19]], ["FSP", 7, 0, 10, 3], ["FSP", 7, 4, 11, 3], ["FSP", 7, 8, 12, 3], ["FSP", 7, 12, 13, 3], ["RE", 7, [0, 4, 8, 12, 1, 5, 9, 13, 2, 6, 10, 14, 3, 7, 11, 15]], ["CA", 6, 7, 11], ["CHR", 5, "shared", [6]], ["CA", 6, 7, 12], ["CHR", 4, "shared", [7]], ["CA", 5, 8, 12], ["AN", 4, 0, 1], ["AN", 4, 1, 1], ["SP", 4, 2, 16, [2], 1], ["SP", 4, 4, 512, [2], 1], ["AN", 4, 6, 1], ["AN", 4, 7, 1], ["RE", 4, [2, 4, 3, 5, 0, 1, 6, 7]], ["CI", 3], ["CA", 2, 4, 3], ["CI", 1], ["FU", 14, [0, 1, 2, 3]], ["SP", 14, 0, 25088, [32], 1], ["AN", 14, 0, 5], ["AN", 14, 1, 6], ["FU", 11, [0, 1, 2, 3]], ["SP", 11, 0, 8192, [64], 1], ["AN", 11, 0, 5], ["AN", 11, 1, 6], ["FU", 9, [0, 1, 2, 3]], ["AN", 9, 0, 5], ["FU", 9, [1, 2, 3, 4]], ["AN", 9, 1, 4], ["FU", 9, [2, 3, 4, 5]], ["AN", 9, 2, 6], ["FU", 7, [0, 1, 2, 3]], ["SP", 7, 0, 16, [1], 1], ["AN", 7, 1, 2], ["FFSP", 7, 0, [13, 12, 11, 10], 1, 1], ["AN", 7, 1, 6], ["FU", 5, [0, 1, 2, 3]], ["SP", 5, 0, 64, [1], 1], ["AN", 5, 1, 2], ["FFSP", 5, 0, [13, 12, 11, 10], 1, 1], ["AN", 5, 1, 6], ["FU", 4, [0, 1, 2, 3]], ["SP", 4, 0, 8192, [32], 1], ["AN", 4, 0, 5], ["AN", 4, 1, 6], ["PR", 4, 0, "auto_unroll_max_step$64"], ["PR", 8, 0, "auto_unroll_max_step$16"], ["PR", 11, 0, "auto_unroll_max_step$512"]]]], "r": [[0.00052014], 0, 1.68261, 1756340203], "v": "v0.6"}
{"i": [["[\"d78e8eb6021c4cdda0ad7775d10f751a\", [1, 7, 7, 512], [4, 4, 512, 512], [1, 7, 7, 512], [1, 7, 7, 512]]", "cuda -keys=cuda,gpu -arch=sm_86 -max_num_threads=1024 -thread_warp_size=32", [-1, 16, 64, 49152, 2147483647, 1024, 8, 32], "", 0, []], [[], [["CI", 9], ["AN", 8, 0, 1], ["AN", 8, 1, 1], ["SP", 8, 2, 16, [1], 1], ["SP", 8, 4, 512, [1], 1], ["AN", 8, 6, 1], ["AN", 8, 7, 1], ["RE", 8, [2, 4, 3, 5, 0, 1, 6, 7]], ["CI", 7], ["CHW", 6, "local"], ["SP", 6, 0, 4, [1, 2, 2, 1], 1], ["SP", 6, 5, 4, [1, 2, 1, 1], 1], ["SP", 6, 10, 16, [2, 4, 1, 2], 1], ["SP", 6, 15, 512, [1, 2, 1, 2], 1], ["SP", 6, 20, 512, [1, 2], 1], ["RE", 6, [0, 5, 10, 15, 1, 6, 11, 16, 2, 7, 12, 17, 20, 21, 3, 8, 13, 18, 22, 4, 9, 14, 19]], ["FSP", 7, 0, 10, 3], ["FSP", 7, 4, 11, 3], ["FSP", 7, 8, 12, 3], ["FSP", 7, 12, 13, 3], ["RE", 7, [0, 4, 8, 12, 1, 5, 9, 13, 2, 6, 10, 14, 3, 7, 11, 15]], ["CA", 6, 7, 11], ["CHR", 5, "shared", [6]], ["CA", 6, 7, 12], ["CHR", 4, "shared", [7]], ["CA", 5, 8, 12], ["AN", 4, 0, 1], ["AN", 4, 1, 1], ["SP", 4, 2, 16, [16], 1], ["SP", 4, 4, 512, [64], 1], ["AN", 4, 6, 1], ["AN", 4, 7, 1], ["RE", 4, [2, 4, 3, 5, 0, 1, 6, 7]], ["CI", 3], ["CA", 2, 4, 3], ["CI", 1], ["FU", 14, [0, 1, 2, 3]], ["SP", 14, 0, 25088, [32], 1], ["AN", 14, 0, 5], ["AN", 14, 1, 6], ["FU", 11, [0, 1, 2, 3]], ["SP", 11, 0, 8192, [32], 1], ["AN", 11, 0, 5], ["AN", 11, 1, 6], ["FU", 9, [0, 1, 2, 3]], ["AN", 9, 0, 5], ["FU", 9, [1, 2, 3, 4]], ["AN", 9, 1, 4], ["FU", 9, [2, 3, 4, 5]], ["AN", 9, 2, 6], ["FU", 7, [0, 1, 2, 3]], ["SP", 7, 0, 8, [1], 1], ["AN", 7, 1, 2], ["FFSP", 7, 0, [13, 12, 11, 10], 1, 1], ["AN", 7, 1, 6], ["FU", 5, [0, 1, 2, 3]], ["SP", 5, 0, 8, [1], 1], ["AN", 5, 1, 2], ["FFSP", 5, 0, [13, 12, 11, 10], 1, 1], ["AN", 5, 1, 6], ["FU", 4, [0, 1, 2, 3]], ["SP", 4, 0, 8192, [4], 1], ["AN", 4, 0, 5], ["AN", 4, 1, 6], ["PR", 4, 0, "auto_unroll_max_step$64"], ["PR", 8, 0, "auto_unroll_max_step$512"], ["PR", 11, 0, "auto_unroll_max_step$64"]]]], "r": [[0.000153362], 0, 1.14899, 1756340203], "v": "v0.6"}
{"i": [["[\"d78e8eb6021c4cdda0ad7775d10f751a\", [1, 7, 7, 512], [4, 4, 512, 512], [1, 7, 7, 512], [1, 7, 7, 512]]", "cuda -keys=cuda,gpu -arch=sm_86 -max_num_threads=1024 -thread_warp_size=32", [-1, 16, 64, 49152, 2147483647, 1024, 8, 32], "", 0, []], [[], [["CI", 9], ["AN", 8, 0, 1], ["AN", 8, 1, 1], ["SP", 8, 2, 16, [16], 1], ["SP", 8, 4, 512, [32], 1], ["AN", 8, 6, 1], ["AN", 8, 7, 1], ["RE", 8, [2, 4, 3, 5, 0, 1, 6, 7]], ["CI", 7], ["CHW", 6, "local"], ["SP", 6, 0, 4, [1, 1, 1, 1], 1], ["SP", 6, 5, 4, [1, 2, 1, 2], 1], ["SP", 6, 10, 16, [4, 4, 1, 1], 1], ["SP", 6, 15, 512, [2, 8, 1, 16], 1], ["SP", 6, 20, 512, [2, 1], 1], ["RE", 6, [0, 5, 10, 15, 1, 6, 11, 16, 2, 7, 12, 17, 20, 21, 3, 8, 13, 18, 22, 4, 9, 14, 19]], ["FSP", 7, 0, 10, 3], ["FSP", 7, 4, 11, 3], ["FSP", 7, 8, 12, 3], ["FSP", 7, 12, 13, 3], ["RE", 7, [0, 4, 8, 12, 1, 5, 9, 13, 2, 6, 10, 14, 3, 7, 11, 15]], ["CA", 6, 7, 11], ["CHR", 5, "shared", [6]], ["CA", 6, 7, 12], ["CHR", 4, "shared", [7]], ["CA", 5, 8, 12], ["AN", 4, 0, 1], ["AN", 4, 1, 1], ["SP", 4, 2, 16, [8], 1], ["SP", 4, 4, 512, [1], 1], ["AN", 4, 6, 1], ["AN", 4, 7, 1], ["RE", 4, [2, 4, 3, 5, 0, 1, 6, 7]], ["CI", 3], ["CA", 2, 4, 3], ["CI", 1], ["FU", 14, [0, 1, 2, 3]], ["SP", 14, 0, 25088, [32], 1], ["AN", 14, 0, 5], ["AN", 14, 1, 6], ["FU", 11, [0, 1, 2, 3]], ["SP", 11, 0, 8192, [32], 1], ["AN", 11, 0, 5], ["AN", 11, 1, 6], ["FU", 9, [0, 1, 2, 3]], ["AN", 9, 0, 5], ["FU", 9, [1, 2, 3, 4]], ["AN", 9, 1, 4], ["FU", 9, [2, 3, 4, 5]], ["AN", 9, 2, 6], ["FU", 7, [0, 1, 2, 3]], ["SP", 7, 0, 64, [1], 1], ["AN", 7, 1, 2], ["FFSP", 7, 0, [13, 12, 11, 10], 1, 1], ["AN", 7, 1, 6], ["FU", 5, [0, 1, 2, 3]], ["SP", 5, 0, 4, [1], 1], ["AN", 5, 1, 2], ["FFSP", 5, 0, [13, 12, 11, 10], 1, 1], ["AN", 5, 1, 6], ["FU", 4, [0, 1, 2, 3]], ["SP", 4, 0, 8192, [32], 1], ["AN", 4, 0, 5], ["AN", 4, 1, 6], ["PR", 4, 0, "auto_unroll_max_step$512"], ["PR", 8, 0, "auto_unroll_max_step$1024"], ["PR", 11, 0, "auto_unroll_max_step$0"]]]], "r": [[0.000995239], 0, 1.86687, 1756340204], "v": "v0.6"}
{"i": [["[\"d78e8eb6021c4cdda0ad7775d10f751a\", [1, 7, 7, 512], [4, 4, 512, 512], [1, 7, 7, 512], [1, 7, 7, 512]]", "cuda -keys=cuda,gpu -arch=sm_86 -max_num_threads=1024 -thread_warp_size=32", [-1, 16, 64, 49152, 2147483647, 1024, 8, 32], "", 0, []], [[], [["CI", 9], ["AN", 8, 0, 1], ["AN", 8, 1, 1], ["SP", 8, 2, 16, [8], 1], ["SP", 8, 4, 512, [2], 1], ["AN", 8, 6, 1], ["AN", 8, 7, 1], ["RE", 8, [2, 4, 3, 5, 0, 1, 6, 7]], ["CI", 7], ["CHW", 6, "local"], ["SP", 6, 0, 4, [1, 1, 2, 1], 1], ["SP", 6, 5, 4, [1, 1, 2, 1], 1], ["SP", 6, 10, 16, [1, 16, 1, 1], 1], ["SP", 6, 15, 512, [2, 2, 4, 4], 1], ["SP", 6, 20, 512, [4, 8], 1], ["RE", 6, [0, 5, 10, 15, 1, 6, 11, 16, 2, 7, 12, 17, 20, 21, 3, 8, 13, 18, 22, 4, 9, 14, 19]], ["FSP", 7, 0, 10, 3], ["FSP", 7, 4, 11, 3], ["FSP", 7, 8, 12, 3], ["FSP", 7, 12, 13, 3], ["RE", 7, [0, 4, 8, 12, 1, 5, 9, 13, 2, 6, 10, 14, 3, 7, 11, 15]], ["CA", 6, 7, 11], ["CHR", 5, "shared", [6]], ["CA", 6, 7, 12], ["CHR", 4, "shared", [7]], ["CA", 5, 8, 12], ["AN", 4, 0, 1], ["AN", 4, 1, 1], ["SP", 4, 2, 16, [4], 1], ["SP", 4, 4, 512, [16], 1], ["AN", 4, 6, 1], ["AN", 4, 7, 1], ["RE", 4, [2, 4, 3, 5, 0, 1, 6, 7]], ["CI", 3], ["CA", 2, 4, 3], ["CI", 1], ["FU", 14, [0, 1, 2, 3]], ["SP", 14, 0, 25088, [32], 1], ["AN", 14, 0, 5], ["AN", 14, 1, 6], ["FU", 11, [0, 1, 2, 3]], ["SP", 11, 0, 8192, [32], 1], ["AN", 11, 0, 5], ["AN", 11, 1, 6], ["FU", 9, [0, 1, 2, 3]], ["AN", 9, 0, 5], ["FU", 9, [1, 2, 3, 4]], ["AN", 9, 1, 4], ["FU", 9, [2, 3, 4, 5]], ["AN", 9, 2, 6], ["FU", 7, [0, 1, 2, 3]], ["SP", 7, 0, 1024, [1], 1], ["AN", 7, 1, 2], ["FFSP", 7, 0, [13, 12, 11, 10], 1, 1], ["AN", 7, 1, 6], ["FU", 5, [0, 1, 2, 3]], ["SP", 5, 0, 64, [1], 1], ["AN", 5, 1, 2], ["FFSP", 5, 0, [13, 12, 11, 10], 1, 1], ["AN", 5, 1, 6], ["FU", 4, [0, 1, 2, 3]], ["SP", 4, 0, 8192, [32], 1], ["AN", 4, 0, 5], ["AN", 4, 1, 6], ["PR", 4, 0, "auto_unroll_max_step$16"], ["PR", 8, 0, "auto_unroll_max_step$0"], ["PR", 11, 0, "auto_unroll_max_step$1024"]]]], "r": [[0.000155047], 0, 2.16418, 1756340205], "v": "v0.6"}
{"i": [["[\"d78e8eb6021c4cdda0ad7775d10f751a\", [1, 7, 7, 512], [4, 4, 512, 512], [1, 7, 7, 512], [1, 7, 7, 512]]", "cuda -keys=cuda,gpu -arch=sm_86 -max_num_threads=1024 -thread_warp_size=32", [-1, 16, 64, 49152, 2147483647, 1024, 8, 32], "", 0, []], [[], [["CI", 9], ["AN", 8, 0, 1], ["AN", 8, 1, 1], ["SP", 8, 2, 16, [4], 1], ["SP", 8, 4, 512, [32], 1], ["AN", 8, 6, 1], ["AN", 8, 7, 1], ["RE", 8, [2, 4, 3, 5, 0, 1, 6, 7]], ["CI", 7], ["CHW", 6, "local"], ["SP", 6, 0, 4, [1, 1, 2, 1], 1], ["SP", 6, 5, 4, [1, 1, 1, 2], 1], ["SP", 6, 10, 16, [1, 8, 1, 1], 1], ["SP", 6, 15, 512, [1, 8, 4, 2], 1], ["SP", 6, 20, 512, [2, 1], 1], ["RE", 6, [0, 5, 10, 15, 1, 6, 11, 16, 2, 7, 12, 17, 20, 21, 3, 8, 13, 18, 22, 4, 9, 14, 19]], ["FSP", 7, 0, 10, 3], ["FSP", 7, 4, 11, 3], ["FSP", 7, 8, 12, 3], ["FSP", 7, 12, 13, 3], ["RE", 7, [0, 4, 8, 12, 1, 5, 9, 13, 2, 6, 10, 14, 3, 7, 11, 15]], ["CA", 6, 7, 11], ["CHR", 5, "shared", [6]], ["CA", 6, 7, 12], ["CHR", 4, "shared", [7]], ["CA", 5, 8, 12], ["AN", 4, 0, 1], ["AN", 4, 1, 1], ["SP", 4, 2, 16, [16], 1], ["SP", 4, 4, 512, [2], 1], ["AN", 4, 6, 1], ["AN", 4, 7, 1], ["RE", 4, [2, 4, 3, 5, 0, 1, 6, 7]], ["CI", 3], ["CA", 2, 4, 3], ["CI", 1], ["FU", 14, [0, 1, 2, 3]], ["SP", 14, 0, 25088, [32], 1], ["AN", 14, 0, 5], ["AN", 14, 1, 6], ["FU", 11, [0, 1, 2, 3]], ["SP", 11, 0, 8192, [32], 1], ["AN", 11, 0, 5], ["AN", 11, 1, 6], ["FU", 9, [0, 1, 2, 3]], ["AN", 9, 0, 5], ["FU", 9, [1, 2, 3, 4]], ["AN", 9, 1, 4], ["FU", 9, [2, 3, 4, 5]], ["AN", 9, 2, 6], ["FU", 7, [0, 1, 2, 3]], ["SP", 7, 0, 64, [1], 1], ["AN", 7, 1, 2], ["FFSP", 7, 0, [13, 12, 11, 10], 1, 1], ["AN", 7, 1, 6], ["FU", 5, [0, 1, 2, 3]], ["SP", 5, 0, 8, [1], 1], ["AN", 5, 1, 2], ["FFSP", 5, 0, [13, 12, 11, 10], 1, 1], ["AN", 5, 1, 6], ["FU", 4, [0, 1, 2, 3]], ["SP", 4, 0, 8192, [32], 1], ["AN", 4, 0, 5], ["AN", 4, 1, 6], ["PR", 4, 0, "auto_unroll_max_step$0"], ["PR", 8, 0, "auto_unroll_max_step$0"], ["PR", 11, 0, "auto_unroll_max_step$0"]]]], "r": [[0.00017319], 0, 1.5819, 1756340206], "v": "v0.6"}
{"i": [["[\"d78e8eb6021c4cdda0ad7775d10f751a\", [1, 7, 7, 512], [4, 4, 512, 512], [1, 7, 7, 512], [1, 7, 7, 512]]", "cuda -keys=cuda,gpu -arch=sm_86 -max_num_threads=1024 -thread_warp_size=32", [-1, 16, 64, 49152, 2147483647, 1024, 8, 32], "", 0, []], [[], [["CI", 9], ["AN", 8, 0, 1], ["AN", 8, 1, 1], ["SP", 8, 2, 16, [4], 1], ["SP", 8, 4, 512, [8], 1], ["AN", 8, 6, 1], ["AN", 8, 7, 1], ["RE", 8, [2, 4, 3, 5, 0, 1, 6, 7]], ["CI", 7], ["CHW", 6, "local"], ["SP", 6, 0, 4, [1, 1, 2, 1], 1], ["SP", 6, 5, 4, [2, 1, 1, 2], 1], ["SP", 6, 10, 16, [1, 2, 2, 4], 1], ["SP", 6, 15, 512, [4, 16, 2, 1], 1], ["SP", 6, 20, 512, [1, 4], 1], ["RE", 6, [0, 5, 10, 15, 1, 6, 11, 16, 2, 7, 12, 17, 20, 21, 3, 8, 13, 18, 22, 4, 9, 14, 19]], ["FSP", 7, 0, 10, 3], ["FSP", 7, 4, 11, 3], ["FSP", 7, 8, 12, 3], ["FSP", 7, 12, 13, 3], ["RE", 7, [0, 4, 8, 12, 1, 5, 9, 13, 2, 6, 10, 14, 3, 7, 11, 15]], ["CA", 6, 7, 11], ["CHR", 5, "shared", [6]], ["CA", 6, 7, 12], ["CHR", 4, "shared", [7]], ["CA", 5, 8, 12], ["AN", 4, 0, 1], ["AN", 4, 1, 1], ["SP", 4, 2, 16, [1], 1], ["SP", 4, 4, 512, [64], 1], ["AN", 4, 6, 1], ["AN", 4, 7, 1], ["RE", 4, [2, 4, 3, 5, 0, 1, 6, 7]], ["CI", 3], ["CA", 2, 4, 3], ["CI", 1], ["FU", 14, [0, 1, 2, 3]], ["SP", 14, 0, 25088, [64], 1], ["AN", 14, 0, 5], ["AN", 14, 1, 6], ["FU", 11, [0, 1, 2, 3]], ["SP", 11, 0, 8192, [32], 1], ["AN", 11, 0, 5], ["AN", 11, 1, 6], ["FU", 9, [0, 1, 2, 3]], ["AN", 9, 0, 5], ["FU", 9, [1, 2, 3, 4]], ["AN", 9, 1, 4], ["FU", 9, [2, 3, 4, 5]], ["AN", 9, 2, 6], ["FU", 7, [0, 1, 2, 3]], ["SP", 7, 0, 16, [1], 1], ["AN", 7, 1, 2], ["FFSP", 7, 0, [13, 12, 11, 10], 1, 1], ["AN", 7, 1, 6], ["FU", 5, [0, 1, 2, 3]], ["SP", 5, 0, 64, [1], 1], ["AN", 5, 1, 2], ["FFSP", 5, 0, [13, 12, 11, 10], 1, 1], ["AN", 5, 1, 6], ["FU", 4, [0, 1, 2, 3]], ["SP", 4, 0, 8192, [32], 1], ["AN", 4, 0, 5], ["AN", 4, 1, 6], ["PR", 4, 0, "auto_unroll_max_step$1024"], ["PR", 8, 0, "auto_unroll_max_step$16"], ["PR", 11, 0, "auto_unroll_max_step$1024"]]]], "r": [[0.000887334], 0, 2.2718, 1756340207], "v": "v0.6"}
{"i": [["[\"d78e8eb6021c4cdda0ad7775d10f751a\", [1, 7, 7, 512], [4, 4, 512, 512], [1, 7, 7, 512], [1, 7, 7, 512]]", "cuda -keys=cuda,gpu -arch=sm_86 -max_num_threads=1024 -thread_warp_size=32", [-1, 16, 64, 49152, 2147483647, 1024, 8, 32], "", 0, []], [[], [["CI", 9], ["AN", 8, 0, 1], ["AN", 8, 1, 1], ["SP", 8, 2, 16, [2], 1], ["SP", 8, 4, 512, [32], 1], ["AN", 8, 6, 1], ["AN", 8, 7, 1], ["RE", 8, [2, 4, 3, 5, 0, 1, 6, 7]], ["CI", 7], ["CHW", 6, "local"], ["SP", 6, 0, 4, [1, 2, 1, 1], 1], ["SP", 6, 5, 4, [1, 4, 1, 1], 1], ["SP", 6, 10, 16, [1, 2, 1, 1], 1], ["SP", 6, 15, 512, [1, 4, 1, 2], 1], ["SP", 6, 20, 512, [128, 1], 1], ["RE", 6, [0, 5, 10, 15, 1, 6, 11, 16, 2, 7, 12, 17, 20, 21, 3, 8, 13, 18, 22, 4, 9, 14, 19]], ["FSP", 7, 0, 10, 3], ["FSP", 7, 4, 11, 3], ["FSP", 7, 8, 12, 3], ["FSP", 7, 12, 13, 3], ["RE", 7, [0, 4, 8, 12, 1, 5, 9, 13, 2, 6, 10, 14, 3, 7, 11, 15]], ["CA", 6, 7, 11], ["CHR", 5, "shared", [6]], ["CA", 6, 7, 12], ["CHR", 4, "shared", [7]], ["CA", 5, 8, 12], ["AN", 4, 0, 1], ["AN", 4, 1, 1], ["SP", 4, 2, 16, [2], 1], ["SP", 4, 4, 512, [32], 1], ["AN", 4, 6, 1], ["AN", 4, 7, 1], ["RE", 4, [2, 4, 3, 5, 0, 1, 6, 7]], ["CI", 3], ["CA", 2, 4, 3], ["CI", 1], ["FU", 14, [0, 1, 2, 3]], ["SP", 14, 0, 25088, [32], 1], ["AN", 14, 0, 5], ["AN", 14, 1, 6], ["FU", 11, [0, 1, 2, 3]], ["SP", 11, 0, 8192, [32], 1], ["AN", 11, 0, 5], ["AN", 11, 1, 6], ["FU", 9, [0, 1, 2, 3]], ["AN", 9, 0, 5], ["FU", 9, [1, 2, 3, 4]], ["AN", 9, 1, 4], ["FU", 9, [2, 3, 4, 5]], ["AN", 9, 2, 6], ["FU", 7, [0, 1, 2, 3]], ["SP", 7, 0, 256, [1], 1], ["AN", 7, 1, 2], ["FFSP", 7, 0, [13, 12, 11, 10], 1, 1], ["AN", 7, 1, 6], ["FU", 5, [0, 1, 2, 3]], ["SP", 5, 0, 128, [1], 1], ["AN", 5, 1, 2], ["FFSP", 5, 0, [13, 12, 11, 10], 1, 1], ["AN", 5, 1, 6], ["FU", 4, [0, 1, 2, 3]], ["SP", 4, 0, 8192, [8], 1], ["AN", 4, 0, 5], ["AN", 4, 1, 6], ["PR", 4, 0, "auto_unroll_max_step$1024"], ["PR", 8, 0, "auto_unroll_max_step$64"], ["PR", 11, 0, "auto_unroll_max_step$512"]]]], "r": [[0.000127464], 0, 1.17456, 1756340207], "v": "v0.6"}
