gallery/logs_schedule/multi-tiny_conv_1/tiny_conv_1-B1.json
{"i": [["[\"ca6d973aba9593e2d1df5b0c0dc911aa\", [1, 32, 32, 16], [1, 1, 1, 16]]", "cuda -keys=cuda,gpu -arch=sm_86 -max_num_threads=1024 -thread_warp_size=32", [-1, 16, 64, 49152, 2147483647, 1024, 8, 32], "", 0, []], [[], [["FU", 2, [0, 1, 2, 3]], ["AN", 2, 0, 6], ["FU", 1, [0, 1, 2, 3]], ["AN", 1, 0, 6], ["PR", 1, 0, "auto_unroll_max_step$0"]]]], "r": [[1.10384e-05], 0, 1.23285, 1756345173], "v": "v0.6"}
{"i": [["[\"ca6d973aba9593e2d1df5b0c0dc911aa\", [1, 32, 32, 16], [1, 1, 1, 16]]", "cuda -keys=cuda,gpu -arch=sm_86 -max_num_threads=1024 -thread_warp_size=32", [-1, 16, 64, 49152, 2147483647, 1024, 8, 32], "", 0, []], [[], [["FU", 2, [0, 1, 2, 3]], ["AN", 2, 0, 6], ["FU", 1, [0, 1, 2, 3]], ["AN", 1, 0, 6], ["PR", 1, 0, "auto_unroll_max_step$16"]]]], "r": [[1.11183e-05], 0, 1.04125, 1756345174], "v": "v0.6"}
{"i": [["[\"ca6d973aba9593e2d1df5b0c0dc911aa\", [1, 32, 32, 16], [1, 1, 1, 16]]", "cuda -keys=cuda,gpu -arch=sm_86 -max_num_threads=1024 -thread_warp_size=32", [-1, 16, 64, 49152, 2147483647, 1024, 8, 32], "", 0, []], [[], [["FU", 2, [0, 1, 2, 3]], ["AN", 2, 0, 6], ["FU", 1, [0, 1, 2, 3]], ["AN", 1, 0, 6], ["PR", 1, 0, "auto_unroll_max_step$512"]]]], "r": [[1.11213e-05], 0, 1.16513, 1756345175], "v": "v0.6"}
{"i": [["[\"ca6d973aba9593e2d1df5b0c0dc911aa\", [1, 32, 32, 16], [1, 1, 1, 16]]", "cuda -keys=cuda,gpu -arch=sm_86 -max_num_threads=1024 -thread_warp_size=32", [-1, 16, 64, 49152, 2147483647, 1024, 8, 32], "", 0, []], [[], [["FU", 2, [0, 1, 2, 3]], ["AN", 2, 0, 6], ["FU", 1, [0, 1, 2, 3]], ["AN", 1, 0, 6], ["PR", 1, 0, "auto_unroll_max_step$1024"]]]], "r": [[1.11262e-05], 0, 1.14655, 1756345176], "v": "v0.6"}
{"i": [["[\"ca6d973aba9593e2d1df5b0c0dc911aa\", [1, 32, 32, 16], [1, 1, 1, 16]]", "cuda -keys=cuda,gpu -arch=sm_86 -max_num_threads=1024 -thread_warp_size=32", [-1, 16, 64, 49152, 2147483647, 1024, 8, 32], "", 0, []], [[], [["FU", 2, [0, 1, 2, 3]], ["AN", 2, 0, 6], ["FU", 1, [0, 1, 2, 3]], ["AN", 1, 0, 6], ["PR", 1, 0, "auto_unroll_max_step$64"]]]], "r": [[1.11267e-05], 0, 1.13214, 1756345177], "v": "v0.6"}
{"i": [["[\"08f7449d79e570b7274174709e5e5e01\", [1, 16], [10, 16], [1, 10], [1, 10]]", "cuda -keys=cuda,gpu -arch=sm_86 -max_num_threads=1024 -thread_warp_size=32", [-1, 16, 64, 49152, 2147483647, 1024, 8, 32], "", 0, []], [[], [["SP", 2, 0, 1, [1, 1, 1, 1], 1], ["SP", 2, 5, 10, [1, 1, 10, 1], 1], ["SP", 2, 10, 16, [8, 2], 1], ["RE", 2, [0, 5, 1, 6, 2, 7, 10, 11, 3, 8, 12, 4, 9]], ["FSP", 4, 0, 0, 3], ["FSP", 4, 4, 1, 3], ["RE", 4, [0, 4, 1, 5, 2, 6, 3, 7]], ["CA", 2, 4, 5], ["CHR", 1, "shared", [2]], ["CA", 2, 3, 6], ["CHR", 0, "shared", [3]], ["CA", 1, 4, 6], ["FU", 6, [0, 1]], ["AN", 6, 0, 5], ["FU", 6, [1, 2]], ["AN", 6, 1, 4], ["FU", 6, [2, 3]], ["AN", 6, 2, 6], ["FU", 3, [0, 1]], ["SP", 3, 0, 160, [1], 1], ["AN", 3, 1, 2], ["FFSP", 3, 0, [1, 0], 1, 1], ["AN", 3, 1, 6], ["FU", 1, [0, 1]], ["SP", 1, 0, 16, [1], 1], ["AN", 1, 1, 2], ["FFSP", 1, 0, [1, 0], 1, 1], ["AN", 1, 1, 6], ["PR", 4, 0, "auto_unroll_max_step$0"]]]], "r": [[2.70627e-06], 0, 1.5502, 1756345195], "v": "v0.6"}
{"i": [["[\"08f7449d79e570b7274174709e5e5e01\", [1, 16], [10, 16], [1, 10], [1, 10]]", "cuda -keys=cuda,gpu -arch=sm_86 -max_num_threads=1024 -thread_warp_size=32", [-1, 16, 64, 49152, 2147483647, 1024, 8, 32], "", 0, []], [[], [["SP", 2, 0, 1, [1, 1, 1, 1], 1], ["SP", 2, 5, 10, [1, 1, 1, 1], 1], ["SP", 2, 10, 16, [1, 4], 1], ["RE", 2, [0, 5, 1, 6, 2, 7, 10, 11, 3, 8, 12, 4, 9]], ["FSP", 4, 0, 0, 3], ["FSP", 4, 4, 1, 3], ["RE", 4, [0, 4, 1, 5, 2, 6, 3, 7]], ["CA", 2, 4, 5], ["CHR", 1, "shared", [2]], ["CA", 2, 3, 6], ["CHR", 0, "shared", [3]], ["CA", 1, 4, 6], ["FU", 6, [0, 1]], ["AN", 6, 0, 5], ["FU", 6, [1, 2]], ["AN", 6, 1, 4], ["FU", 6, [2, 3]], ["AN", 6, 2, 6], ["FU", 3, [0, 1]], ["SP", 3, 0, 4, [2], 1], ["AN", 3, 1, 2], ["FFSP", 3, 0, [1, 0], 1, 1], ["AN", 3, 1, 6], ["FU", 1, [0, 1]], ["SP", 1, 0, 4, [1], 1], ["AN", 1, 1, 2], ["FFSP", 1, 0, [1, 0], 1, 1], ["AN", 1, 1, 6], ["PR", 4, 0, "auto_unroll_max_step$1024"]]]], "r": [[1.72292e-06], 0, 1.07659, 1756345196], "v": "v0.6"}
{"i": [["[\"08f7449d79e570b7274174709e5e5e01\", [1, 16], [10, 16], [1, 10], [1, 10]]", "cuda -keys=cuda,gpu -arch=sm_86 -max_num_threads=1024 -thread_warp_size=32", [-1, 16, 64, 49152, 2147483647, 1024, 8, 32], "", 0, []], [[], [["SP", 2, 0, 1, [1, 1, 1, 1], 1], ["SP", 2, 5, 10, [1, 1, 1, 10], 1], ["SP", 2, 10, 16, [2, 8], 1], ["RE", 2, [0, 5, 1, 6, 2, 7, 10, 11, 3, 8, 12, 4, 9]], ["FSP", 4, 0, 0, 3], ["FSP", 4, 4, 1, 3], ["RE", 4, [0, 4, 1, 5, 2, 6, 3, 7]], ["CA", 2, 4, 5], ["CHR", 1, "shared", [2]], ["CA", 2, 3, 6], ["CHR", 0, "shared", [3]], ["CA", 1, 4, 6], ["FU", 6, [0, 1]], ["AN", 6, 0, 5], ["FU", 6, [1, 2]], ["AN", 6, 1, 4], ["FU", 6, [2, 3]], ["AN", 6, 2, 6], ["FU", 3, [0, 1]], ["SP", 3, 0, 4, [1], 1], ["AN", 3, 1, 2], ["FFSP", 3, 0, [1, 0], 1, 1], ["AN", 3, 1, 6], ["FU", 1, [0, 1]], ["SP", 1, 0, 4, [1], 1], ["AN", 1, 1, 2], ["FFSP", 1, 0, [1, 0], 1, 1], ["AN", 1, 1, 6], ["PR", 4, 0, "auto_unroll_max_step$64"]]]], "r": [[2.7052e-06], 0, 1.23707, 1756345197], "v": "v0.6"}
{"i": [["[\"08f7449d79e570b7274174709e5e5e01\", [1, 16], [10, 16], [1, 10], [1, 10]]", "cuda -keys=cuda,gpu -arch=sm_86 -max_num_threads=1024 -thread_warp_size=32", [-1, 16, 64, 49152, 2147483647, 1024, 8, 32], "", 0, []], [[], [["SP", 2, 0, 1, [1, 1, 1, 1], 1], ["SP", 2, 5, 10, [1, 10, 1, 1], 1], ["SP", 2, 10, 16, [4, 4], 1], ["RE", 2, [0, 5, 1, 6, 2, 7, 10, 11, 3, 8, 12, 4, 9]], ["FSP", 4, 0, 0, 3], ["FSP", 4, 4, 1, 3], ["RE", 4, [0, 4, 1, 5, 2, 6, 3, 7]], ["CA", 2, 4, 5], ["CHR", 1, "shared", [2]], ["CA", 2, 3, 6], ["CHR", 0, "shared", [3]], ["CA", 1, 4, 6], ["FU", 6, [0, 1]], ["AN", 6, 0, 5], ["FU", 6, [1, 2]], ["AN", 6, 1, 4], ["FU", 6, [2, 3]], ["AN", 6, 2, 6], ["FU", 3, [0, 1]], ["SP", 3, 0, 16, [1], 1], ["AN", 3, 1, 2], ["FFSP", 3, 0, [1, 0], 1, 1], ["AN", 3, 1, 6], ["FU", 1, [0, 1]], ["SP", 1, 0, 16, [2], 1], ["AN", 1, 1, 2], ["FFSP", 1, 0, [1, 0], 1, 1], ["AN", 1, 1, 6], ["PR", 4, 0, "auto_unroll_max_step$512"]]]], "r": [[1.58531e-06], 0, 1.49294, 1756345198], "v": "v0.6"}
{"i": [["[\"08f7449d79e570b7274174709e5e5e01\", [1, 16], [10, 16], [1, 10], [1, 10]]", "cuda -keys=cuda,gpu -arch=sm_86 -max_num_threads=1024 -thread_warp_size=32", [-1, 16, 64, 49152, 2147483647, 1024, 8, 32], "", 0, []], [[], [["SP", 2, 0, 1, [1, 1, 1, 1], 1], ["SP", 2, 5, 10, [1, 1, 5, 1], 1], ["SP", 2, 10, 16, [16, 1], 1], ["RE", 2, [0, 5, 1, 6, 2, 7, 10, 11, 3, 8, 12, 4, 9]], ["FSP", 4, 0, 0, 3], ["FSP", 4, 4, 1, 3], ["RE", 4, [0, 4, 1, 5, 2, 6, 3, 7]], ["CA", 2, 4, 5], ["CHR", 1, "shared", [2]], ["CA", 2, 3, 6], ["CHR", 0, "shared", [3]], ["CA", 1, 4, 6], ["FU", 6, [0, 1]], ["AN", 6, 0, 5], ["FU", 6, [1, 2]], ["AN", 6, 1, 4], ["FU", 6, [2, 3]], ["AN", 6, 2, 6], ["FU", 3, [0, 1]], ["SP", 3, 0, 80, [2], 1], ["AN", 3, 1, 2], ["FFSP", 3, 0, [1, 0], 1, 1], ["AN", 3, 1, 6], ["FU", 1, [0, 1]], ["SP", 1, 0, 16, [1], 1], ["AN", 1, 1, 2], ["FFSP", 1, 0, [1, 0], 1, 1], ["AN", 1, 1, 6], ["PR", 4, 0, "auto_unroll_max_step$1024"]]]], "r": [[2.07372e-06], 0, 1.15572, 1756345198], "v": "v0.6"}
{"i": [["[\"08f7449d79e570b7274174709e5e5e01\", [1, 16], [10, 16], [1, 10], [1, 10]]", "cuda -keys=cuda,gpu -arch=sm_86 -max_num_threads=1024 -thread_warp_size=32", [-1, 16, 64, 49152, 2147483647, 1024, 8, 32], "", 0, []], [[], [["SP", 2, 0, 1, [1, 1, 1, 1], 1], ["SP", 2, 5, 10, [1, 1, 1, 10], 1], ["SP", 2, 10, 16, [2, 4], 1], ["RE", 2, [0, 5, 1, 6, 2, 7, 10, 11, 3, 8, 12, 4, 9]], ["FSP", 4, 0, 0, 3], ["FSP", 4, 4, 1, 3], ["RE", 4, [0, 4, 1, 5, 2, 6, 3, 7]], ["CA", 2, 4, 5], ["CHR", 1, "shared", [2]], ["CA", 2, 3, 6], ["CHR", 0, "shared", [3]], ["CA", 1, 4, 6], ["FU", 6, [0, 1]], ["AN", 6, 0, 5], ["FU", 6, [1, 2]], ["AN", 6, 1, 4], ["FU", 6, [2, 3]], ["AN", 6, 2, 6], ["FU", 3, [0, 1]], ["SP", 3, 0, 80, [1], 1], ["AN", 3, 1, 2], ["FFSP", 3, 0, [1, 0], 1, 1], ["AN", 3, 1, 6], ["FU", 1, [0, 1]], ["SP", 1, 0, 8, [1], 1], ["AN", 1, 1, 2], ["FFSP", 1, 0, [1, 0], 1, 1], ["AN", 1, 1, 6], ["PR", 4, 0, "auto_unroll_max_step$16"]]]], "r": [[3.26656e-06], 0, 1.18711, 1756345199], "v": "v0.6"}
{"i": [["[\"08f7449d79e570b7274174709e5e5e01\", [1, 16], [10, 16], [1, 10], [1, 10]]", "cuda -keys=cuda,gpu -arch=sm_86 -max_num_threads=1024 -thread_warp_size=32", [-1, 16, 64, 49152, 2147483647, 1024, 8, 32], "", 0, []], [[], [["SP", 2, 0, 1, [1, 1, 1, 1], 1], ["SP", 2, 5, 10, [5, 2, 1, 1], 1], ["SP", 2, 10, 16, [1, 4], 1], ["RE", 2, [0, 5, 1, 6, 2, 7, 10, 11, 3, 8, 12, 4, 9]], ["FSP", 4, 0, 0, 3], ["FSP", 4, 4, 1, 3], ["RE", 4, [0, 4, 1, 5, 2, 6, 3, 7]], ["CA", 2, 4, 5], ["CHR", 1, "shared", [2]], ["CA", 2, 3, 6], ["CHR", 0, "shared", [3]], ["CA", 1, 4, 6], ["FU", 6, [0, 1]], ["AN", 6, 0, 5], ["FU", 6, [1, 2]], ["AN", 6, 1, 4], ["FU", 6, [2, 3]], ["AN", 6, 2, 6], ["FU", 3, [0, 1]], ["SP", 3, 0, 4, [4], 1], ["AN", 3, 1, 2], ["FFSP", 3, 0, [1, 0], 1, 1], ["AN", 3, 1, 6], ["FU", 1, [0, 1]], ["SP", 1, 0, 4, [1], 1], ["AN", 1, 1, 2], ["FFSP", 1, 0, [1, 0], 1, 1], ["AN", 1, 1, 6], ["PR", 4, 0, "auto_unroll_max_step$1024"]]]], "r": [[1.86304e-06], 0, 1.16571, 1756345200], "v": "v0.6"}
{"i": [["[\"08f7449d79e570b7274174709e5e5e01\", [1, 16], [10, 16], [1, 10], [1, 10]]", "cuda -keys=cuda,gpu -arch=sm_86 -max_num_threads=1024 -thread_warp_size=32", [-1, 16, 64, 49152, 2147483647, 1024, 8, 32], "", 0, []], [[], [["SP", 2, 0, 1, [1, 1, 1, 1], 1], ["SP", 2, 5, 10, [1, 5, 1, 1], 1], ["SP", 2, 10, 16, [4, 1], 1], ["RE", 2, [0, 5, 1, 6, 2, 7, 10, 11, 3, 8, 12, 4, 9]], ["FSP", 4, 0, 0, 3], ["FSP", 4, 4, 1, 3], ["RE", 4, [0, 4, 1, 5, 2, 6, 3, 7]], ["CA", 2, 4, 5], ["CHR", 1, "shared", [2]], ["CA", 2, 3, 6], ["CHR", 0, "shared", [3]], ["CA", 1, 4, 6], ["FU", 6, [0, 1]], ["AN", 6, 0, 5], ["FU", 6, [1, 2]], ["AN", 6, 1, 4], ["FU", 6, [2, 3]], ["AN", 6, 2, 6], ["FU", 3, [0, 1]], ["SP", 3, 0, 4, [2], 1], ["AN", 3, 1, 2], ["FFSP", 3, 0, [1, 0], 1, 1], ["AN", 3, 1, 6], ["FU", 1, [0, 1]], ["SP", 1, 0, 4, [4], 1], ["AN", 1, 1, 2], ["FFSP", 1, 0, [1, 0], 1, 1], ["AN", 1, 1, 6], ["PR", 4, 0, "auto_unroll_max_step$1024"]]]], "r": [[1.72255e-06], 0, 1.07098, 1756345201], "v": "v0.6"}
{"i": [["[\"08f7449d79e570b7274174709e5e5e01\", [1, 16], [10, 16], [1, 10], [1, 10]]", "cuda -keys=cuda,gpu -arch=sm_86 -max_num_threads=1024 -thread_warp_size=32", [-1, 16, 64, 49152, 2147483647, 1024, 8, 32], "", 0, []], [[], [["SP", 2, 0, 1, [1, 1, 1, 1], 1], ["SP", 2, 5, 10, [2, 5, 1, 1], 1], ["SP", 2, 10, 16, [2, 1], 1], ["RE", 2, [0, 5, 1, 6, 2, 7, 10, 11, 3, 8, 12, 4, 9]], ["FSP", 4, 0, 0, 3], ["FSP", 4, 4, 1, 3], ["RE", 4, [0, 4, 1, 5, 2, 6, 3, 7]], ["CA", 2, 4, 5], ["CHR", 1, "shared", [2]], ["CA", 2, 3, 6], ["CHR", 0, "shared", [3]], ["CA", 1, 4, 6], ["FU", 6, [0, 1]], ["AN", 6, 0, 5], ["FU", 6, [1, 2]], ["AN", 6, 1, 4], ["FU", 6, [2, 3]], ["AN", 6, 2, 6], ["FU", 3, [0, 1]], ["SP", 3, 0, 1, [1], 1], ["AN", 3, 1, 2], ["FFSP", 3, 0, [1, 0], 1, 1], ["AN", 3, 1, 6], ["FU", 1, [0, 1]], ["SP", 1, 0, 1, [1], 1], ["AN", 1, 1, 2], ["FFSP", 1, 0, [1, 0], 1, 1], ["AN", 1, 1, 6], ["PR", 4, 0, "auto_unroll_max_step$64"]]]], "r": [[2.00324e-06], 0, 1.10769, 1756345201], "v": "v0.6"}
{"i": [["[\"08f7449d79e570b7274174709e5e5e01\", [1, 16], [10, 16], [1, 10], [1, 10]]", "cuda -keys=cuda,gpu -arch=sm_86 -max_num_threads=1024 -thread_warp_size=32", [-1, 16, 64, 49152, 2147483647, 1024, 8, 32], "", 0, []], [[], [["SP", 2, 0, 1, [1, 1, 1, 1], 1], ["SP", 2, 5, 10, [5, 2, 1, 1], 1], ["SP", 2, 10, 16, [1, 16], 1], ["RE", 2, [0, 5, 1, 6, 2, 7, 10, 11, 3, 8, 12, 4, 9]], ["FSP", 4, 0, 0, 3], ["FSP", 4, 4, 1, 3], ["RE", 4, [0, 4, 1, 5, 2, 6, 3, 7]], ["CA", 2, 4, 5], ["CHR", 1, "shared", [2]], ["CA", 2, 3, 6], ["CHR", 0, "shared", [3]], ["CA", 1, 4, 6], ["FU", 6, [0, 1]], ["AN", 6, 0, 5], ["FU", 6, [1, 2]], ["AN", 6, 1, 4], ["FU", 6, [2, 3]], ["AN", 6, 2, 6], ["FU", 3, [0, 1]], ["SP", 3, 0, 16, [2], 1], ["AN", 3, 1, 2], ["FFSP", 3, 0, [1, 0], 1, 1], ["AN", 3, 1, 6], ["FU", 1, [0, 1]], ["SP", 1, 0, 16, [1], 1], ["AN", 1, 1, 2], ["FFSP", 1, 0, [1, 0], 1, 1], ["AN", 1, 1, 6], ["PR", 4, 0, "auto_unroll_max_step$64"]]]], "r": [[1.86297e-06], 0, 1.20016, 1756345202], "v": "v0.6"}
{"i": [["[\"08f7449d79e570b7274174709e5e5e01\", [1, 16], [10, 16], [1, 10], [1, 10]]", "cuda -keys=cuda,gpu -arch=sm_86 -max_num_threads=1024 -thread_warp_size=32", [-1, 16, 64, 49152, 2147483647, 1024, 8, 32], "", 0, []], [[], [["SP", 2, 0, 1, [1, 1, 1, 1], 1], ["SP", 2, 5, 10, [1, 5, 2, 1], 1], ["SP", 2, 10, 16, [4, 4], 1], ["RE", 2, [0, 5, 1, 6, 2, 7, 10, 11, 3, 8, 12, 4, 9]], ["FSP", 4, 0, 0, 3], ["FSP", 4, 4, 1, 3], ["RE", 4, [0, 4, 1, 5, 2, 6, 3, 7]], ["CA", 2, 4, 5], ["CHR", 1, "shared", [2]], ["CA", 2, 3, 6], ["CHR", 0, "shared", [3]], ["CA", 1, 4, 6], ["FU", 6, [0, 1]], ["AN", 6, 0, 5], ["FU", 6, [1, 2]], ["AN", 6, 1, 4], ["FU", 6, [2, 3]], ["AN", 6, 2, 6], ["FU", 3, [0, 1]], ["SP", 3, 0, 16, [2], 1], ["AN", 3, 1, 2], ["FFSP", 3, 0, [1, 0], 1, 1], ["AN", 3, 1, 6], ["FU", 1, [0, 1]], ["SP", 1, 0, 16, [1], 1], ["AN", 1, 1, 2], ["FFSP", 1, 0, [1, 0], 1, 1], ["AN", 1, 1, 6], ["PR", 4, 0, "auto_unroll_max_step$64"]]]], "r": [[1.72265e-06], 0, 1.11558, 1756345203], "v": "v0.6"}
{"i": [["[\"08f7449d79e570b7274174709e5e5e01\", [1, 16], [10, 16], [1, 10], [1, 10]]", "cuda -keys=cuda,gpu -arch=sm_86 -max_num_threads=1024 -thread_warp_size=32", [-1, 16, 64, 49152, 2147483647, 1024, 8, 32], "", 0, []], [[], [["SP", 2, 0, 1, [1, 1, 1, 1], 1], ["SP", 2, 5, 10, [1, 10, 1, 1], 1], ["SP", 2, 10, 16, [1, 4], 1], ["RE", 2, [0, 5, 1, 6, 2, 7, 10, 11, 3, 8, 12, 4, 9]], ["FSP", 4, 0, 0, 3], ["FSP", 4, 4, 1, 3], ["RE", 4, [0, 4, 1, 5, 2, 6, 3, 7]], ["CA", 2, 4, 5], ["CHR", 1, "shared", [2]], ["CA", 2, 3, 6], ["CHR", 0, "shared", [3]], ["CA", 1, 4, 6], ["FU", 6, [0, 1]], ["AN", 6, 0, 5], ["FU", 6, [1, 2]], ["AN", 6, 1, 4], ["FU", 6, [2, 3]], ["AN", 6, 2, 6], ["FU", 3, [0, 1]], ["SP", 3, 0, 8, [4], 1], ["AN", 3, 1, 2], ["FFSP", 3, 0, [1, 0], 1, 1], ["AN", 3, 1, 6], ["FU", 1, [0, 1]], ["SP", 1, 0, 4, [2], 1], ["AN", 1, 1, 2], ["FFSP", 1, 0, [1, 0], 1, 1], ["AN", 1, 1, 6], ["PR", 4, 0, "auto_unroll_max_step$0"]]]], "r": [[1.72264e-06], 0, 1.06092, 1756345203], "v": "v0.6"}
{"i": [["[\"08f7449d79e570b7274174709e5e5e01\", [1, 16], [10, 16], [1, 10], [1, 10]]", "cuda -keys=cuda,gpu -arch=sm_86 -max_num_threads=1024 -thread_warp_size=32", [-1, 16, 64, 49152, 2147483647, 1024, 8, 32], "", 0, []], [[], [["SP", 2, 0, 1, [1, 1, 1, 1], 1], ["SP", 2, 5, 10, [1, 1, 1, 2], 1], ["SP", 2, 10, 16, [1, 2], 1], ["RE", 2, [0, 5, 1, 6, 2, 7, 10, 11, 3, 8, 12, 4, 9]], ["FSP", 4, 0, 0, 3], ["FSP", 4, 4, 1, 3], ["RE", 4, [0, 4, 1, 5, 2, 6, 3, 7]], ["CA", 2, 4, 5], ["CHR", 1, "shared", [2]], ["CA", 2, 3, 6], ["CHR", 0, "shared", [3]], ["CA", 1, 4, 6], ["FU", 6, [0, 1]], ["AN", 6, 0, 5], ["FU", 6, [1, 2]], ["AN", 6, 1, 4], ["FU", 6, [2, 3]], ["AN", 6, 2, 6], ["FU", 3, [0, 1]], ["SP", 3, 0, 16, [1], 1], ["AN", 3, 1, 2], ["FFSP", 3, 0, [1, 0], 1, 1], ["AN", 3, 1, 6], ["FU", 1, [0, 1]], ["SP", 1, 0, 8, [1], 1], ["AN", 1, 1, 2], ["FFSP", 1, 0, [1, 0], 1, 1], ["AN", 1, 1, 6], ["PR", 4, 0, "auto_unroll_max_step$0"]]]], "r": [[2.14372e-06], 0, 1.06399, 1756345204], "v": "v0.6"}
{"i": [["[\"08f7449d79e570b7274174709e5e5e01\", [1, 16], [10, 16], [1, 10], [1, 10]]", "cuda -keys=cuda,gpu -arch=sm_86 -max_num_threads=1024 -thread_warp_size=32", [-1, 16, 64, 49152, 2147483647, 1024, 8, 32], "", 0, []], [[], [["SP", 2, 0, 1, [1, 1, 1, 1], 1], ["SP", 2, 5, 10, [5, 1, 1, 2], 1], ["SP", 2, 10, 16, [4, 4], 1], ["RE", 2, [0, 5, 1, 6, 2, 7, 10, 11, 3, 8, 12, 4, 9]], ["FSP", 4, 0, 0, 3], ["FSP", 4, 4, 1, 3], ["RE", 4, [0, 4, 1, 5, 2, 6, 3, 7]], ["CA", 2, 4, 5], ["CHR", 1, "shared", [2]], ["CA", 2, 3, 6], ["CHR", 0, "shared", [3]], ["CA", 1, 4, 6], ["FU", 6, [0, 1]], ["AN", 6, 0, 5], ["FU", 6, [1, 2]], ["AN", 6, 1, 4], ["FU", 6, [2, 3]], ["AN", 6, 2, 6], ["FU", 3, [0, 1]], ["SP", 3, 0, 8, [2], 1], ["AN", 3, 1, 2], ["FFSP", 3, 0, [1, 0], 1, 1], ["AN", 3, 1, 6], ["FU", 1, [0, 1]], ["SP", 1, 0, 4, [4], 1], ["AN", 1, 1, 2], ["FFSP", 1, 0, [1, 0], 1, 1], ["AN", 1, 1, 6], ["PR", 4, 0, "auto_unroll_max_step$1024"]]]], "r": [[2.56478e-06], 0, 1.29394, 1756345205], "v": "v0.6"}
{"i": [["[\"08f7449d79e570b7274174709e5e5e01\", [1, 16], [10, 16], [1, 10], [1, 10]]", "cuda -keys=cuda,gpu -arch=sm_86 -max_num_threads=1024 -thread_warp_size=32", [-1, 16, 64, 49152, 2147483647, 1024, 8, 32], "", 0, []], [[], [["SP", 2, 0, 1, [1, 1, 1, 1], 1], ["SP", 2, 5, 10, [2, 5, 1, 1], 1], ["SP", 2, 10, 16, [8, 2], 1], ["RE", 2, [0, 5, 1, 6, 2, 7, 10, 11, 3, 8, 12, 4, 9]], ["FSP", 4, 0, 0, 3], ["FSP", 4, 4, 1, 3], ["RE", 4, [0, 4, 1, 5, 2, 6, 3, 7]], ["CA", 2, 4, 5], ["CHR", 1, "shared", [2]], ["CA", 2, 3, 6], ["CHR", 0, "shared", [3]], ["CA", 1, 4, 6], ["FU", 6, [0, 1]], ["AN", 6, 0, 5], ["FU", 6, [1, 2]], ["AN", 6, 1, 4], ["FU", 6, [2, 3]], ["AN", 6, 2, 6], ["FU", 3, [0, 1]], ["SP", 3, 0, 16, [1], 1], ["AN", 3, 1, 2], ["FFSP", 3, 0, [1, 0], 1, 1], ["AN", 3, 1, 6], ["FU", 1, [0, 1]], ["SP", 1, 0, 16, [1], 1], ["AN", 1, 1, 2], ["FFSP", 1, 0, [1, 0], 1, 1], ["AN", 1, 1, 6], ["PR", 4, 0, "auto_unroll_max_step$1024"]]]], "r": [[1.72252e-06], 0, 1.05942, 1756345205], "v": "v0.6"}
{"i": [["[\"08f7449d79e570b7274174709e5e5e01\", [1, 16], [10, 16], [1, 10], [1, 10]]", "cuda -keys=cuda,gpu -arch=sm_86 -max_num_threads=1024 -thread_warp_size=32", [-1, 16, 64, 49152, 2147483647, 1024, 8, 32], "", 0, []], [[], [["SP", 2, 0, 1, [1, 1, 1, 1], 1], ["SP", 2, 5, 10, [5, 1, 1, 1], 1], ["SP", 2, 10, 16, [4, 4], 1], ["RE", 2, [0, 5, 1, 6, 2, 7, 10, 11, 3, 8, 12, 4, 9]], ["FSP", 4, 0, 0, 3], ["FSP", 4, 4, 1, 3], ["RE", 4, [0, 4, 1, 5, 2, 6, 3, 7]], ["CA", 2, 4, 5], ["CHR", 1, "shared", [2]], ["CA", 2, 3, 6], ["CHR", 0, "shared", [3]], ["CA", 1, 4, 6], ["FU", 6, [0, 1]], ["AN", 6, 0, 5], ["FU", 6, [1, 2]], ["AN", 6, 1, 4], ["FU", 6, [2, 3]], ["AN", 6, 2, 6], ["FU", 3, [0, 1]], ["SP", 3, 0, 16, [1], 1], ["AN", 3, 1, 2], ["FFSP", 3, 0, [1, 0], 1, 1], ["AN", 3, 1, 6], ["FU", 1, [0, 1]], ["SP", 1, 0, 16, [1], 1], ["AN", 1, 1, 2], ["FFSP", 1, 0, [1, 0], 1, 1], ["AN", 1, 1, 6], ["PR", 4, 0, "auto_unroll_max_step$512"]]]], "r": [[2.14359e-06], 0, 1.21791, 1756345206], "v": "v0.6"}
{"i": [["[\"08f7449d79e570b7274174709e5e5e01\", [1, 16], [10, 16], [1, 10], [1, 10]]", "cuda -keys=cuda,gpu -arch=sm_86 -max_num_threads=1024 -thread_warp_size=32", [-1, 16, 64, 49152, 2147483647, 1024, 8, 32], "", 0, []], [[], [["SP", 2, 0, 1, [1, 1, 1, 1], 1], ["SP", 2, 5, 10, [1, 10, 1, 1], 1], ["SP", 2, 10, 16, [1, 1], 1], ["RE", 2, [0, 5, 1, 6, 2, 7, 10, 11, 3, 8, 12, 4, 9]], ["FSP", 4, 0, 0, 3], ["FSP", 4, 4, 1, 3], ["RE", 4, [0, 4, 1, 5, 2, 6, 3, 7]], ["CA", 2, 4, 5], ["CHR", 1, "shared", [2]], ["CA", 2, 3, 6], ["CHR", 0, "shared", [3]], ["CA", 1, 4, 6], ["FU", 6, [0, 1]], ["AN", 6, 0, 5], ["FU", 6, [1, 2]], ["AN", 6, 1, 4], ["FU", 6, [2, 3]], ["AN", 6, 2, 6], ["FU", 3, [0, 1]], ["SP", 3, 0, 8, [1], 1], ["AN", 3, 1, 2], ["FFSP", 3, 0, [1, 0], 1, 1], ["AN", 3, 1, 6], ["FU", 1, [0, 1]], ["SP", 1, 0, 8, [4], 1], ["AN", 1, 1, 2], ["FFSP", 1, 0, [1, 0], 1, 1], ["AN", 1, 1, 6], ["PR", 4, 0, "auto_unroll_max_step$1024"]]]], "r": [[2.14328e-06], 0, 1.14046, 1756345207], "v": "v0.6"}
{"i": [["[\"08f7449d79e570b7274174709e5e5e01\", [1, 16], [10, 16], [1, 10], [1, 10]]", "cuda -keys=cuda,gpu -arch=sm_86 -max_num_threads=1024 -thread_warp_size=32", [-1, 16, 64, 49152, 2147483647, 1024, 8, 32], "", 0, []], [[], [["SP", 2, 0, 1, [1, 1, 1, 1], 1], ["SP", 2, 5, 10, [1, 1, 5, 1], 1], ["SP", 2, 10, 16, [1, 16], 1], ["RE", 2, [0, 5, 1, 6, 2, 7, 10, 11, 3, 8, 12, 4, 9]], ["FSP", 4, 0, 0, 3], ["FSP", 4, 4, 1, 3], ["RE", 4, [0, 4, 1, 5, 2, 6, 3, 7]], ["CA", 2, 4, 5], ["CHR", 1, "shared", [2]], ["CA", 2, 3, 6], ["CHR", 0, "shared", [3]], ["CA", 1, 4, 6], ["FU", 6, [0, 1]], ["AN", 6, 0, 5], ["FU", 6, [1, 2]], ["AN", 6, 1, 4], ["FU", 6, [2, 3]], ["AN", 6, 2, 6], ["FU", 3, [0, 1]], ["SP", 3, 0, 80, [1], 1], ["AN", 3, 1, 2], ["FFSP", 3, 0, [1, 0], 1, 1], ["AN", 3, 1, 6], ["FU", 1, [0, 1]], ["SP", 1, 0, 16, [1], 1], ["AN", 1, 1, 2], ["FFSP", 1, 0, [1, 0], 1, 1], ["AN", 1, 1, 6], ["PR", 4, 0, "auto_unroll_max_step$16"]]]], "r": [[2.15387e-06], 0, 1.05923, 1756345208], "v": "v0.6"}
{"i": [["[\"08f7449d79e570b7274174709e5e5e01\", [1, 16], [10, 16], [1, 10], [1, 10]]", "cuda -keys=cuda,gpu -arch=sm_86 -max_num_threads=1024 -thread_warp_size=32", [-1, 16, 64, 49152, 2147483647, 1024, 8, 32], "", 0, []], [[], [["SP", 2, 0, 1, [1, 1, 1, 1], 1], ["SP", 2, 5, 10, [2, 5, 1, 1], 1], ["SP", 2, 10, 16, [1, 16], 1], ["RE", 2, [0, 5, 1, 6, 2, 7, 10, 11, 3, 8, 12, 4, 9]], ["FSP", 4, 0, 0, 3], ["FSP", 4, 4, 1, 3], ["RE", 4, [0, 4, 1, 5, 2, 6, 3, 7]], ["CA", 2, 4, 5], ["CHR", 1, "shared", [2]], ["CA", 2, 3, 6], ["CHR", 0, "shared", [3]], ["CA", 1, 4, 6], ["FU", 6, [0, 1]], ["AN", 6, 0, 5], ["FU", 6, [1, 2]], ["AN", 6, 1, 4], ["FU", 6, [2, 3]], ["AN", 6, 2, 6], ["FU", 3, [0, 1]], ["SP", 3, 0, 160, [1], 1], ["AN", 3, 1, 2], ["FFSP", 3, 0, [1, 0], 1, 1], ["AN", 3, 1, 6], ["FU", 1, [0, 1]], ["SP", 1, 0, 16, [4], 1], ["AN", 1, 1, 2], ["FFSP", 1, 0, [1, 0], 1, 1], ["AN", 1, 1, 6], ["PR", 4, 0, "auto_unroll_max_step$512"]]]], "r": [[1.73782e-06], 0, 1.02727, 1756345208], "v": "v0.6"}
{"i": [["[\"08f7449d79e570b7274174709e5e5e01\", [1, 16], [10, 16], [1, 10], [1, 10]]", "cuda -keys=cuda,gpu -arch=sm_86 -max_num_threads=1024 -thread_warp_size=32", [-1, 16, 64, 49152, 2147483647, 1024, 8, 32], "", 0, []], [[], [["SP", 2, 0, 1, [1, 1, 1, 1], 1], ["SP", 2, 5, 10, [5, 1, 1, 2], 1], ["SP", 2, 10, 16, [2, 2], 1], ["RE", 2, [0, 5, 1, 6, 2, 7, 10, 11, 3, 8, 12, 4, 9]], ["FSP", 4, 0, 0, 3], ["FSP", 4, 4, 1, 3], ["RE", 4, [0, 4, 1, 5, 2, 6, 3, 7]], ["CA", 2, 4, 5], ["CHR", 1, "shared", [2]], ["CA", 2, 3, 6], ["CHR", 0, "shared", [3]], ["CA", 1, 4, 6], ["FU", 6, [0, 1]], ["AN", 6, 0, 5], ["FU", 6, [1, 2]], ["AN", 6, 1, 4], ["FU", 6, [2, 3]], ["AN", 6, 2, 6], ["FU", 3, [0, 1]], ["SP", 3, 0, 8, [1], 1], ["AN", 3, 1, 2], ["FFSP", 3, 0, [1, 0], 1, 1], ["AN", 3, 1, 6], ["FU", 1, [0, 1]], ["SP", 1, 0, 4, [1], 1], ["AN", 1, 1, 2], ["FFSP", 1, 0, [1, 0], 1, 1], ["AN", 1, 1, 6], ["PR", 4, 0, "auto_unroll_max_step$0"]]]], "r": [[2.87055e-06], 0, 1.09809, 1756345209], "v": "v0.6"}
{"i": [["[\"08f7449d79e570b7274174709e5e5e01\", [1, 16], [10, 16], [1, 10], [1, 10]]", "cuda -keys=cuda,gpu -arch=sm_86 -max_num_threads=1024 -thread_warp_size=32", [-1, 16, 64, 49152, 2147483647, 1024, 8, 32], "", 0, []], [[], [["SP", 2, 0, 1, [1, 1, 1, 1], 1], ["SP", 2, 5, 10, [1, 10, 1, 1], 1], ["SP", 2, 10, 16, [16, 1], 1], ["RE", 2, [0, 5, 1, 6, 2, 7, 10, 11, 3, 8, 12, 4, 9]], ["FSP", 4, 0, 0, 3], ["FSP", 4, 4, 1, 3], ["RE", 4, [0, 4, 1, 5, 2, 6, 3, 7]], ["CA", 2, 4, 5], ["CHR", 1, "shared", [2]], ["CA", 2, 3, 6], ["CHR", 0, "shared", [3]], ["CA", 1, 4, 6], ["FU", 6, [0, 1]], ["AN", 6, 0, 5], ["FU", 6, [1, 2]], ["AN", 6, 1, 4], ["FU", 6, [2, 3]], ["AN", 6, 2, 6], ["FU", 3, [0, 1]], ["SP", 3, 0, 16, [1], 1], ["AN", 3, 1, 2], ["FFSP", 3, 0, [1, 0], 1, 1], ["AN", 3, 1, 6], ["FU", 1, [0, 1]], ["SP", 1, 0, 16, [1], 1], ["AN", 1, 1, 2], ["FFSP", 1, 0, [1, 0], 1, 1], ["AN", 1, 1, 6], ["PR", 4, 0, "auto_unroll_max_step$1024"]]]], "r": [[1.60321e-06], 0, 1.38302, 1756345210], "v": "v0.6"}
{"i": [["[\"08f7449d79e570b7274174709e5e5e01\", [1, 16], [10, 16], [1, 10], [1, 10]]", "cuda -keys=cuda,gpu -arch=sm_86 -max_num_threads=1024 -thread_warp_size=32", [-1, 16, 64, 49152, 2147483647, 1024, 8, 32], "", 0, []], [[], [["SP", 2, 0, 1, [1, 1, 1, 1], 1], ["SP", 2, 5, 10, [1, 1, 1, 10], 1], ["SP", 2, 10, 16, [1, 2], 1], ["RE", 2, [0, 5, 1, 6, 2, 7, 10, 11, 3, 8, 12, 4, 9]], ["FSP", 4, 0, 0, 3], ["FSP", 4, 4, 1, 3], ["RE", 4, [0, 4, 1, 5, 2, 6, 3, 7]], ["CA", 2, 4, 5], ["CHR", 1, "shared", [2]], ["CA", 2, 3, 6], ["CHR", 0, "shared", [3]], ["CA", 1, 4, 6], ["FU", 6, [0, 1]], ["AN", 6, 0, 5], ["FU", 6, [1, 2]], ["AN", 6, 1, 4], ["FU", 6, [2, 3]], ["AN", 6, 2, 6], ["FU", 3, [0, 1]], ["SP", 3, 0, 4, [1], 1], ["AN", 3, 1, 2], ["FFSP", 3, 0, [1, 0], 1, 1], ["AN", 3, 1, 6], ["FU", 1, [0, 1]], ["SP", 1, 0, 2, [1], 1], ["AN", 1, 1, 2], ["FFSP", 1, 0, [1, 0], 1, 1], ["AN", 1, 1, 6], ["PR", 4, 0, "auto_unroll_max_step$0"]]]], "r": [[3.15333e-06], 0, 1.04768, 1756345211], "v": "v0.6"}
{"i": [["[\"08f7449d79e570b7274174709e5e5e01\", [1, 16], [10, 16], [1, 10], [1, 10]]", "cuda -keys=cuda,gpu -arch=sm_86 -max_num_threads=1024 -thread_warp_size=32", [-1, 16, 64, 49152, 2147483647, 1024, 8, 32], "", 0, []], [[], [["SP", 2, 0, 1, [1, 1, 1, 1], 1], ["SP", 2, 5, 10, [2, 1, 1, 1], 1], ["SP", 2, 10, 16, [4, 1], 1], ["RE", 2, [0, 5, 1, 6, 2, 7, 10, 11, 3, 8, 12, 4, 9]], ["FSP", 4, 0, 0, 3], ["FSP", 4, 4, 1, 3], ["RE", 4, [0, 4, 1, 5, 2, 6, 3, 7]], ["CA", 2, 4, 5], ["CHR", 1, "shared", [2]], ["CA", 2, 3, 6], ["CHR", 0, "shared", [3]], ["CA", 1, 4, 6], ["FU", 6, [0, 1]], ["AN", 6, 0, 5], ["FU", 6, [1, 2]], ["AN", 6, 1, 4], ["FU", 6, [2, 3]], ["AN", 6, 2, 6], ["FU", 3, [0, 1]], ["SP", 3, 0, 16, [1], 1], ["AN", 3, 1, 2], ["FFSP", 3, 0, [1, 0], 1, 1], ["AN", 3, 1, 6], ["FU", 1, [0, 1]], ["SP", 1, 0, 8, [8], 1], ["AN", 1, 1, 2], ["FFSP", 1, 0, [1, 0], 1, 1], ["AN", 1, 1, 6], ["PR", 4, 0, "auto_unroll_max_step$16"]]]], "r": [[1.87942e-06], 0, 0.889453, 1756345212], "v": "v0.6"}
{"i": [["[\"08f7449d79e570b7274174709e5e5e01\", [1, 16], [10, 16], [1, 10], [1, 10]]", "cuda -keys=cuda,gpu -arch=sm_86 -max_num_threads=1024 -thread_warp_size=32", [-1, 16, 64, 49152, 2147483647, 1024, 8, 32], "", 0, []], [[], [["SP", 2, 0, 1, [1, 1, 1, 1], 1], ["SP", 2, 5, 10, [1, 2, 1, 5], 1], ["SP", 2, 10, 16, [2, 4], 1], ["RE", 2, [0, 5, 1, 6, 2, 7, 10, 11, 3, 8, 12, 4, 9]], ["FSP", 4, 0, 0, 3], ["FSP", 4, 4, 1, 3], ["RE", 4, [0, 4, 1, 5, 2, 6, 3, 7]], ["CA", 2, 4, 5], ["CHR", 1, "shared", [2]], ["CA", 2, 3, 6], ["CHR", 0, "shared", [3]], ["CA", 1, 4, 6], ["FU", 6, [0, 1]], ["AN", 6, 0, 5], ["FU", 6, [1, 2]], ["AN", 6, 1, 4], ["FU", 6, [2, 3]], ["AN", 6, 2, 6], ["FU", 3, [0, 1]], ["SP", 3, 0, 40, [1], 1], ["AN", 3, 1, 2], ["FFSP", 3, 0, [1, 0], 1, 1], ["AN", 3, 1, 6], ["FU", 1, [0, 1]], ["SP", 1, 0, 8, [1], 1], ["AN", 1, 1, 2], ["FFSP", 1, 0, [1, 0], 1, 1], ["AN", 1, 1, 6], ["PR", 4, 0, "auto_unroll_max_step$64"]]]], "r": [[2.02246e-06], 0, 0.975345, 1756345212], "v": "v0.6"}
{"i": [["[\"7d79c516e212fe1d73f5dbb90eaca2cf\", [1, 10], [1, 10]]", "cuda -keys=cuda,gpu -arch=sm_86 -max_num_threads=1024 -thread_warp_size=32", [-1, 16, 64, 49152, 2147483647, 1024, 8, 32], "", 0, []], [[], [["CI", 2], ["FU", 4, [0, 1]], ["AN", 4, 0, 6], ["AN", 3, 0, 6], ["AN", 1, 0, 6], ["PR", 1, 0, "auto_unroll_max_step$0"], ["PR", 3, 0, "auto_unroll_max_step$512"]]]], "r": [[4.74488e-06], 0, 1.45272, 1756345224], "v": "v0.6"}
{"i": [["[\"7d79c516e212fe1d73f5dbb90eaca2cf\", [1, 10], [1, 10]]", "cuda -keys=cuda,gpu -arch=sm_86 -max_num_threads=1024 -thread_warp_size=32", [-1, 16, 64, 49152, 2147483647, 1024, 8, 32], "", 0, []], [[], [["CI", 2], ["FU", 4, [0, 1]], ["AN", 4, 0, 6], ["AN", 3, 0, 6], ["AN", 1, 0, 6], ["PR", 1, 0, "auto_unroll_max_step$64"], ["PR", 3, 0, "auto_unroll_max_step$512"]]]], "r": [[4.77809e-06], 0, 1.24183, 1756345225], "v": "v0.6"}
{"i": [["[\"7d79c516e212fe1d73f5dbb90eaca2cf\", [1, 10], [1, 10]]", "cuda -keys=cuda,gpu -arch=sm_86 -max_num_threads=1024 -thread_warp_size=32", [-1, 16, 64, 49152, 2147483647, 1024, 8, 32], "", 0, []], [[], [["CI", 2], ["FU", 4, [0, 1]], ["AN", 4, 0, 6], ["AN", 3, 0, 6], ["AN", 1, 0, 6], ["PR", 1, 0, "auto_unroll_max_step$1024"], ["PR", 3, 0, "auto_unroll_max_step$1024"]]]], "r": [[4.78732e-06], 0, 1.25679, 1756345226], "v": "v0.6"}
{"i": [["[\"7d79c516e212fe1d73f5dbb90eaca2cf\", [1, 10], [1, 10]]", "cuda -keys=cuda,gpu -arch=sm_86 -max_num_threads=1024 -thread_warp_size=32", [-1, 16, 64, 49152, 2147483647, 1024, 8, 32], "", 0, []], [[], [["CI", 2], ["FU", 4, [0, 1]], ["AN", 4, 0, 6], ["AN", 3, 0, 6], ["AN", 1, 0, 6], ["PR", 1, 0, "auto_unroll_max_step$64"], ["PR", 3, 0, "auto_unroll_max_step$16"]]]], "r": [[4.78702e-06], 0, 1.26438, 1756345227], "v": "v0.6"}
{"i": [["[\"7d79c516e212fe1d73f5dbb90eaca2cf\", [1, 10], [1, 10]]", "cuda -keys=cuda,gpu -arch=sm_86 -max_num_threads=1024 -thread_warp_size=32", [-1, 16, 64, 49152, 2147483647, 1024, 8, 32], "", 0, []], [[], [["CI", 2], ["FU", 4, [0, 1]], ["AN", 4, 0, 6], ["AN", 3, 0, 6], ["AN", 1, 0, 6], ["PR", 1, 0, "auto_unroll_max_step$16"], ["PR", 3, 0, "auto_unroll_max_step$512"]]]], "r": [[4.78656e-06], 0, 1.24219, 1756345228], "v": "v0.6"}
{"i": [["[\"7d79c516e212fe1d73f5dbb90eaca2cf\", [1, 10], [1, 10]]", "cuda -keys=cuda,gpu -arch=sm_86 -max_num_threads=1024 -thread_warp_size=32", [-1, 16, 64, 49152, 2147483647, 1024, 8, 32], "", 0, []], [[], [["CI", 2], ["FU", 4, [0, 1]], ["AN", 4, 0, 6], ["AN", 3, 0, 6], ["AN", 1, 0, 6], ["PR", 1, 0, "auto_unroll_max_step$512"], ["PR", 3, 0, "auto_unroll_max_step$512"]]]], "r": [[4.78677e-06], 0, 1.26832, 1756345229], "v": "v0.6"}
{"i": [["[\"7d79c516e212fe1d73f5dbb90eaca2cf\", [1, 10], [1, 10]]", "cuda -keys=cuda,gpu -arch=sm_86 -max_num_threads=1024 -thread_warp_size=32", [-1, 16, 64, 49152, 2147483647, 1024, 8, 32], "", 0, []], [[], [["CI", 2], ["FU", 4, [0, 1]], ["AN", 4, 0, 6], ["AN", 3, 0, 6], ["AN", 1, 0, 6], ["PR", 1, 0, "auto_unroll_max_step$0"], ["PR", 3, 0, "auto_unroll_max_step$0"]]]], "r": [[4.78716e-06], 0, 1.24152, 1756345230], "v": "v0.6"}
{"i": [["[\"7d79c516e212fe1d73f5dbb90eaca2cf\", [1, 10], [1, 10]]", "cuda -keys=cuda,gpu -arch=sm_86 -max_num_threads=1024 -thread_warp_size=32", [-1, 16, 64, 49152, 2147483647, 1024, 8, 32], "", 0, []], [[], [["CI", 2], ["FU", 4, [0, 1]], ["AN", 4, 0, 6], ["AN", 3, 0, 6], ["AN", 1, 0, 6], ["PR", 1, 0, "auto_unroll_max_step$512"], ["PR", 3, 0, "auto_unroll_max_step$1024"]]]], "r": [[4.7868e-06], 0, 1.2846, 1756345231], "v": "v0.6"}
{"i": [["[\"7d79c516e212fe1d73f5dbb90eaca2cf\", [1, 10], [1, 10]]", "cuda -keys=cuda,gpu -arch=sm_86 -max_num_threads=1024 -thread_warp_size=32", [-1, 16, 64, 49152, 2147483647, 1024, 8, 32], "", 0, []], [[], [["CI", 2], ["FU", 4, [0, 1]], ["AN", 4, 0, 6], ["AN", 3, 0, 6], ["AN", 1, 0, 6], ["PR", 1, 0, "auto_unroll_max_step$16"], ["PR", 3, 0, "auto_unroll_max_step$16"]]]], "r": [[4.78645e-06], 0, 1.22309, 1756345231], "v": "v0.6"}
{"i": [["[\"7d79c516e212fe1d73f5dbb90eaca2cf\", [1, 10], [1, 10]]", "cuda -keys=cuda,gpu -arch=sm_86 -max_num_threads=1024 -thread_warp_size=32", [-1, 16, 64, 49152, 2147483647, 1024, 8, 32], "", 0, []], [[], [["CI", 2], ["FU", 4, [0, 1]], ["AN", 4, 0, 6], ["AN", 3, 0, 6], ["AN", 1, 0, 6], ["PR", 1, 0, "auto_unroll_max_step$512"], ["PR", 3, 0, "auto_unroll_max_step$16"]]]], "r": [[4.7871e-06], 0, 1.24646, 1756345232], "v": "v0.6"}
{"i": [["[\"7d79c516e212fe1d73f5dbb90eaca2cf\", [1, 10], [1, 10]]", "cuda -keys=cuda,gpu -arch=sm_86 -max_num_threads=1024 -thread_warp_size=32", [-1, 16, 64, 49152, 2147483647, 1024, 8, 32], "", 0, []], [[], [["CI", 2], ["FU", 4, [0, 1]], ["AN", 4, 0, 6], ["AN", 3, 0, 6], ["AN", 1, 0, 6], ["PR", 1, 0, "auto_unroll_max_step$16"], ["PR", 3, 0, "auto_unroll_max_step$0"]]]], "r": [[4.78681e-06], 0, 1.2293, 1756345233], "v": "v0.6"}
{"i": [["[\"7d79c516e212fe1d73f5dbb90eaca2cf\", [1, 10], [1, 10]]", "cuda -keys=cuda,gpu -arch=sm_86 -max_num_threads=1024 -thread_warp_size=32", [-1, 16, 64, 49152, 2147483647, 1024, 8, 32], "", 0, []], [[], [["CI", 2], ["FU", 4, [0, 1]], ["AN", 4, 0, 6], ["AN", 3, 0, 6], ["AN", 1, 0, 6], ["PR", 1, 0, "auto_unroll_max_step$0"], ["PR", 3, 0, "auto_unroll_max_step$16"]]]], "r": [[4.78683e-06], 0, 1.21772, 1756345234], "v": "v0.6"}
{"i": [["[\"7d79c516e212fe1d73f5dbb90eaca2cf\", [1, 10], [1, 10]]", "cuda -keys=cuda,gpu -arch=sm_86 -max_num_threads=1024 -thread_warp_size=32", [-1, 16, 64, 49152, 2147483647, 1024, 8, 32], "", 0, []], [[], [["CI", 2], ["FU", 4, [0, 1]], ["AN", 4, 0, 6], ["AN", 3, 0, 6], ["AN", 1, 0, 6], ["PR", 1, 0, "auto_unroll_max_step$16"], ["PR", 3, 0, "auto_unroll_max_step$64"]]]], "r": [[4.7868e-06], 0, 1.19045, 1756345235], "v": "v0.6"}
{"i": [["[\"7d79c516e212fe1d73f5dbb90eaca2cf\", [1, 10], [1, 10]]", "cuda -keys=cuda,gpu -arch=sm_86 -max_num_threads=1024 -thread_warp_size=32", [-1, 16, 64, 49152, 2147483647, 1024, 8, 32], "", 0, []], [[], [["CI", 2], ["FU", 4, [0, 1]], ["AN", 4, 0, 6], ["AN", 3, 0, 6], ["AN", 1, 0, 6], ["PR", 1, 0, "auto_unroll_max_step$512"], ["PR", 3, 0, "auto_unroll_max_step$0"]]]], "r": [[4.78624e-06], 0, 1.06335, 1756345236], "v": "v0.6"}
{"i": [["[\"7d79c516e212fe1d73f5dbb90eaca2cf\", [1, 10], [1, 10]]", "cuda -keys=cuda,gpu -arch=sm_86 -max_num_threads=1024 -thread_warp_size=32", [-1, 16, 64, 49152, 2147483647, 1024, 8, 32], "", 0, []], [[], [["CI", 2], ["FU", 4, [0, 1]], ["AN", 4, 0, 6], ["AN", 3, 0, 6], ["AN", 1, 0, 6], ["PR", 1, 0, "auto_unroll_max_step$1024"], ["PR", 3, 0, "auto_unroll_max_step$0"]]]], "r": [[4.78619e-06], 0, 1.23641, 1756345237], "v": "v0.6"}
{"i": [["[\"7d79c516e212fe1d73f5dbb90eaca2cf\", [1, 10], [1, 10]]", "cuda -keys=cuda,gpu -arch=sm_86 -max_num_threads=1024 -thread_warp_size=32", [-1, 16, 64, 49152, 2147483647, 1024, 8, 32], "", 0, []], [[], [["CI", 2], ["FU", 4, [0, 1]], ["AN", 4, 0, 6], ["AN", 3, 0, 6], ["AN", 1, 0, 6], ["PR", 1, 0, "auto_unroll_max_step$1024"], ["PR", 3, 0, "auto_unroll_max_step$512"]]]], "r": [[4.78613e-06], 0, 1.2166, 1756345237], "v": "v0.6"}
{"i": [["[\"7d79c516e212fe1d73f5dbb90eaca2cf\", [1, 10], [1, 10]]", "cuda -keys=cuda,gpu -arch=sm_86 -max_num_threads=1024 -thread_warp_size=32", [-1, 16, 64, 49152, 2147483647, 1024, 8, 32], "", 0, []], [[], [["CI", 2], ["FU", 4, [0, 1]], ["AN", 4, 0, 6], ["AN", 3, 0, 6], ["AN", 1, 0, 6], ["PR", 1, 0, "auto_unroll_max_step$64"], ["PR", 3, 0, "auto_unroll_max_step$0"]]]], "r": [[4.78635e-06], 0, 1.1441, 1756345238], "v": "v0.6"}
{"i": [["[\"7d79c516e212fe1d73f5dbb90eaca2cf\", [1, 10], [1, 10]]", "cuda -keys=cuda,gpu -arch=sm_86 -max_num_threads=1024 -thread_warp_size=32", [-1, 16, 64, 49152, 2147483647, 1024, 8, 32], "", 0, []], [[], [["CI", 2], ["FU", 4, [0, 1]], ["AN", 4, 0, 6], ["AN", 3, 0, 6], ["AN", 1, 0, 6], ["PR", 1, 0, "auto_unroll_max_step$1024"], ["PR", 3, 0, "auto_unroll_max_step$64"]]]], "r": [[4.78617e-06], 0, 1.15516, 1756345239], "v": "v0.6"}
{"i": [["[\"7d79c516e212fe1d73f5dbb90eaca2cf\", [1, 10], [1, 10]]", "cuda -keys=cuda,gpu -arch=sm_86 -max_num_threads=1024 -thread_warp_size=32", [-1, 16, 64, 49152, 2147483647, 1024, 8, 32], "", 0, []], [[], [["CI", 2], ["FU", 4, [0, 1]], ["AN", 4, 0, 6], ["AN", 3, 0, 6], ["AN", 1, 0, 6], ["PR", 1, 0, "auto_unroll_max_step$512"], ["PR", 3, 0, "auto_unroll_max_step$64"]]]], "r": [[4.78643e-06], 0, 1.15962, 1756345240], "v": "v0.6"}
{"i": [["[\"7d79c516e212fe1d73f5dbb90eaca2cf\", [1, 10], [1, 10]]", "cuda -keys=cuda,gpu -arch=sm_86 -max_num_threads=1024 -thread_warp_size=32", [-1, 16, 64, 49152, 2147483647, 1024, 8, 32], "", 0, []], [[], [["CI", 2], ["FU", 4, [0, 1]], ["AN", 4, 0, 6], ["AN", 3, 0, 6], ["AN", 1, 0, 6], ["PR", 1, 0, "auto_unroll_max_step$1024"], ["PR", 3, 0, "auto_unroll_max_step$16"]]]], "r": [[4.78654e-06], 0, 1.17266, 1756345241], "v": "v0.6"}
{"i": [["[\"7d79c516e212fe1d73f5dbb90eaca2cf\", [1, 10], [1, 10]]", "cuda -keys=cuda,gpu -arch=sm_86 -max_num_threads=1024 -thread_warp_size=32", [-1, 16, 64, 49152, 2147483647, 1024, 8, 32], "", 0, []], [[], [["CI", 2], ["FU", 4, [0, 1]], ["AN", 4, 0, 6], ["AN", 3, 0, 6], ["AN", 1, 0, 6], ["PR", 1, 0, "auto_unroll_max_step$16"], ["PR", 3, 0, "auto_unroll_max_step$1024"]]]], "r": [[4.7864e-06], 0, 1.12148, 1756345242], "v": "v0.6"}
{"i": [["[\"7d79c516e212fe1d73f5dbb90eaca2cf\", [1, 10], [1, 10]]", "cuda -keys=cuda,gpu -arch=sm_86 -max_num_threads=1024 -thread_warp_size=32", [-1, 16, 64, 49152, 2147483647, 1024, 8, 32], "", 0, []], [[], [["CI", 2], ["FU", 4, [0, 1]], ["AN", 4, 0, 6], ["AN", 3, 0, 6], ["AN", 1, 0, 6], ["PR", 1, 0, "auto_unroll_max_step$64"], ["PR", 3, 0, "auto_unroll_max_step$64"]]]], "r": [[4.78662e-06], 0, 1.11093, 1756345243], "v": "v0.6"}
{"i": [["[\"7d79c516e212fe1d73f5dbb90eaca2cf\", [1, 10], [1, 10]]", "cuda -keys=cuda,gpu -arch=sm_86 -max_num_threads=1024 -thread_warp_size=32", [-1, 16, 64, 49152, 2147483647, 1024, 8, 32], "", 0, []], [[], [["CI", 2], ["FU", 4, [0, 1]], ["AN", 4, 0, 6], ["AN", 3, 0, 6], ["AN", 1, 0, 6], ["PR", 1, 0, "auto_unroll_max_step$64"], ["PR", 3, 0, "auto_unroll_max_step$1024"]]]], "r": [[4.78673e-06], 0, 1.11096, 1756345243], "v": "v0.6"}
{"i": [["[\"7d79c516e212fe1d73f5dbb90eaca2cf\", [1, 10], [1, 10]]", "cuda -keys=cuda,gpu -arch=sm_86 -max_num_threads=1024 -thread_warp_size=32", [-1, 16, 64, 49152, 2147483647, 1024, 8, 32], "", 0, []], [[], [["CI", 2], ["FU", 4, [0, 1]], ["AN", 4, 0, 6], ["AN", 3, 0, 6], ["AN", 1, 0, 6], ["PR", 1, 0, "auto_unroll_max_step$0"], ["PR", 3, 0, "auto_unroll_max_step$64"]]]], "r": [[4.78697e-06], 0, 1.08498, 1756345244], "v": "v0.6"}
{"i": [["[\"7d79c516e212fe1d73f5dbb90eaca2cf\", [1, 10], [1, 10]]", "cuda -keys=cuda,gpu -arch=sm_86 -max_num_threads=1024 -thread_warp_size=32", [-1, 16, 64, 49152, 2147483647, 1024, 8, 32], "", 0, []], [[], [["CI", 2], ["FU", 4, [0, 1]], ["AN", 4, 0, 6], ["AN", 3, 0, 6], ["AN", 1, 0, 6], ["PR", 1, 0, "auto_unroll_max_step$0"], ["PR", 3, 0, "auto_unroll_max_step$1024"]]]], "r": [[4.78695e-06], 0, 1.13235, 1756345245], "v": "v0.6"}
{"i": [["[\"0c9162aac562ffde85f72dea8ab02a83\", [1, 32, 32, 3], [6, 6, 16, 3], [1, 1, 1, 16], [1, 32, 32, 16]]", "cuda -keys=cuda,gpu -arch=sm_86 -max_num_threads=1024 -thread_warp_size=32", [-1, 16, 64, 49152, 2147483647, 1024, 8, 32], "", 0, []], [[], [["CI", 11], ["CI", 9], ["AN", 8, 0, 1], ["AN", 8, 1, 1], ["SP", 8, 2, 64, [32], 1], ["SP", 8, 4, 16, [2], 1], ["AN", 8, 6, 1], ["AN", 8, 7, 1], ["RE", 8, [2, 4, 3, 5, 0, 1, 6, 7]], ["CI", 7], ["CHW", 6, "local"], ["SP", 6, 0, 6, [1, 2, 1, 3], 1], ["SP", 6, 5, 6, [1, 1, 1, 2], 1], ["SP", 6, 10, 64, [2, 8, 4, 1], 1], ["SP", 6, 15, 16, [4, 2, 2, 1], 1], ["SP", 6, 20, 3, [1, 1], 1], ["RE", 6, [0, 5, 10, 15, 1, 6, 11, 16, 2, 7, 12, 17, 20, 21, 3, 8, 13, 18, 22, 4, 9, 14, 19]], ["FSP", 7, 0, 11, 3], ["FSP", 7, 4, 12, 3], ["FSP", 7, 8, 13, 3], ["FSP", 7, 12, 14, 3], ["RE", 7, [0, 4, 8, 12, 1, 5, 9, 13, 2, 6, 10, 14, 3, 7, 11, 15]], ["CA", 6, 7, 11], ["CHR", 5, "shared", [6]], ["CA", 6, 7, 12], ["CHR", 4, "shared", [7]], ["CA", 5, 8, 12], ["AN", 4, 0, 1], ["AN", 4, 1, 1], ["SP", 4, 2, 64, [16], 1], ["SP", 4, 4, 3, [1], 1], ["AN", 4, 6, 1], ["AN", 4, 7, 1], ["RE", 4, [2, 4, 3, 5, 0, 1, 6, 7]], ["CI", 3], ["CA", 2, 4, 3], ["CI", 1], ["FU", 15, [0, 1, 2, 3]], ["SP", 15, 0, 16384, [32], 1], ["AN", 15, 0, 5], ["AN", 15, 1, 6], ["FU", 11, [0, 1, 2, 3]], ["SP", 11, 0, 1024, [32], 1], ["AN", 11, 0, 5], ["AN", 11, 1, 6], ["FU", 9, [0, 1, 2, 3]], ["AN", 9, 0, 5], ["FU", 9, [1, 2, 3, 4]], ["AN", 9, 1, 4], ["FU", 9, [2, 3, 4, 5]], ["AN", 9, 2, 6], ["FU", 7, [0, 1, 2, 3]], ["SP", 7, 0, 12, [1], 1], ["AN", 7, 1, 2], ["FFSP", 7, 0, [14, 13, 12, 11], 1, 1], ["AN", 7, 1, 6], ["FU", 5, [0, 1, 2, 3]], ["SP", 5, 0, 24, [1], 1], ["AN", 5, 1, 2], ["FFSP", 5, 0, [14, 13, 12, 11], 1, 1], ["AN", 5, 1, 6], ["FU", 4, [0, 1, 2, 3]], ["SP", 4, 0, 192, [64], 1], ["AN", 4, 0, 5], ["AN", 4, 1, 6], ["PR", 4, 0, "auto_unroll_max_step$64"], ["PR", 8, 0, "auto_unroll_max_step$512"], ["PR", 11, 0, "auto_unroll_max_step$0"]]]], "r": [[2.31725e-05], 0, 7.6898, 1756345340], "v": "v0.6"}
{"i": [["[\"0c9162aac562ffde85f72dea8ab02a83\", [1, 32, 32, 3], [6, 6, 16, 3], [1, 1, 1, 16], [1, 32, 32, 16]]", "cuda -keys=cuda,gpu -arch=sm_86 -max_num_threads=1024 -thread_warp_size=32", [-1, 16, 64, 49152, 2147483647, 1024, 8, 32], "", 0, []], [[], [["CI", 11], ["CI", 9], ["AN", 8, 0, 1], ["AN", 8, 1, 1], ["SP", 8, 2, 64, [8], 1], ["SP", 8, 4, 16, [1], 1], ["AN", 8, 6, 1], ["AN", 8, 7, 1], ["RE", 8, [2, 4, 3, 5, 0, 1, 6, 7]], ["CI", 7], ["CHW", 6, "local"], ["SP", 6, 0, 6, [1, 2, 3, 1], 1], ["SP", 6, 5, 6, [2, 1, 3, 1], 1], ["SP", 6, 10, 64, [2, 16, 1, 2], 1], ["SP", 6, 15, 16, [2, 8, 1, 1], 1], ["SP", 6, 20, 3, [3, 1], 1], ["RE", 6, [0, 5, 10, 15, 1, 6, 11, 16, 2, 7, 12, 17, 20, 21, 3, 8, 13, 18, 22, 4, 9, 14, 19]], ["FSP", 7, 0, 11, 3], ["FSP", 7, 4, 12, 3], ["FSP", 7, 8, 13, 3], ["FSP", 7, 12, 14, 3], ["RE", 7, [0, 4, 8, 12, 1, 5, 9, 13, 2, 6, 10, 14, 3, 7, 11, 15]], ["CA", 6, 7, 11], ["CHR", 5, "shared", [6]], ["CA", 6, 7, 12], ["CHR", 4, "shared", [7]], ["CA", 5, 8, 12], ["AN", 4, 0, 1], ["AN", 4, 1, 1], ["SP", 4, 2, 64, [4], 1], ["SP", 4, 4, 3, [3], 1], ["AN", 4, 6, 1], ["AN", 4, 7, 1], ["RE", 4, [2, 4, 3, 5, 0, 1, 6, 7]], ["CI", 3], ["CA", 2, 4, 3], ["CI", 1], ["FU", 15, [0, 1, 2, 3]], ["SP", 15, 0, 16384, [32], 1], ["AN", 15, 0, 5], ["AN", 15, 1, 6], ["FU", 11, [0, 1, 2, 3]], ["SP", 11, 0, 1024, [64], 1], ["AN", 11, 0, 5], ["AN", 11, 1, 6], ["FU", 9, [0, 1, 2, 3]], ["AN", 9, 0, 5], ["FU", 9, [1, 2, 3, 4]], ["AN", 9, 1, 4], ["FU", 9, [2, 3, 4, 5]], ["AN", 9, 2, 6], ["FU", 7, [0, 1, 2, 3]], ["SP", 7, 0, 27, [1], 1], ["AN", 7, 1, 2], ["FFSP", 7, 0, [14, 13, 12, 11], 1, 1], ["AN", 7, 1, 6], ["FU", 5, [0, 1, 2, 3]], ["SP", 5, 0, 54, [1], 1], ["AN", 5, 1, 2], ["FFSP", 5, 0, [14, 13, 12, 11], 1, 1], ["AN", 5, 1, 6], ["FU", 4, [0, 1, 2, 3]], ["SP", 4, 0, 192, [32], 1], ["AN", 4, 0, 5], ["AN", 4, 1, 6], ["PR", 4, 0, "auto_unroll_max_step$512"], ["PR", 8, 0, "auto_unroll_max_step$512"], ["PR", 11, 0, "auto_unroll_max_step$64"]]]], "r": [[1.2935e-05], 0, 7.71242, 1756345341], "v": "v0.6"}
{"i": [["[\"0c9162aac562ffde85f72dea8ab02a83\", [1, 32, 32, 3], [6, 6, 16, 3], [1, 1, 1, 16], [1, 32, 32, 16]]", "cuda -keys=cuda,gpu -arch=sm_86 -max_num_threads=1024 -thread_warp_size=32", [-1, 16, 64, 49152, 2147483647, 1024, 8, 32], "", 0, []], [[], [["CI", 11], ["CI", 9], ["AN", 8, 0, 1], ["AN", 8, 1, 1], ["SP", 8, 2, 64, [4], 1], ["SP", 8, 4, 16, [4], 1], ["AN", 8, 6, 1], ["AN", 8, 7, 1], ["RE", 8, [2, 4, 3, 5, 0, 1, 6, 7]], ["CI", 7], ["CHW", 6, "local"], ["SP", 6, 0, 6, [1, 1, 2, 3], 1], ["SP", 6, 5, 6, [1, 3, 1, 2], 1], ["SP", 6, 10, 64, [2, 4, 1, 1], 1], ["SP", 6, 15, 16, [1, 4, 1, 2], 1], ["SP", 6, 20, 3, [1, 1], 1], ["RE", 6, [0, 5, 10, 15, 1, 6, 11, 16, 2, 7, 12, 17, 20, 21, 3, 8, 13, 18, 22, 4, 9, 14, 19]], ["FSP", 7, 0, 11, 3], ["FSP", 7, 4, 12, 3], ["FSP", 7, 8, 13, 3], ["FSP", 7, 12, 14, 3], ["RE", 7, [0, 4, 8, 12, 1, 5, 9, 13, 2, 6, 10, 14, 3, 7, 11, 15]], ["CA", 6, 7, 11], ["CHR", 5, "shared", [6]], ["CA", 6, 7, 12], ["CHR", 4, "shared", [7]], ["CA", 5, 8, 12], ["AN", 4, 0, 1], ["AN", 4, 1, 1], ["SP", 4, 2, 64, [1], 1], ["SP", 4, 4, 3, [3], 1], ["AN", 4, 6, 1], ["AN", 4, 7, 1], ["RE", 4, [2, 4, 3, 5, 0, 1, 6, 7]], ["CI", 3], ["CA", 2, 4, 3], ["CI", 1], ["FU", 15, [0, 1, 2, 3]], ["SP", 15, 0, 16384, [32], 1], ["AN", 15, 0, 5], ["AN", 15, 1, 6], ["FU", 11, [0, 1, 2, 3]], ["SP", 11, 0, 1024, [1], 1], ["AN", 11, 0, 5], ["AN", 11, 1, 6], ["FU", 9, [0, 1, 2, 3]], ["AN", 9, 0, 5], ["FU", 9, [1, 2, 3, 4]], ["AN", 9, 1, 4], ["FU", 9, [2, 3, 4, 5]], ["AN", 9, 2, 6], ["FU", 7, [0, 1, 2, 3]], ["SP", 7, 0, 24, [1], 1], ["AN", 7, 1, 2], ["FFSP", 7, 0, [14, 13, 12, 11], 1, 1], ["AN", 7, 1, 6], ["FU", 5, [0, 1, 2, 3]], ["SP", 5, 0, 12, [1], 1], ["AN", 5, 1, 2], ["FFSP", 5, 0, [14, 13, 12, 11], 1, 1], ["AN", 5, 1, 6], ["FU", 4, [0, 1, 2, 3]], ["SP", 4, 0, 192, [32], 1], ["AN", 4, 0, 5], ["AN", 4, 1, 6], ["PR", 4, 0, "auto_unroll_max_step$16"], ["PR", 8, 0, "auto_unroll_max_step$1024"], ["PR", 11, 0, "auto_unroll_max_step$16"]]]], "r": [[9.45749e-06], 0, 5.35788, 1756345342], "v": "v0.6"}
{"i": [["[\"0c9162aac562ffde85f72dea8ab02a83\", [1, 32, 32, 3], [6, 6, 16, 3], [1, 1, 1, 16], [1, 32, 32, 16]]", "cuda -keys=cuda,gpu -arch=sm_86 -max_num_threads=1024 -thread_warp_size=32", [-1, 16, 64, 49152, 2147483647, 1024, 8, 32], "", 0, []], [[], [["CI", 11], ["CI", 9], ["AN", 8, 0, 1], ["AN", 8, 1, 1], ["SP", 8, 2, 64, [32], 1], ["SP", 8, 4, 16, [2], 1], ["AN", 8, 6, 1], ["AN", 8, 7, 1], ["RE", 8, [2, 4, 3, 5, 0, 1, 6, 7]], ["CI", 7], ["CHW", 6, "local"], ["SP", 6, 0, 6, [1, 1, 1, 1], 1], ["SP", 6, 5, 6, [1, 3, 1, 2], 1], ["SP", 6, 10, 64, [8, 4, 1, 1], 1], ["SP", 6, 15, 16, [1, 8, 1, 2], 1], ["SP", 6, 20, 3, [1, 3], 1], ["RE", 6, [0, 5, 10, 15, 1, 6, 11, 16, 2, 7, 12, 17, 20, 21, 3, 8, 13, 18, 22, 4, 9, 14, 19]], ["FSP", 7, 0, 11, 3], ["FSP", 7, 4, 12, 3], ["FSP", 7, 8, 13, 3], ["FSP", 7, 12, 14, 3], ["RE", 7, [0, 4, 8, 12, 1, 5, 9, 13, 2, 6, 10, 14, 3, 7, 11, 15]], ["CA", 6, 7, 11], ["CHR", 5, "shared", [6]], ["CA", 6, 7, 12], ["CHR", 4, "shared", [7]], ["CA", 5, 8, 12], ["AN", 4, 0, 1], ["AN", 4, 1, 1], ["SP", 4, 2, 64, [1], 1], ["SP", 4, 4, 3, [1], 1], ["AN", 4, 6, 1], ["AN", 4, 7, 1], ["RE", 4, [2, 4, 3, 5, 0, 1, 6, 7]], ["CI", 3], ["CA", 2, 4, 3], ["CI", 1], ["FU", 15, [0, 1, 2, 3]], ["SP", 15, 0, 16384, [32], 1], ["AN", 15, 0, 5], ["AN", 15, 1, 6], ["FU", 11, [0, 1, 2, 3]], ["SP", 11, 0, 1024, [32], 1], ["AN", 11, 0, 5], ["AN", 11, 1, 6], ["FU", 9, [0, 1, 2, 3]], ["AN", 9, 0, 5], ["FU", 9, [1, 2, 3, 4]], ["AN", 9, 1, 4], ["FU", 9, [2, 3, 4, 5]], ["AN", 9, 2, 6], ["FU", 7, [0, 1, 2, 3]], ["SP", 7, 0, 12, [3], 1], ["AN", 7, 1, 2], ["FFSP", 7, 0, [14, 13, 12, 11], 1, 1], ["AN", 7, 1, 6], ["FU", 5, [0, 1, 2, 3]], ["SP", 5, 0, 6, [1], 1], ["AN", 5, 1, 2], ["FFSP", 5, 0, [14, 13, 12, 11], 1, 1], ["AN", 5, 1, 6], ["FU", 4, [0, 1, 2, 3]], ["SP", 4, 0, 192, [16], 1], ["AN", 4, 0, 5], ["AN", 4, 1, 6], ["PR", 4, 0, "auto_unroll_max_step$0"], ["PR", 8, 0, "auto_unroll_max_step$1024"], ["PR", 11, 0, "auto_unroll_max_step$512"]]]], "r": [[8.32144e-06], 0, 5.26641, 1756345343], "v": "v0.6"}
{"i": [["[\"0c9162aac562ffde85f72dea8ab02a83\", [1, 32, 32, 3], [6, 6, 16, 3], [1, 1, 1, 16], [1, 32, 32, 16]]", "cuda -keys=cuda,gpu -arch=sm_86 -max_num_threads=1024 -thread_warp_size=32", [-1, 16, 64, 49152, 2147483647, 1024, 8, 32], "", 0, []], [[], [["CI", 11], ["CI", 9], ["AN", 8, 0, 1], ["AN", 8, 1, 1], ["SP", 8, 2, 64, [32], 1], ["SP", 8, 4, 16, [8], 1], ["AN", 8, 6, 1], ["AN", 8, 7, 1], ["RE", 8, [2, 4, 3, 5, 0, 1, 6, 7]], ["CI", 7], ["CHW", 6, "local"], ["SP", 6, 0, 6, [1, 6, 1, 1], 1], ["SP", 6, 5, 6, [1, 6, 1, 1], 1], ["SP", 6, 10, 64, [2, 2, 2, 4], 1], ["SP", 6, 15, 16, [1, 1, 8, 2], 1], ["SP", 6, 20, 3, [1, 1], 1], ["RE", 6, [0, 5, 10, 15, 1, 6, 11, 16, 2, 7, 12, 17, 20, 21, 3, 8, 13, 18, 22, 4, 9, 14, 19]], ["FSP", 7, 0, 11, 3], ["FSP", 7, 4, 12, 3], ["FSP", 7, 8, 13, 3], ["FSP", 7, 12, 14, 3], ["RE", 7, [0, 4, 8, 12, 1, 5, 9, 13, 2, 6, 10, 14, 3, 7, 11, 15]], ["CA", 6, 7, 11], ["CHR", 5, "shared", [6]], ["CA", 6, 7, 12], ["CHR", 4, "shared", [7]], ["CA", 5, 8, 12], ["AN", 4, 0, 1], ["AN", 4, 1, 1], ["SP", 4, 2, 64, [16], 1], ["SP", 4, 4, 3, [3], 1], ["AN", 4, 6, 1], ["AN", 4, 7, 1], ["RE", 4, [2, 4, 3, 5, 0, 1, 6, 7]], ["CI", 3], ["CA", 2, 4, 3], ["CI", 1], ["FU", 15, [0, 1, 2, 3]], ["SP", 15, 0, 16384, [32], 1], ["AN", 15, 0, 5], ["AN", 15, 1, 6], ["FU", 11, [0, 1, 2, 3]], ["SP", 11, 0, 1024, [32], 1], ["AN", 11, 0, 5], ["AN", 11, 1, 6], ["FU", 9, [0, 1, 2, 3]], ["AN", 9, 0, 5], ["FU", 9, [1, 2, 3, 4]], ["AN", 9, 1, 4], ["FU", 9, [2, 3, 4, 5]], ["AN", 9, 2, 6], ["FU", 7, [0, 1, 2, 3]], ["SP", 7, 0, 16, [1], 1], ["AN", 7, 1, 2], ["FFSP", 7, 0, [14, 13, 12, 11], 1, 1], ["AN", 7, 1, 6], ["FU", 5, [0, 1, 2, 3]], ["SP", 5, 0, 8, [1], 1], ["AN", 5, 1, 2], ["FFSP", 5, 0, [14, 13, 12, 11], 1, 1], ["AN", 5, 1, 6], ["FU", 4, [0, 1, 2, 3]], ["SP", 4, 0, 192, [32], 1], ["AN", 4, 0, 5], ["AN", 4, 1, 6], ["PR", 4, 0, "auto_unroll_max_step$64"], ["PR", 8, 0, "auto_unroll_max_step$1024"], ["PR", 11, 0, "auto_unroll_max_step$16"]]]], "r": [[2.73436e-05], 0, 6.7623, 1756345343], "v": "v0.6"}
{"i": [["[\"0c9162aac562ffde85f72dea8ab02a83\", [1, 32, 32, 3], [6, 6, 16, 3], [1, 1, 1, 16], [1, 32, 32, 16]]", "cuda -keys=cuda,gpu -arch=sm_86 -max_num_threads=1024 -thread_warp_size=32", [-1, 16, 64, 49152, 2147483647, 1024, 8, 32], "", 0, []], [[], [["CI", 11], ["CI", 9], ["AN", 8, 0, 1], ["AN", 8, 1, 1], ["SP", 8, 2, 64, [64], 1], ["SP", 8, 4, 16, [4], 1], ["AN", 8, 6, 1], ["AN", 8, 7, 1], ["RE", 8, [2, 4, 3, 5, 0, 1, 6, 7]], ["CI", 7], ["CHW", 6, "local"], ["SP", 6, 0, 6, [1, 1, 3, 1], 1], ["SP", 6, 5, 6, [1, 3, 1, 2], 1], ["SP", 6, 10, 64, [1, 8, 1, 4], 1], ["SP", 6, 15, 16, [4, 4, 1, 1], 1], ["SP", 6, 20, 3, [3, 1], 1], ["RE", 6, [0, 5, 10, 15, 1, 6, 11, 16, 2, 7, 12, 17, 20, 21, 3, 8, 13, 18, 22, 4, 9, 14, 19]], ["FSP", 7, 0, 11, 3], ["FSP", 7, 4, 12, 3], ["FSP", 7, 8, 13, 3], ["FSP", 7, 12, 14, 3], ["RE", 7, [0, 4, 8, 12, 1, 5, 9, 13, 2, 6, 10, 14, 3, 7, 11, 15]], ["CA", 6, 7, 11], ["CHR", 5, "shared", [6]], ["CA", 6, 7, 12], ["CHR", 4, "shared", [7]], ["CA", 5, 8, 12], ["AN", 4, 0, 1], ["AN", 4, 1, 1], ["SP", 4, 2, 64, [32], 1], ["SP", 4, 4, 3, [3], 1], ["AN", 4, 6, 1], ["AN", 4, 7, 1], ["RE", 4, [2, 4, 3, 5, 0, 1, 6, 7]], ["CI", 3], ["CA", 2, 4, 3], ["CI", 1], ["FU", 15, [0, 1, 2, 3]], ["SP", 15, 0, 16384, [32], 1], ["AN", 15, 0, 5], ["AN", 15, 1, 6], ["FU", 11, [0, 1, 2, 3]], ["SP", 11, 0, 1024, [32], 1], ["AN", 11, 0, 5], ["AN", 11, 1, 6], ["FU", 9, [0, 1, 2, 3]], ["AN", 9, 0, 5], ["FU", 9, [1, 2, 3, 4]], ["AN", 9, 1, 4], ["FU", 9, [2, 3, 4, 5]], ["AN", 9, 2, 6], ["FU", 7, [0, 1, 2, 3]], ["SP", 7, 0, 9, [1], 1], ["AN", 7, 1, 2], ["FFSP", 7, 0, [14, 13, 12, 11], 1, 1], ["AN", 7, 1, 6], ["FU", 5, [0, 1, 2, 3]], ["SP", 5, 0, 36, [1], 1], ["AN", 5, 1, 2], ["FFSP", 5, 0, [14, 13, 12, 11], 1, 1], ["AN", 5, 1, 6], ["FU", 4, [0, 1, 2, 3]], ["SP", 4, 0, 192, [32], 1], ["AN", 4, 0, 5], ["AN", 4, 1, 6], ["PR", 4, 0, "auto_unroll_max_step$16"], ["PR", 8, 0, "auto_unroll_max_step$512"], ["PR", 11, 0, "auto_unroll_max_step$512"]]]], "r": [[9.92721e-06], 0, 5.61847, 1756345344], "v": "v0.6"}
{"i": [["[\"0c9162aac562ffde85f72dea8ab02a83\", [1, 32, 32, 3], [6, 6, 16, 3], [1, 1, 1, 16], [1, 32, 32, 16]]", "cuda -keys=cuda,gpu -arch=sm_86 -max_num_threads=1024 -thread_warp_size=32", [-1, 16, 64, 49152, 2147483647, 1024, 8, 32], "", 0, []], [[], [["CI", 11], ["CI", 9], ["AN", 8, 0, 1], ["AN", 8, 1, 1], ["SP", 8, 2, 64, [2], 1], ["SP", 8, 4, 16, [8], 1], ["AN", 8, 6, 1], ["AN", 8, 7, 1], ["RE", 8, [2, 4, 3, 5, 0, 1, 6, 7]], ["CI", 7], ["CHW", 6, "local"], ["SP", 6, 0, 6, [1, 3, 1, 1], 1], ["SP", 6, 5, 6, [1, 2, 3, 1], 1], ["SP", 6, 10, 64, [4, 8, 1, 2], 1], ["SP", 6, 15, 16, [1, 4, 2, 1], 1], ["SP", 6, 20, 3, [1, 1], 1], ["RE", 6, [0, 5, 10, 15, 1, 6, 11, 16, 2, 7, 12, 17, 20, 21, 3, 8, 13, 18, 22, 4, 9, 14, 19]], ["FSP", 7, 0, 11, 3], ["FSP", 7, 4, 12, 3], ["FSP", 7, 8, 13, 3], ["FSP", 7, 12, 14, 3], ["RE", 7, [0, 4, 8, 12, 1, 5, 9, 13, 2, 6, 10, 14, 3, 7, 11, 15]], ["CA", 6, 7, 11], ["CHR", 5, "shared", [6]], ["CA", 6, 7, 12], ["CHR", 4, "shared", [7]], ["CA", 5, 8, 12], ["AN", 4, 0, 1], ["AN", 4, 1, 1], ["SP", 4, 2, 64, [64], 1], ["SP", 4, 4, 3, [1], 1], ["AN", 4, 6, 1], ["AN", 4, 7, 1], ["RE", 4, [2, 4, 3, 5, 0, 1, 6, 7]], ["CI", 3], ["CA", 2, 4, 3], ["CI", 1], ["FU", 15, [0, 1, 2, 3]], ["SP", 15, 0, 16384, [32], 1], ["AN", 15, 0, 5], ["AN", 15, 1, 6], ["FU", 11, [0, 1, 2, 3]], ["SP", 11, 0, 1024, [32], 1], ["AN", 11, 0, 5], ["AN", 11, 1, 6], ["FU", 9, [0, 1, 2, 3]], ["AN", 9, 0, 5], ["FU", 9, [1, 2, 3, 4]], ["AN", 9, 1, 4], ["FU", 9, [2, 3, 4, 5]], ["AN", 9, 2, 6], ["FU", 7, [0, 1, 2, 3]], ["SP", 7, 0, 3, [1], 1], ["AN", 7, 1, 2], ["FFSP", 7, 0, [14, 13, 12, 11], 1, 1], ["AN", 7, 1, 6], ["FU", 5, [0, 1, 2, 3]], ["SP", 5, 0, 6, [1], 1], ["AN", 5, 1, 2], ["FFSP", 5, 0, [14, 13, 12, 11], 1, 1], ["AN", 5, 1, 6], ["FU", 4, [0, 1, 2, 3]], ["SP", 4, 0, 192, [32], 1], ["AN", 4, 0, 5], ["AN", 4, 1, 6], ["PR", 4, 0, "auto_unroll_max_step$512"], ["PR", 8, 0, "auto_unroll_max_step$512"], ["PR", 11, 0, "auto_unroll_max_step$64"]]]], "r": [[1.04245e-05], 0, 5.47744, 1756345345], "v": "v0.6"}
{"i": [["[\"0c9162aac562ffde85f72dea8ab02a83\", [1, 32, 32, 3], [6, 6, 16, 3], [1, 1, 1, 16], [1, 32, 32, 16]]", "cuda -keys=cuda,gpu -arch=sm_86 -max_num_threads=1024 -thread_warp_size=32", [-1, 16, 64, 49152, 2147483647, 1024, 8, 32], "", 0, []], [[], [["CI", 11], ["CI", 9], ["AN", 8, 0, 1], ["AN", 8, 1, 1], ["SP", 8, 2, 64, [16], 1], ["SP", 8, 4, 16, [8], 1], ["AN", 8, 6, 1], ["AN", 8, 7, 1], ["RE", 8, [2, 4, 3, 5, 0, 1, 6, 7]], ["CI", 7], ["CHW", 6, "local"], ["SP", 6, 0, 6, [1, 3, 2, 1], 1], ["SP", 6, 5, 6, [1, 3, 1, 2], 1], ["SP", 6, 10, 64, [1, 1, 16, 1], 1], ["SP", 6, 15, 16, [1, 8, 1, 1], 1], ["SP", 6, 20, 3, [1, 1], 1], ["RE", 6, [0, 5, 10, 15, 1, 6, 11, 16, 2, 7, 12, 17, 20, 21, 3, 8, 13, 18, 22, 4, 9, 14, 19]], ["FSP", 7, 0, 11, 3], ["FSP", 7, 4, 12, 3], ["FSP", 7, 8, 13, 3], ["FSP", 7, 12, 14, 3], ["RE", 7, [0, 4, 8, 12, 1, 5, 9, 13, 2, 6, 10, 14, 3, 7, 11, 15]], ["CA", 6, 7, 11], ["CHR", 5, "shared", [6]], ["CA", 6, 7, 12], ["CHR", 4, "shared", [7]], ["CA", 5, 8, 12], ["AN", 4, 0, 1], ["AN", 4, 1, 1], ["SP", 4, 2, 64, [1], 1], ["SP", 4, 4, 3, [1], 1], ["AN", 4, 6, 1], ["AN", 4, 7, 1], ["RE", 4, [2, 4, 3, 5, 0, 1, 6, 7]], ["CI", 3], ["CA", 2, 4, 3], ["CI", 1], ["FU", 15, [0, 1, 2, 3]], ["SP", 15, 0, 16384, [32], 1], ["AN", 15, 0, 5], ["AN", 15, 1, 6], ["FU", 11, [0, 1, 2, 3]], ["SP", 11, 0, 1024, [32], 1], ["AN", 11, 0, 5], ["AN", 11, 1, 6], ["FU", 9, [0, 1, 2, 3]], ["AN", 9, 0, 5], ["FU", 9, [1, 2, 3, 4]], ["AN", 9, 1, 4], ["FU", 9, [2, 3, 4, 5]], ["AN", 9, 2, 6], ["FU", 7, [0, 1, 2, 3]], ["SP", 7, 0, 4, [2], 1], ["AN", 7, 1, 2], ["FFSP", 7, 0, [14, 13, 12, 11], 1, 1], ["AN", 7, 1, 6], ["FU", 5, [0, 1, 2, 3]], ["SP", 5, 0, 64, [1], 1], ["AN", 5, 1, 2], ["FFSP", 5, 0, [14, 13, 12, 11], 1, 1], ["AN", 5, 1, 6], ["FU", 4, [0, 1, 2, 3]], ["SP", 4, 0, 192, [32], 1], ["AN", 4, 0, 5], ["AN", 4, 1, 6], ["PR", 4, 0, "auto_unroll_max_step$512"], ["PR", 8, 0, "auto_unroll_max_step$16"], ["PR", 11, 0, "auto_unroll_max_step$512"]]]], "r": [[9.09078e-06], 0, 5.1896, 1756345346], "v": "v0.6"}
{"i": [["[\"0c9162aac562ffde85f72dea8ab02a83\", [1, 32, 32, 3], [6, 6, 16, 3], [1, 1, 1, 16], [1, 32, 32, 16]]", "cuda -keys=cuda,gpu -arch=sm_86 -max_num_threads=1024 -thread_warp_size=32", [-1, 16, 64, 49152, 2147483647, 1024, 8, 32], "", 0, []], [[], [["CI", 11], ["CI", 9], ["AN", 8, 0, 1], ["AN", 8, 1, 1], ["SP", 8, 2, 64, [1], 1], ["SP", 8, 4, 16, [2], 1], ["AN", 8, 6, 1], ["AN", 8, 7, 1], ["RE", 8, [2, 4, 3, 5, 0, 1, 6, 7]], ["CI", 7], ["CHW", 6, "local"], ["SP", 6, 0, 6, [2, 1, 1, 3], 1], ["SP", 6, 5, 6, [1, 3, 1, 2], 1], ["SP", 6, 10, 64, [4, 8, 1, 1], 1], ["SP", 6, 15, 16, [1, 2, 1, 4], 1], ["SP", 6, 20, 3, [3, 1], 1], ["RE", 6, [0, 5, 10, 15, 1, 6, 11, 16, 2, 7, 12, 17, 20, 21, 3, 8, 13, 18, 22, 4, 9, 14, 19]], ["FSP", 7, 0, 11, 3], ["FSP", 7, 4, 12, 3], ["FSP", 7, 8, 13, 3], ["FSP", 7, 12, 14, 3], ["RE", 7, [0, 4, 8, 12, 1, 5, 9, 13, 2, 6, 10, 14, 3, 7, 11, 15]], ["CA", 6, 7, 11], ["CHR", 5, "shared", [6]], ["CA", 6, 7, 12], ["CHR", 4, "shared", [7]], ["CA", 5, 8, 12], ["AN", 4, 0, 1], ["AN", 4, 1, 1], ["SP", 4, 2, 64, [64], 1], ["SP", 4, 4, 3, [1], 1], ["AN", 4, 6, 1], ["AN", 4, 7, 1], ["RE", 4, [2, 4, 3, 5, 0, 1, 6, 7]], ["CI", 3], ["CA", 2, 4, 3], ["CI", 1], ["FU", 15, [0, 1, 2, 3]], ["SP", 15, 0, 16384, [32], 1], ["AN", 15, 0, 5], ["AN", 15, 1, 6], ["FU", 11, [0, 1, 2, 3]], ["SP", 11, 0, 1024, [32], 1], ["AN", 11, 0, 5], ["AN", 11, 1, 6], ["FU", 9, [0, 1, 2, 3]], ["AN", 9, 0, 5], ["FU", 9, [1, 2, 3, 4]], ["AN", 9, 1, 4], ["FU", 9, [2, 3, 4, 5]], ["AN", 9, 2, 6], ["FU", 7, [0, 1, 2, 3]], ["SP", 7, 0, 24, [1], 1], ["AN", 7, 1, 2], ["FFSP", 7, 0, [14, 13, 12, 11], 1, 1], ["AN", 7, 1, 6], ["FU", 5, [0, 1, 2, 3]], ["SP", 5, 0, 6, [1], 1], ["AN", 5, 1, 2], ["FFSP", 5, 0, [14, 13, 12, 11], 1, 1], ["AN", 5, 1, 6], ["FU", 4, [0, 1, 2, 3]], ["SP", 4, 0, 192, [32], 1], ["AN", 4, 0, 5], ["AN", 4, 1, 6], ["PR", 4, 0, "auto_unroll_max_step$512"], ["PR", 8, 0, "auto_unroll_max_step$16"], ["PR", 11, 0, "auto_unroll_max_step$16"]]]], "r": [[1.26415e-05], 0, 5.18643, 1756345347], "v": "v0.6"}
{"i": [["[\"0c9162aac562ffde85f72dea8ab02a83\", [1, 32, 32, 3], [6, 6, 16, 3], [1, 1, 1, 16], [1, 32, 32, 16]]", "cuda -keys=cuda,gpu -arch=sm_86 -max_num_threads=1024 -thread_warp_size=32", [-1, 16, 64, 49152, 2147483647, 1024, 8, 32], "", 0, []], [[], [["CI", 11], ["CI", 9], ["AN", 8, 0, 1], ["AN", 8, 1, 1], ["SP", 8, 2, 64, [2], 1], ["SP", 8, 4, 16, [1], 1], ["AN", 8, 6, 1], ["AN", 8, 7, 1], ["RE", 8, [2, 4, 3, 5, 0, 1, 6, 7]], ["CI", 7], ["CHW", 6, "local"], ["SP", 6, 0, 6, [1, 1, 1, 1], 1], ["SP", 6, 5, 6, [1, 3, 2, 1], 1], ["SP", 6, 10, 64, [1, 8, 1, 8], 1], ["SP", 6, 15, 16, [1, 2, 8, 1], 1], ["SP", 6, 20, 3, [3, 1], 1], ["RE", 6, [0, 5, 10, 15, 1, 6, 11, 16, 2, 7, 12, 17, 20, 21, 3, 8, 13, 18, 22, 4, 9, 14, 19]], ["FSP", 7, 0, 11, 3], ["FSP", 7, 4, 12, 3], ["FSP", 7, 8, 13, 3], ["FSP", 7, 12, 14, 3], ["RE", 7, [0, 4, 8, 12, 1, 5, 9, 13, 2, 6, 10, 14, 3, 7, 11, 15]], ["CA", 6, 7, 11], ["CHR", 5, "shared", [6]], ["CA", 6, 7, 12], ["CHR", 4, "shared", [7]], ["CA", 5, 8, 12], ["AN", 4, 0, 1], ["AN", 4, 1, 1], ["SP", 4, 2, 64, [32], 1], ["SP", 4, 4, 3, [3], 1], ["AN", 4, 6, 1], ["AN", 4, 7, 1], ["RE", 4, [2, 4, 3, 5, 0, 1, 6, 7]], ["CI", 3], ["CA", 2, 4, 3], ["CI", 1], ["FU", 15, [0, 1, 2, 3]], ["SP", 15, 0, 16384, [32], 1], ["AN", 15, 0, 5], ["AN", 15, 1, 6], ["FU", 11, [0, 1, 2, 3]], ["SP", 11, 0, 1024, [32], 1], ["AN", 11, 0, 5], ["AN", 11, 1, 6], ["FU", 9, [0, 1, 2, 3]], ["AN", 9, 0, 5], ["FU", 9, [1, 2, 3, 4]], ["AN", 9, 1, 4], ["FU", 9, [2, 3, 4, 5]], ["AN", 9, 2, 6], ["FU", 7, [0, 1, 2, 3]], ["SP", 7, 0, 48, [1], 1], ["AN", 7, 1, 2], ["FFSP", 7, 0, [14, 13, 12, 11], 1, 1], ["AN", 7, 1, 6], ["FU", 5, [0, 1, 2, 3]], ["SP", 5, 0, 48, [1], 1], ["AN", 5, 1, 2], ["FFSP", 5, 0, [14, 13, 12, 11], 1, 1], ["AN", 5, 1, 6], ["FU", 4, [0, 1, 2, 3]], ["SP", 4, 0, 192, [32], 1], ["AN", 4, 0, 5], ["AN", 4, 1, 6], ["PR", 4, 0, "auto_unroll_max_step$1024"], ["PR", 8, 0, "auto_unroll_max_step$512"], ["PR", 11, 0, "auto_unroll_max_step$512"]]]], "r": [[1.23597e-05], 0, 5.35175, 1756345348], "v": "v0.6"}
{"i": [["[\"0c9162aac562ffde85f72dea8ab02a83\", [1, 32, 32, 3], [6, 6, 16, 3], [1, 1, 1, 16], [1, 32, 32, 16]]", "cuda -keys=cuda,gpu -arch=sm_86 -max_num_threads=1024 -thread_warp_size=32", [-1, 16, 64, 49152, 2147483647, 1024, 8, 32], "", 0, []], [[], [["CI", 11], ["CI", 9], ["AN", 8, 0, 1], ["AN", 8, 1, 1], ["SP", 8, 2, 64, [2], 1], ["SP", 8, 4, 16, [16], 1], ["AN", 8, 6, 1], ["AN", 8, 7, 1], ["RE", 8, [2, 4, 3, 5, 0, 1, 6, 7]], ["CI", 7], ["CHW", 6, "local"], ["SP", 6, 0, 6, [2, 1, 3, 1], 1], ["SP", 6, 5, 6, [1, 1, 1, 2], 1], ["SP", 6, 10, 64, [4, 4, 1, 2], 1], ["SP", 6, 15, 16, [1, 8, 2, 1], 1], ["SP", 6, 20, 3, [1, 3], 1], ["RE", 6, [0, 5, 10, 15, 1, 6, 11, 16, 2, 7, 12, 17, 20, 21, 3, 8, 13, 18, 22, 4, 9, 14, 19]], ["FSP", 7, 0, 11, 3], ["FSP", 7, 4, 12, 3], ["FSP", 7, 8, 13, 3], ["FSP", 7, 12, 14, 3], ["RE", 7, [0, 4, 8, 12, 1, 5, 9, 13, 2, 6, 10, 14, 3, 7, 11, 15]], ["CA", 6, 7, 11], ["CHR", 5, "shared", [6]], ["CA", 6, 7, 12], ["CHR", 4, "shared", [7]], ["CA", 5, 8, 12], ["AN", 4, 0, 1], ["AN", 4, 1, 1], ["SP", 4, 2, 64, [8], 1], ["SP", 4, 4, 3, [1], 1], ["AN", 4, 6, 1], ["AN", 4, 7, 1], ["RE", 4, [2, 4, 3, 5, 0, 1, 6, 7]], ["CI", 3], ["CA", 2, 4, 3], ["CI", 1], ["FU", 15, [0, 1, 2, 3]], ["SP", 15, 0, 16384, [32], 1], ["AN", 15, 0, 5], ["AN", 15, 1, 6], ["FU", 11, [0, 1, 2, 3]], ["SP", 11, 0, 1024, [2], 1], ["AN", 11, 0, 5], ["AN", 11, 1, 6], ["FU", 9, [0, 1, 2, 3]], ["AN", 9, 0, 5], ["FU", 9, [1, 2, 3, 4]], ["AN", 9, 1, 4], ["FU", 9, [2, 3, 4, 5]], ["AN", 9, 2, 6], ["FU", 7, [0, 1, 2, 3]], ["SP", 7, 0, 36, [1], 1], ["AN", 7, 1, 2], ["FFSP", 7, 0, [14, 13, 12, 11], 1, 1], ["AN", 7, 1, 6], ["FU", 5, [0, 1, 2, 3]], ["SP", 5, 0, 36, [1], 1], ["AN", 5, 1, 2], ["FFSP", 5, 0, [14, 13, 12, 11], 1, 1], ["AN", 5, 1, 6], ["FU", 4, [0, 1, 2, 3]], ["SP", 4, 0, 192, [32], 1], ["AN", 4, 0, 5], ["AN", 4, 1, 6], ["PR", 4, 0, "auto_unroll_max_step$64"], ["PR", 8, 0, "auto_unroll_max_step$64"], ["PR", 11, 0, "auto_unroll_max_step$0"]]]], "r": [[9.31614e-06], 0, 6.04793, 1756345349], "v": "v0.6"}
{"i": [["[\"0c9162aac562ffde85f72dea8ab02a83\", [1, 32, 32, 3], [6, 6, 16, 3], [1, 1, 1, 16], [1, 32, 32, 16]]", "cuda -keys=cuda,gpu -arch=sm_86 -max_num_threads=1024 -thread_warp_size=32", [-1, 16, 64, 49152, 2147483647, 1024, 8, 32], "", 0, []], [[], [["CI", 11], ["CI", 9], ["AN", 8, 0, 1], ["AN", 8, 1, 1], ["SP", 8, 2, 64, [4], 1], ["SP", 8, 4, 16, [4], 1], ["AN", 8, 6, 1], ["AN", 8, 7, 1], ["RE", 8, [2, 4, 3, 5, 0, 1, 6, 7]], ["CI", 7], ["CHW", 6, "local"], ["SP", 6, 0, 6, [1, 2, 3, 1], 1], ["SP", 6, 5, 6, [1, 3, 2, 1], 1], ["SP", 6, 10, 64, [1, 2, 2, 8], 1], ["SP", 6, 15, 16, [1, 4, 2, 1], 1], ["SP", 6, 20, 3, [1, 1], 1], ["RE", 6, [0, 5, 10, 15, 1, 6, 11, 16, 2, 7, 12, 17, 20, 21, 3, 8, 13, 18, 22, 4, 9, 14, 19]], ["FSP", 7, 0, 11, 3], ["FSP", 7, 4, 12, 3], ["FSP", 7, 8, 13, 3], ["FSP", 7, 12, 14, 3], ["RE", 7, [0, 4, 8, 12, 1, 5, 9, 13, 2, 6, 10, 14, 3, 7, 11, 15]], ["CA", 6, 7, 11], ["CHR", 5, "shared", [6]], ["CA", 6, 7, 12], ["CHR", 4, "shared", [7]], ["CA", 5, 8, 12], ["AN", 4, 0, 1], ["AN", 4, 1, 1], ["SP", 4, 2, 64, [8], 1], ["SP", 4, 4, 3, [3], 1], ["AN", 4, 6, 1], ["AN", 4, 7, 1], ["RE", 4, [2, 4, 3, 5, 0, 1, 6, 7]], ["CI", 3], ["CA", 2, 4, 3], ["CI", 1], ["FU", 15, [0, 1, 2, 3]], ["SP", 15, 0, 16384, [32], 1], ["AN", 15, 0, 5], ["AN", 15, 1, 6], ["FU", 11, [0, 1, 2, 3]], ["SP", 11, 0, 1024, [32], 1], ["AN", 11, 0, 5], ["AN", 11, 1, 6], ["FU", 9, [0, 1, 2, 3]], ["AN", 9, 0, 5], ["FU", 9, [1, 2, 3, 4]], ["AN", 9, 1, 4], ["FU", 9, [2, 3, 4, 5]], ["AN", 9, 2, 6], ["FU", 7, [0, 1, 2, 3]], ["SP", 7, 0, 12, [1], 1], ["AN", 7, 1, 2], ["FFSP", 7, 0, [14, 13, 12, 11], 1, 1], ["AN", 7, 1, 6], ["FU", 5, [0, 1, 2, 3]], ["SP", 5, 0, 96, [1], 1], ["AN", 5, 1, 2], ["FFSP", 5, 0, [14, 13, 12, 11], 1, 1], ["AN", 5, 1, 6], ["FU", 4, [0, 1, 2, 3]], ["SP", 4, 0, 192, [32], 1], ["AN", 4, 0, 5], ["AN", 4, 1, 6], ["PR", 4, 0, "auto_unroll_max_step$64"], ["PR", 8, 0, "auto_unroll_max_step$0"], ["PR", 11, 0, "auto_unroll_max_step$64"]]]], "r": [[1.07993e-05], 0, 6.93012, 1756345350], "v": "v0.6"}
{"i": [["[\"0c9162aac562ffde85f72dea8ab02a83\", [1, 32, 32, 3], [6, 6, 16, 3], [1, 1, 1, 16], [1, 32, 32, 16]]", "cuda -keys=cuda,gpu -arch=sm_86 -max_num_threads=1024 -thread_warp_size=32", [-1, 16, 64, 49152, 2147483647, 1024, 8, 32], "", 0, []], [[], [["CI", 11], ["CI", 9], ["AN", 8, 0, 1], ["AN", 8, 1, 1], ["SP", 8, 2, 64, [8], 1], ["SP", 8, 4, 16, [2], 1], ["AN", 8, 6, 1], ["AN", 8, 7, 1], ["RE", 8, [2, 4, 3, 5, 0, 1, 6, 7]], ["CI", 7], ["CHW", 6, "local"], ["SP", 6, 0, 6, [1, 2, 1, 3], 1], ["SP", 6, 5, 6, [1, 3, 1, 2], 1], ["SP", 6, 10, 64, [1, 4, 2, 1], 1], ["SP", 6, 15, 16, [8, 2, 1, 1], 1], ["SP", 6, 20, 3, [1, 1], 1], ["RE", 6, [0, 5, 10, 15, 1, 6, 11, 16, 2, 7, 12, 17, 20, 21, 3, 8, 13, 18, 22, 4, 9, 14, 19]], ["FSP", 7, 0, 11, 3], ["FSP", 7, 4, 12, 3], ["FSP", 7, 8, 13, 3], ["FSP", 7, 12, 14, 3], ["RE", 7, [0, 4, 8, 12, 1, 5, 9, 13, 2, 6, 10, 14, 3, 7, 11, 15]], ["CA", 6, 7, 11], ["CHR", 5, "shared", [6]], ["CA", 6, 7, 12], ["CHR", 4, "shared", [7]], ["CA", 5, 8, 12], ["AN", 4, 0, 1], ["AN", 4, 1, 1], ["SP", 4, 2, 64, [16], 1], ["SP", 4, 4, 3, [3], 1], ["AN", 4, 6, 1], ["AN", 4, 7, 1], ["RE", 4, [2, 4, 3, 5, 0, 1, 6, 7]], ["CI", 3], ["CA", 2, 4, 3], ["CI", 1], ["FU", 15, [0, 1, 2, 3]], ["SP", 15, 0, 16384, [32], 1], ["AN", 15, 0, 5], ["AN", 15, 1, 6], ["FU", 11, [0, 1, 2, 3]], ["SP", 11, 0, 1024, [32], 1], ["AN", 11, 0, 5], ["AN", 11, 1, 6], ["FU", 9, [0, 1, 2, 3]], ["AN", 9, 0, 5], ["FU", 9, [1, 2, 3, 4]], ["AN", 9, 1, 4], ["FU", 9, [2, 3, 4, 5]], ["AN", 9, 2, 6], ["FU", 7, [0, 1, 2, 3]], ["SP", 7, 0, 18, [1], 1], ["AN", 7, 1, 2], ["FFSP", 7, 0, [14, 13, 12, 11], 1, 1], ["AN", 7, 1, 6], ["FU", 5, [0, 1, 2, 3]], ["SP", 5, 0, 36, [1], 1], ["AN", 5, 1, 2], ["FFSP", 5, 0, [14, 13, 12, 11], 1, 1], ["AN", 5, 1, 6], ["FU", 4, [0, 1, 2, 3]], ["SP", 4, 0, 192, [32], 1], ["AN", 4, 0, 5], ["AN", 4, 1, 6], ["PR", 4, 0, "auto_unroll_max_step$512"], ["PR", 8, 0, "auto_unroll_max_step$1024"], ["PR", 11, 0, "auto_unroll_max_step$1024"]]]], "r": [[1.02333e-05], 0, 6.0059, 1756345351], "v": "v0.6"}
